6526	ZCL B-LINK BL-LW05-H2F2 Outdoors High-power Signal Enhancement Receiver	152
5723	YAN TuoShi G618 Wifi Signal Amplifiers Receiver	152
5723	GG TuoShi G618 Wifi Signal Amplifiers Receiver	152
12383	GJY VONETS NEW Arrival Wifi Repeater/Extender/Expander MINI300	152
5723	GJY TuoShi G618 Wifi Signal Amplifiers Receiver	152
5723	GG Netcord NW360usb TV £×ireless Fidelity Receiver , Black	152
5723	GJY Netcord NW360usb TV £×ireless Fidelity Receiver , Black	152
6526	ZCL Netcord NW360usb TV £×ireless Fidelity Receiver , Black	152
12383	MCH- VONETS NEW Arrival Wifi Repeater/Extender/Expander MINI300	152
