40091	Manhattan 421560 Notebook Briefcase	256
30263	Tsirtech Cushioned Faux Leather Top, Laptop Lap Desk, Brown - Comfortable Lightweight Plush Material makes Laptop feel weightless!	256
18720	Tecnet TJA-30NC Nylon Carrying Case	256
30263	McKlein USA Elston Nylon Double Compartment Laptop Case - Black	256
4380	Acer Aspire AS1410-8913 11.6-Inch Netbook Carrying Bag Case Classic Series - Dark Blue / Black 	256
16816	"Case Logic - 16"" Professional Notebook & Ipad R Briefcase - Case Logic - 16"" Professional Notebook & Ipad R Briefcasefits Notebooks With Up To 16"" Screens & Ipad R /Tabletdedicated Compartments Pro"	256
4380	RawhideTwists - 800 Items	256
42503	"Professional Carrying Case Briefcase for 15.6"" Notebook"	256
27821	Excellent Customized Colorful Irving Laptop Bag For Men's Gift (17 17.3 Inch) with Hidden Handle and Adjustable Shoulder Strap For Lenovo ThinkPad ASUS Apple DELL acer HP Microsoft SAMSUNG TOSHIBA - CB-17-6088	256
1498	Black Men's Genuine Leather Briefcase Bag / Handbag，can Put 14-inch Laptop	256
16088	- Black Airport Check-Point-Friendly High Quality Carrying Case Bag for Apple Macbook Pro 13-inch Notebook Laptop (+ 1pc Lost-n-Found ID Tag) ..... Best Seller on Amazon!	256
4380	rooCASE Netbook Carrying Bag for ASUS Eee PC Seashell 1005PR 10.1-Inch White Classic Series - Dark Blue	256
43042	"Kroo Fashion Business Waterproof PVC Leather Briefcase Laptop Case Messenge Shoulder Bag Eco-friendly Green Checkpoint-Friendly for Lenovo IdeaPad U410 +2 14"" Ultrabook 59351634 "	256
40997	JxSar Laptop Case for Macbook Pro 13.3 Inch Material Plastic Texture Frosted Color Sky blue	256
4380	rooCASE 2n1 Netbook Carrying Bag with Wall Charger for Acer Aspire One AO532h-2962 10.1-inch (Versasport Series - Black)	256
42835	Okidata 52113701 LIFE EXPECTANCY OF UP TO 15,000 PAGES, CONTINUOUS PRINT AT 5% DENSITY.	256
11272	"Mobile Edge Select Computer Briefcase - 15.6""PC / 17"" MacBook Pro"	256
42383	HP Mini 110-3000 10.1 Inch Netbook Laptop Hard Nylon Case with External Micro Suede Pocket, Color Black / Red + NuVur  Keychain (ND10LXR1)	256
19160	Clava Canvas Laptop Briefcase	256
43042	Bombata Crocco Laptop Briefcase	256
43042	Red Laptop Bag for 15 inch Sony VAIO VGN-NR220E Notebook + An Ekatomi Hook.	256
811	PORTER STAGE 2way Briefcase (A4 Correspondence) S Gray	256
43042	Dark Blue Laptop Bag for 15 inch Dell Vostro-3450 Notebook + An Ekatomi Hook.	256
42770	Jack Georges Elements Collection Flapover Laptop Briefcase	256
16088	At-Baby Pokemon Custom Durable Case Carrying Bag for Apple Macbook pro Air Notebook Laptop Sleeve Fits All 13 inch Notebook Laptop(Twin sides)	256
4380	rooCASE Netbook Carrying Bag for Lenovo ThinkPad 287635U 11.6-Inch Laptop - Classic Series Black / Dark Blue	256
42835	"Booq Viper Rush for 17"" MacBook Pro Black"	256
2748	Acer Aspire 15.6 inch laptop carrying case for Acer Aspire AS5734Z-4725 AS5532-5509 Acer EX5635-6897 Black-Red 	256
25961	American Shield computer notebook Laptop backpack.ASBZ1630-E1	256
1508	Vintage Leather Bazaar Goat Leather Office Laptop Macbook Messenger Notebook Computer Bags & Cases Office & School Supplies Bag 16 Inch Brown	256
42835	"HP DF Fire Pattern Transparent PC Hard Case for MacBook Pro (Assorted Colors) , Red , 13.3"""	256
4380	MSI Wind U120-020US 10-Inch Netbook Carrying Bag Case Classic Series - Dark Blue / Black 	256
34327	"Coosbo? Matt Rubberized Hard Cover Case for 11"" 13"" Mac Macbook Air (Assorted Color)"	256
43042	Blue Laptop Bag for 15.6 inch Toshiba A205-S5812 Notebook + An Ekatomi Hook.	256
33613	Asus Eee PC 1008P Karim Rashid Collection 10.1 Inch Netbook Laptop Hard Nylon Case With External Micro Suede Pocket, Color Black / Red + Nuvur  Keychain (ND10LXR1)	256
8540	"Solo Premium Leather 15.6"" Laptop Rolling Case , Black, D529"	256
22038	"15"" Men's Genuine Leather Messenger for Laptop, Office, Mackbook School Bag B 123"	256
43042	"Kroo Fashion Business Waterproof PVC Leather Briefcase Laptop Case Messenge Shoulder Bag Eco-friendly Green Checkpoint-Friendly for MSI-14"" Laptop GE40 2OC-008US"	256
4380	rooCASE Netbook Carrying Bag for Samsung NP900X1B-A02 11.6-Inch Notebook - Classic Series Black / Dark Blue	256
36634	Nine States 14 Inch Water Resistant Laptop Bag Computer Shoulder Bag Tablet Briefcase Pink	256
42439	Speck Products SmartShell Case for MacBook Pro Retina 15-Inch, Tennis Ball Green (SPK-A2574)	256
1508	Klasse Men's Laptop Cum Office Folio Tan Leather Laptop Computer Shoulder Bags One Size	256
32137	"Vagabond Traveler 16"" Professional Briefcase Leather Laptop Bag L49. Brown"	256
11272	"Wenger 16"" Pillar Notebook Briefcase"	256
36727	Leather Laptop Briefcase Color: Brown	256
17005	"Popular Customized Fashion Animal Laptop Bag For Men's Gift (15""15.4""15.6"") For Macbook Pro Lenovo ThinkPad ASUS Apple DELL acer HP Microsoft SAMSUNG TOSHIBA - CB-15-29598"	256
40997	JxSar Laptop Case for Macbook Pro 13.3 Inch Material Plastic Texture Frosted Color Pink	256
4380	Shuttle PF55 carrying bag for X50	256
15831	Sinpaid 15 inch Water Resistant Laptop Backpack/Business Bag	256
43042	Blue Laptop Bag for 15.6 inch Asus N53SV-HDU3 Notebook + An Ekatomi Hook.	256
9384	Siamod Novembre Ladies Vertical Detachable-Wheeled Italian Crocco Leather Laptop Case - Black	256
11272	Mobile Edge Select V-Load Notebook Case	256
1705	"Gold Damask Design Full-Body Protective Plastic Case for MacBook Pro 13""/15"" (Non-Retina)"	256
18014	YIYINOE 2015 Hot High Quality Nylon Black laptop Bag Shoulder Bag For Men/Women Notebook Bag Set for 15 15.4 15.6 Inch Computer Briefcase Blue	256
21516	Mebont Hard Case for Macbook Pro 15'' Color Pattern Rubber Coated Laptop Computer Shell Cover MMP15 A1286	256
8540	"Solo Premium Leather 15.6"" Laptop Carryall, Espresso, VTA801-3"	256
43042	Targus Commuter Leather 16 Inch Notebook Case	256
8540	"Solo Pro 14.1"" Laptop Slim Brief, Black, CLA112-4"	256
42383	Alienware Vindicator Briefcase for 17-Inch Laptop AWVBC17	256
21516	Mebont Hard Case for Macbook Pro 15'' Art Pattern Rubber Coated Laptop Computer Shell Cover MMP15 A1286	256
67	12 Inch Rainbow Rubberized Hard Case for 2015 Macbook Matte Shell Cover Green	256
42383	HP Mini 110-1040 10.1 Inch Netbook Laptop Hard Nylon Case with External Micro Suede Pocket, Color Black / Blue + NuVur  Keychain (ND10LXB1)	256
43042	Dark Blue Laptop Bag for 15.6 inch Sony VAIO VGN-NW270 Notebook + An Ekatomi Hook.	256
21516	442119-001 Hewlett-Packard 80Gb 5400Rpm 2.5Inch Sata Laptop Hard Driv	256
42835	Kroo® Blu Life Pure Cases Safari PU Leather Pattern Wallet	256
9774	Catify, Americans Bag!men's Genuine Leather Briefcase Business Laptop Messenger Crossbody Shoulder Bag (Dark brown)	256
4380	rooCASE Netbook Carrying Bag for Dell Inspiron Mini iM1012-738CRD 10.1-Inch Netbook Crimson Red Classic Series - Red 	256
11273	At-Baby Pierce the veil lyrics Custom Durable Case Carrying Bag for Apple Macbook pro Air Notebook Laptop Sleeve Fits All 15 inch Notebook Laptop(Twin sides)	256
11272	MOBILE EDGE LLC ScanFast Laptop Backpack-CKPT-Blk-17.3	256
43042	Red Laptop Bag for 15 inch Toshiba A665D-S5172 Notebook + An Ekatomi Hook.	256
43042	Red Laptop Bag for 15 inch Asus N53SV-XV1 Notebook + An Ekatomi Hook.	256
27821	Cool Print Custom Justin Timberlake Laptop Bag For Men's Gift (17 17.3 Inch) with Hidden Handle and Adjustable Shoulder Strap For Lenovo ThinkPad ASUS Apple DELL acer HP Microsoft SAMSUNG TOSHIBA - CB-17-793	256
9612	Soho PadFolio Smart Stand Alone Cover Case Durable Premium Design For Azpen A1020, A920, A9, A940 Android 9 to 10.1 inch Touch Screen Tablet Mobile Computer Device + Includes a Windshield Car Mount with Auxilary Cable AUX 	256
42835	"HP DFMerry Christmas Pattern Transparent PC Hard Case for MacBook Pro Assorted Colors , Purple , 13.3"""	256
43042	Red Laptop Bag for 15.6 inch Asus K50IJ-XD1B Notebook + An Ekatomi Hook.	256
14694	"Caseflex Alienware M11X R3 Premium Protective 11.6"" Laptop Shoulder Bag Carry Case - Black"	256
20485	Navitech Black Sleek Premium Water Resistant Shock Absorbent 13.1 to 15.4 Laptop/ Notebook Carry Bag Case For The Compaq Presario CQ60-305SA, Compaq Presario CQ61-120SA, Compaq Presario CQ61-220SA, Compaq Presario CQ60-305EA 15.6-inch , Compaq 6735s Lapto	256
11272	Mobile Edge Alienware Orion ScanFast Checkpoint Friendly Tactical Briefcase AWBC17C 	256
11272	Mobile Edge ScanFast Element Checkpoint-Friendly Laptop Briefcase MESFEB8	256
9384	McKlein - Black Gresham Litigator Laptop Briefcase	256
2748	Acer Aspire One AO751h-1192 11.6-Inch Netbook Executive Laptop Carrying Bag with 12v Car Charger	256
20353	Bombata Classic Laptop Briefcase	256
43042	HP Pavilion 17.3 Inch Notebook Laptop Nylon Sleeve Carrying Case with Extra Compartment Pockets , Fits models g7-1257dx, g7-1260CA, g7-1260US, g7-1277dx Color Black / Magenta + NuVur  Keychain (ND17SEM1)	256
1498	CalPak 'Magno' 16-inch Deluxe Laptop Briefcase	256
11273	At-Baby Custom Legend of zelda 2 Durable Case Carrying Bag for Notebook Laptop Sleeve Macbook Air 17 inch (Twin sides)	256
22765	LB1 High Performance New Leather Briefcase for Acer Aspire Timeline AS1410 Notebook Laptop Dark Brown Full-grain Leather Laptop Messenger Bag Business Travel Crossbody Case	256
23271	"Targus 15.4"" Notepac Notebook Case ocn1 -"	256
8540	"Solo Classic 16"" Smart Strap Briefcase , SGB300"	256
6256	Caso Topload viajeros Corporativo de 14 pulgadas Portátiles, Checkpoint friendly (CUCT02UA14S)	256
36634	Nine States 11.6 Inch Slim Fit Shakeproof Computer Laptop Bag Tablet Briefcase Notebook Handbag Black	256
45051	Manhattan Portage Commuter Jr Laptop Bag	256
38122	"14"" Checkpoint Friendly Laptop Case"	256
22765	17-Inch Leather Laptop Briefcase	256
42835	"HP DF Modern Life Pattern Transparent PC Hard Case for MacBook Pro (Assorted Colors) , Orange , 13.3"""	256
36634	Nine States 13 Inch Shockproof Computer Laptop Bag Tablet Briefcase Khaki	256
23271	Targus Merk Primo Rev TG-PR0120 Case (Black/Pink)	256
43042	Genuine Leather Laptop Shoulder Bag Briefcase Color: Black	256
2055	Clava Executive Laptop Briefcase	256
42383	HP Mini 210-3050nr 10.1 Inch Netbook Laptop Hard Nylon Case With External Micro Suede Pocket, Color Black / Red + Nuvur  Keychain (ND10LXR1)	256
4380	rooCase 3n1 Combo - Toshiba Mini NB205-N330WH 10.1-Inch Netbook Carrying Bag Case with 12v Car and AC Adapter Wall Charger - Dark Blue / Black Classic Series	256
21516	Mebont Hard Case for Macbook Pro 15'' Art Pattern Rubber Coated Laptop Computer Shell Cover MMP15 A1286	256
42503	2KV7304 - McKleinUSA Montclare Carrying Case Briefcase for 13.3quot; Notebook - Brown	256
18720	Thinkpad Nylon Carrying Case	256
18720	Targus Citygear Los Angeles Black Grey Yellow Nylon Case For 17 Inch Notebook	256
18720	Black Briefcase Carrying Case for 14/ 15.4 inch laptops	256
10515	Case Logic Zlc-216 16 Professional Notebook & Ipad R Briefcase	256
6152	"Professional 16"" Front-Loading Notebook Case"	256
4229	"Mobile Edge MECBC1 Black Eco-Friendly Carrying Case Briefcase for 17"" Notebook"	256
42975	Faux Snake Rolling Laptop Tote Briefcase Carryall Bag	256
35225	"MOBILE EDGE MESFBC2.0 16"" PC/17"" MacBook R ScanFast TM Briefcase"	256
42835	"HP DFRunning Man Pattern Transparent PC Hard Case for MacBook Pro (Assorted Colors) , Red , 13.3"""	256
20485	Intuos4 Large Carry Case ACK400023 By: Wacom Tech Corp. Notebook Bags	256
11272	Mobile Edge Alienware Vindicator	256
42503	"Mobile Edge 17"" Premium Briefcase - Notebook Carrying Case - 17.3"" - Black, Charcoal ""Product Type: Supplies & Accessories/Notebook Carrying Cases"""	256
42835	"HP DFMerry Christmas Pattern Transparent PC Hard Case for MacBook Pro (Assorted Colors) , Purple , 15.4"""	256
11272	Mobile Edge Premium 17.3-Inch V-Load Briefcase for Notebooks MEV17P	256
18720	Asus Eee PC 12 inch Notebook Green* Carrying Sleeve + SumacLife TM Wisdom Courage Wristband	256
11272	"Quick Briefcase - 16""""""""-17"""""""" Mac"	256
16088	At-Baby Legend of zelda Custom Durable Case Carrying Bag for Apple Macbook pro Air Notebook Laptop Sleeve Fits All 13 inch Notebook Laptop(Twin sides)	256
32616	1ST Crazy Horse Leather Men's Dark Brown Laptop Bag Briefcase Handbag Messenger,M36	256
43042	"Executive Briefcase Style Business Bag Case for Toshiba Encore 2 WT10 10.1"" Tablet Black "	256
25160	One side A Bug's Life style Laptop Sleeve 10'' Cover designed by Coolphonecases	256
10515	Case Logic QNA-214 Slim Case for 14-Inch Laptop	256
43042	Designer Sleeves 13-Inch 60's Butterfly Executive Laptop Bag 13ES-60B	256
4380	rooCASE Deluxe 13.3-Inch Netbook Carrying Bag - Black	256
43042	Dark Blue Laptop Bag for 15.6 inch Dell M5030-2792B3D Notebook + An Ekatomi Hook.	256
26677	"Customized Creative Flowing Color Series Colorful Swirl Special Design Water Resistant Hard Case for Macbook Air 13"" (Model A1369/a1466)"	256
18720	Pro Messenger Bag Soft Nylon Carrying Case Black Silver For Asus Eee PC 1015P Netbook 10.1 inch Screen	256
42503	Targus XL Notebook Case - Top-loading - Handle, Detachable Shoulder Strap - 1 Pocket - Nylon - Black - TXL417	256
43042	Red Laptop Bag for 15.6 inch Asus G53SX-SZ061V Notebook + An Ekatomi Hook.	256
42439	Speck Products SmartShell Case for MacBook Pro 15-Inch, Cabernet Red (SPK-A2353)	256
4229	Techstyle Laptop Portfolio - Holds 16 Pc Or 17 Mac Screens - Black Faux Croc - M	256
43911	Red Laptop Bag for 10 inch Acer AOD257-1633 N570, AOD260-1270, Aspire One AOD270-1410 Netbook + An Ekatomi Hook.	256
44518	"Coosbo? Colorful Matt Rubberized Hard Case for 13"",15"" inch Mac Macbook Pro"	256
1546	Smart Tech® RUSHANG 13.3-Inch Laptop Bag For Macbook Air / Pro A-PURPLE 	256
27821	Popular Customized Fashion Elsa Pataky Laptop Bag Suitalbe Men's (17 17.3 Inch) with Hidden Handle and Adjustable Shoulder Strap For Lenovo ThinkPad ASUS Apple DELL acer HP Microsoft SAMSUNG TOSHIBA - CB-17-349	256
2989	Acer Aspire One D257-1471 10.1 Inch Netbook Laptop Hard Nylon Case With External Micro Suede Pocket, Color Black / Blue + Nuvur  Keychain (ND10LXB1)	256
21516	Watercolor Night Sky Customized Cover Case with Hard Shell Protection for Ipad2,3,4 Case lxa#857205	256
43042	Mosey Life The Nester Notebook Bag	256
8540	"Solo Premium Leather 16"" Laptop Briefcase, Espresso, D535-3"	256
43911	Black Laptop Bag for 10 inch Acer Aspire One AOD257-1497, AOD250-1116 Netbook + An Ekatomi Hook.	256
11272	"Mobile Edge ScanFast Checkpoint Friendly Women's Element Laptop Bag - 16""PC /"	256
29782	Excellent Travel Gear computer notebook Laptop teblet inch Backpack.SA1512-C1	256
40091	MANHATTAN Times Square Notebook Computer Briefcase 421430 	256
21916	"Ladies Rolling 15.4"" Laptop Computer Briefcase - BLACK"	256
11272	Mobile Edge Meen01 16 Pc/17 Macbook Tm Express Tote	256
15183	"Mobile Edge Chocolate Suede Tote - Notebook Carrying Case - Chocolate ""Product Type: Supplies & Accessories/Notebook Carrying Cases"""	256
43042	ACME MADE Slick Case for Laptop	256
8540	Solo Classic Leather Briefcase	256
31632	KABB Brown Case for 11-Inch MacBook Pro Package - Vintage leather case for MacBook Pro 15-Inch	256
33613	Asus 17.3 Inch Notebook Laptop Nylon Sleeve Carrying Case with Extra Compartment Pockets , Fits models K73SV-A1, K73SV-DH51, K73SV-DH51 Color Black / Red + NuVur  Keychain (ND17SER1)	256
17005	"Popular Customized Fashion Animal Laptop Bag For Men's Gift (15""15.4""15.6"") For Macbook Pro Lenovo ThinkPad ASUS Apple DELL acer HP Microsoft SAMSUNG TOSHIBA - CB-15-15678"	256
42835	"HP DFModern Life Pattern Transparent PC Hard Case for MacBook Air Assorted Colors , Rose , 11.6"""	256
10515	Bellino Expresso Vertical Laptop Canvas Brief - Checkpoint Friendly	256
14694	"Caseflex HP Pavilion TouchSmart Premium Protective 11.6"" Laptop Shoulder Bag Carry Case - Black"	256
43042	Blue Laptop Bag for 15.6 inch Sony VAIO VPC-EB46FX Notebook + An Ekatomi Hook.	256
19035	Alienware Orion Tactical BP Alienware Orion Tactical BP	256
4380	rooCASE Netbook / iPad Carrying Bag for Acer Aspire One AO522-BZ824 10.1-Inch HD Netbook Olive Green - Deluxe Series Dark Blue / Black	256
42383	Dell Inspiron Mini 10V Netbook Computer	256
15183	"Mobile Edge Alienware Vindicator Slim Case - Notebook Carrying Case - 17"" - Black ""Product Type: Supplies & Accessories/Notebook Carrying Cases"""	256
4380	rooCASE 2n1 Gateway LT2106u 10.1-Inch Black Netbook Carrying Bag Case with AC Adapter Wall Charger - Classic Series - Dark Blue / Black	256
18720	Tecnet Tja-30Nc Nylon Carrying Case	256
43042	Mosey Life The Nester Notebook Bag	256
40997	JxSar Laptop Case for Macbook Pro 13.3 Inch Material Plastic Texture Smooth Color Water blue	256
22038	TOP-BAG® Men's Genuine Leather Briefcase Laptop Bag Messenger ,NM001	256
4380	rooCASE 2n1 Netbook Carrying Bag with Wall Charger for Acer Aspire One AO532h-2789 10.1-inch (Versasport Series - Black)	256
1705	"Gold Damask Design Full-Body Protective Plastic Case for MacBook Pro 13""/15"" (Non-Retina)"	256
42503	"TARGUS case deluxe 17"" leather notebook case black TLE400"	256
31632	"Easygoby Tribal Design Rubberized Rubber Coated Hard Case for 13-Inch MacBook Pro 13.3"" Model No.A1278 Shell Cover - Tribe"	256
7234	"Mobile Edge Men's Quick Briefcase - 16""/17"" Mac"	256
9860	"Johnston & Murphy 17"" Slimline Laptop Briefcase Black/Dark Mahogany"	256
43042	Kroo Neoprene Shoulder Bag with Pockets Fits up to 11-Inch Tablet (ND11SCK1-7285)	256
42383	HP Mini 110-2070 10.1 Inch Netbook Laptop Nylon Sleeve Case with External Pockets for extra capacity, Color Black / Green + NuVur  Keychain (ND10SEG1) GREAT CHRISTMAS GIFT !	256
8540	"Solo Classic 17.3"" Laptop Rolling Case, Black, PT136-4"	256
6256	Acer Aspire One AOD250-1116 10.1-Inch Netbook Carrying Case - VersaSport Bag - Black	256
22765	LB1 High Performance New Leather Briefcase for HP Pavilion DV6-1360US Notebook Laptop Dark Brown Full-grain Leather Laptop Messenger Bag Business Travel Crossbody Case	256
42383	Fujitsu LifeBook MH380 10.1 Inch Netbook Laptop Hard Nylon Case with External Pocket, Color Grey + NuVur  Keychain (ND10N2E1)	256
4380	ROOCASE DELUXE NETBOOK CARRYING BAG	256
9384	"McKlein USA Kenwood Leather 15.4"" Laptop Case,One Size,Cognac"	256
8540	"Solo Classic 16"" Expandable Leather Attache"	256
30263	Betsey Johnson Polka Party Black Briefcase 2 Compartment Laptop Case	256
22765	Aerovation CPFR-1A 15.4 Brown Leather Checkpoint Friendly Laptop Bag	256
43911	"Back to School Laptop Bag for 10"" Acer Aspire One AOD257-13Dkk, A0531h-1766, AO23227 Netbook + An Ekatomi Hook. Summer Sale!"	256
16088	Jocase MacBook Pro 13 inch Case,Hard Case Print Frosted for MacBook Pro 13 inch Fits Model A1278	256
42835	"Pocket Pro 11.6"" Netbook Case with Pockets andSecurity Strap"	256
19035	Neoprene Laptop Carrying Case Sleeve Bag w. Hidden Handle & Eyelet D-Ring for 15 15.6 Inch Notebook - Klimt Tree of Life	256
2797	Lateendo Genuine Leather Handbag Briefcase For Men's Business Bag	256
43042	"Kroo Fashion Business Waterproof PVC Leather Briefcase Laptop Case Messenge Shoulder Bag Eco-friendly Green Checkpoint-Friendly for Toshiba-Satellite Ultrabook 14.4"" Laptop U845WS4180"	256
4380	MSI Wind U100-427 10-Inch Netbook Carrying Bag Case Classic Series - Dark Blue / Black	256
43042	Dark Blue Laptop Bag for 15 inch Sony VAIO VGN-NS235J Notebook + An Ekatomi Hook.	256
14694	"Caseflex Acer Aspire V5-122P Premium Protective 11.6"" Laptop Shoulder Bag Carry Case - Black"	256
14694	"Caseflex Lenovo ThinkPad X121E Premium Protective 11.6"" Laptop Shoulder Bag Carry Case - Black"	256
4380	Acer Aspire One AOD250-1613 10.1-Inch Netbook Carrying Case Deluxe Bag - Pink 	256
42383	HP Mini 110-3098 10.1 Inch Netbook Laptop Hard Nylon Case with External Micro Suede Pocket, Color Black / Blue + NuVur  Keychain (ND10LXB1)	256
10515	Case Logic Zlc-216 16 Professional Notebook & Ipad R Briefcase	256
42383	HP Mini 110-3700 10.1 Inch Netbook Laptop Nylon Sleeve Case with External Pockets for extra capacity, Color Black / Green + NuVur  Keychain (ND10SEG1) GREAT CHRISTMAS GIFT !	256
42503	Brenthaven Broadmore - Wheeled Case Briefcase Black	256
4380	cocoon innovations cns340bk netbook case - black accommodates up to a 10.2in netbook	256
2055	"SwissGear Lugano 17"" Rolling Briefcase Black"	256
4380	rooCASE Netbook Carrying Bag for Acer TravelMate 8172 Timeline 11.6-Inch Laptop TM8172T-7818 - Classic Series Black / Dark Blue	256
40091	Manhattan 421560 Notebook Briefcase	256
11272	Mobile Edge MEUWBC Womenfts Netbook Briefcase - Notebook carrying case - 13.3 inch - black	256
24632	Mesh Slim Line Carrying Bag Case for HP Pavilion g6z-2200 15.6-inch Notebook PC	256
26677	"Customized Creative Flowing Color Series Colorful Paint Special Design Water Resistant Hard Case for Macbook Air 11"" (Model A1370/a1465)"	256
30111	Tucano One Premium MacBook Pro Tote Bag Dark Green	256
43042	Professional Protect Bag Inner Bag for 7 Inch Laptop	256
20485	VanGoddy Wave Briefcase / Messenger Bag for Asus 14 to 15.6-inch Laptops (Sky Blue)	256
14694	"Caseflex Lenovo S20-30 Premium Protective 11.6"" Laptop Shoulder Bag Carry Case - Black"	256
6584	NEW Samsonite Quantum Checkpoint Friendly Large Laptop Bag - 42361-1408	256
13645	Uniquely designed SumacLife Brand Black Ultra Durable Reinforced 12 Inch Cady Hard Shell Sports Bag for all models of the ASUS Eee PC Seashell 12.1 Inch Netbook ASUS 1215N-PU27-RD, 1215N-PU17-SL, 1215B-PU17-BK, 1215N-PU27-RD, 1225B-SU17-BK 11.6 Inch, Netbook Laptop + 2 Cable Holder Organizers	256
30111	"Tucano Shine Laptop Bag for 15"" MacBook Pro/Retina or Notebook"	256
43402	VanGoddy Wave Briefcase / Messenger Bag for Fujitsu LifeBook & CELSIUS 14 to 15.6-inch Laptops (Sky Blue)	256
42835	Modern Life Pattern Transparent PC Hard Case for MacBook Pro (Assorted Colors)	256
43042	Kroo Waterproof PVC Leather Briefcase Laptop Case Messenge Shoulder Bag Neon Green Checkpoint-Friendly for ASUS VivoBook S400CA Ultrabook 14 Touchscreen	256
43042	"12 Inch Netbook Green Case with Pockets for HP EliteBook WP884AW 12.1"" Includes EnvyDeal Velcro Cable Tie"	256
43042	"12 Inch Netbook Red Carrying Case with Pockets for Samsung 12.1"" Chromebook XE500C21-A04US Includes EnvyDeal Velcro Cable Tie"	256
21516	Mebont Hard Case for Macbook Pro 15'' Color Pattern Rubber Coated Laptop Computer Shell Cover MMP15 A1286	256
18720	Red Cube Case for Asus Eee PC 1005HA-PU17-BU 10.1-Inch Intel Atom Netbook Computer	256
19160	Kinmac Chocolatier Confisur Lady Pattern Canvas Laptop Briefcase for 14 Inch Laptop Computer	256
43911	Red Laptop Bag for 10 inch Asus Eee Pad SL101-B1-BR, 1016PT-BU37, T101MT-EU47 Netbook + An Ekatomi Hook.	256
11272	"Mobile Edge Mebppt Premium Carrying Case for 17.3"" Notebook, Black/Camo"	256
11272	MOBILE EDGE - 16IN ELEMENT BRIEFCS PNK	256
4380	rooCASE Netbook Carrying Bag for Acer Aspire One 10.1-Inch AOD255-2929 Netbook - Deluxe Black	256
43042	Extra Lightweight Laptop Briefcase by Bond Street	256
4380	rooCASE 2n1 Netbook Carrying Bag with Wall Charger for Lenovo IdeaPad U150 6909-69U 11.6-Inch Laptop BlackStarry Night Versasport Series - Black	256
28380	Men's AL2601 Leather Duster 3X-Large Black	256
40997	JxSar Laptop Case for Macbook Pro 15.4 Inch Material Plastic Texture Frosted Color Water blue	256
41563	"Embassy Plus 17"" Black Rolling Laptop Computer Bag Business Wheeled Briefcase"	256
21516	Mebont Hard Case for Macbook Pro 13'' Art Pattern Rubber Coated Laptop Computer Shell Cover MMP13 A1278	256
22765	Violett-ABEL Cowhide Briefcase and Crossbody Bag	256
4380	rooCASE Netbook Carrying Bag for Acer Aspire One AO533-13531 10.1-inch - Deluxe Black	256
30263	McKleinUSA OHARE 86535 Black Leather Fly-Through Checkpoint-Friendly 17 Detachable Wheeled Laptop Case	256
43042	Kroo Waterproof PVC Leather Briefcase Laptop Case Messenge Shoulder Bag Neon Green Checkpoint-Friendly for Lenovo ThinkPad X1 3443CTO 14-inch Laptop	256
8540	"Solo Urban 17.3"" Laptop Briefcase, Black, LVL330-4"	256
43042	Blue Laptop Bag for 15.6 inch Asus N55SF-S1128V Notebook + An Ekatomi Hook.	256
25961	American Shield computer notebook Laptop backpack.ASBZ1630-C5	256
34962	"Manhattan - 15.4"" Times Square Notebook Computer Briefcase *** Product Descri..."	256
7234	"Mobile Edge ScanFast Element Checkpoint Friendly Briefcase - Notebook carrying case - 15.6"" - brown - SCANFAST ELEMENT BRN SUEDE BRIEFCASE CPF 16IN"	256
42835	"HP DFRunning Man Pattern Transparent PC Hard Case for MacBook Pro (Assorted Colors) , Red , 15.4"""	256
43042	Microsoft 16-Inch Laptop Shuttle Case	256
10515	Case Logic PNC-17 17-Inch Slimline Laptop Case Black	256
1439	Last Innovation Blue Metallic Hard Case for MacBook Pro 13.3 inch (A1278)	256
43042	Red Laptop Bag for 15 inch Sony VAIO VGN-NW160JS Notebook + An Ekatomi Hook.	256
6152	"Professional 16"" Front-Loading Notebook Case"	256
14694	"Caseflex HP Stream 11 Premium Protective 11.6"" Laptop Shoulder Bag Carry Case - Black"	256
34327	"HP DFHigh Quality Smart Cover Grid Design Flip Cover Case for Macbook Air 11"" , Red"	256
43042	Blue Laptop Bag for 15.6 inch Asus K50IJ-SX539V Notebook + An Ekatomi Hook.	256
4380	Acer Aspire One 531h 10.1-Inch Netbook Carrying Case Deluxe Bag - Red / Black 	256
20485	Targus Checkpoint-Friendly Mobile Elite Laptop Bag for 15.4 Inch Laptops TBT045US Black	256
34327	"Coosbo? Matt Rubberized Hard Cover Case for 11"" 13"" Mac Macbook Air (Assorted Color)"	256
42383	HP Mini 110-1021 10.1 Inch Netbook Laptop Nylon Sleeve Case with External Pockets for extra capacity, Color Black / Orange + NuVur  Keychain (ND10SEO1) GREAT CHRISTMAS GIFT !	256
43042	"Kroo Fashion Business Waterproof PVC Leather Briefcase Laptop Case Messenge Shoulder Bag Eco-friendly Green Checkpoint-Friendly for HP-ENVY TouchSmart Ultrabook 14"" Touch-Screen Laptop 14-k020us"	256
11272	"Mobile Edge Eco-Friendly Mecte88 16"" Notebook Case ""Prod. Type: Bags & Carry Cases/Notebook Bags"""	256
18720	Red Cube Case for ASUS 1025CE-MU17-PR 10.1-Inch Netbook	256
38373	Royce Leather 17 Laptop Briefcase - Tan	256
43042	Black Laptop Bag for 15.6 inch Sony VAIO VGN-NR220E Notebook + An Ekatomi Hook.	256
20485	hot 14 Inch Shock-Proof Water Resistant One-shoulder Sleeves Bag with Handle for Notebook PC , Red	256
