40091	Manhattan 421560 Notebook Briefcase	256
40997	JxSar Laptop Case for Macbook Pro 15.4 Inch Material Plastic Texture Smooth Color Grey	256
10515	Case Logic ZLCS-117 Check Point Friendly 17-Inch Laptop Case Black	256
31632	"Rayshop - Bright Colors Dull Polish Case Shell for 13.3"" 15.4"" MacBook Pro Retina Color : White , Size : 15.4"" "	256
6256	Dynomighty Men's Express Mail Mighty Case Laptop, Turquoise/Red/White/Black, One Size	256
3563	Lucrin - Case for MacBook 12 inches - Burgundy - Granulated Leather	256
22765	"Bombata Doppio 15"" Laptop Briefcase Brown & Yellow"	256
13497	"16"" Black Laptop Briefcase"	256
43042	"12 Inch Netbook Navy Blue Case with Pockets for Panasonic Toughbook CF-C1BDHCZ1M 12.1"" Includes EnvyDeal Velcro Cable Tie"	256
2055	"Royce Leather 15"" Executive Laptop Briefcase in Genuine Leather"	256
1439	Last Innovation Silver Metallic Hard Case for MacBook Pro 15.4 inch (A1286)	256
30263	Glen Ellyn Aqua Blue Italian Leather Wheeled Detachable Laptop Briefcase	256
11272	Mobile Edge Tech Brief Laptop Case - T - MEBCT1	256
42835	Modern Life Pattern Transparent PC Hard Case for MacBook Pro (Assorted Colors)	256
27821	13' PLUM & PINK Laptop Bag for Dell Lattitude XT3 with Pockets & Shoulder Strap	256
1351	Business and Casual Travel Gear fashion computer notebook Laptop teblet inch Backpack.SG9382-C2	256
22765	Mylux 1888-4 Laptop Travel 100% High End Genuine Leather Briefcase black	256
10515	"Case Logic 7-10"" Netbook Attach Red lneo-10red -"	256
42835	"HP DFSpecial Circles Pattern Transparent PC Hard Case for MacBook Pro (Assorted Colors) , Purple , 13.3"""	256
43402	Toshiba SD-P91S 9-Inch Portable DVD Player KROO Case Carrying Bag Sleeve Briefcase Pouch Eva Green + Includes a 4-inch Determination Hand Strap	256
27821	"Popular Customized Fashion ( Animals bird natures a branches ) Laptop Bag For Men's Gift (10 Inch) For 9.7""iPad Air 2-iPad 1 2 3 4 5-Samsung Galaxy Tab 3 S T700-Note 10.1-Tab PRO-Google Nexus 10 - CB-10-3918"	256
43042	Juice Action Men's Leather 13 Inch Laptop Bag Crossbody Shoulder Handbag Briefcase Black	256
22765	Leather Notebook Case Leather Notebook Case	256
43042	Professional Protect Bag Inner Bag for 8 Inch Laptop	256
40997	JxSar Laptop Bag for Macbook 13.3 Inch Material Canvas Style Handbag Color Green	256
40091	Manhattan 15.6-Inch Notebook Briefcase, Black 438889	256
9384	McKlein USA NORTH PARK I Series Leather Laptop Briefcase	256
4502	ArcEnCiel® 13 inch Laptop Bag with Hidden Handle	256
29782	Excellent Travel Gear computer notebook Laptop teblet inch Backpack.SA9274-C2	256
43042	"Kroo Fashion Business Waterproof PVC Leather Briefcase Laptop Case Messenge Shoulder Bag Eco-friendly Green Checkpoint-Friendly for Sony-VAIO Fit 14"" Touch-Screen Laptop SVF14A15CXS"	256
1508	Stebco Premium Cowhide Leather Computer Briefcase	256
43042	Blue Laptop Bag for 15.6 inch Dell M5030-4512 Notebook + An Ekatomi Hook.	256
42439	Speck Products See Thru Hard Shell Case for MacBook Pro 15-Inch Aluminum Unibody Only, Cobalt SPK-A0471	256
10515	Case Logic ZLR-116 Rolling 15.6-Inch Case for Laptop	256
4229	"MOBILE EDGE, Mobile Edge Quick Carrying Case Briefcase for 17"" Notebook - Black Catalog Category: Accessories / Carrying Cases"	256
43042	Blue Laptop Bag for 15.6 inch Asus G53SX-SZ019V Notebook + An Ekatomi Hook.	256
9384	McKlein USA Glen Ellyn 2-in-1 Removable-Wheeled Briefcase	256
16088	"Zebra 13"" 13.3"" Inch Notebook Laptop Case Sleeve Carrying Bag with Hidden Handle"	256
4380	rooCase 3n1 Combo - Toshiba Mini NB205-N230 10.1-Inch Netbook Carrying Bag Case with 12v Car and AC Adapter Wall Charger - Dark Blue / Black Classic Series	256
23271	Targus Notebook Case RG0322 -	256
11272	"ALIENWARE AWVBC18 Vindicator Briefcase 18"""	256
6256	Acer Aspire One AOA110-1137 8.9-Inch Lightweight Checkpoint Friendly Netbook Bag with Home Wall Charger - Red Black	256
37740	Preferred Nation Travelwell Appalachian Laptop Briefcase	256
43042	Dark Blue Laptop Bag for 15.6 inch Toshiba A665D-S6084 Notebook + An Ekatomi Hook.	256
6584	SolarGoPack 12k Pro Briefcase, solar powered Professional Briefcase, charges all mobile devices, Take Your Power with You, 12k mAh Lithium Ion Battery - Ballistic Nylon and Leather - Black	256
41339	MLB Tan Leather Porthole Laptop Briefcase	256
7514	Fabric Business Briefcase Laptop Bag Notebook Computer Tablet Bag For 15 Inch Laptop Spider Man Print.	256
42835	HP DFHigh Quality Case Camouflage Design Flip Cover Case for Macbook Air 11 , 3	256
8960	"Gootium 41141 Canvas Genuine Leather 15"" Laptop Bag"	256
23531	Soho PadFolio Smart Stand Alone Cover Case Durable Premium Design For Lenovo IdeaTab S2109, S2110, S6000, A2109 / Miix 10 / ThinkPad 2 10-inch Tablet Computer	256
26677	"Customized Creative Flowing Color Series Colorful Paint Special Design Water Resistant Hard Case for Macbook Air 13"" (Model A1369/a1466)"	256
10515	"CASE LOGIC CLRS-117 17"" Checkpoint Friendly TM Rolling Notebook Case"	256
43042	"12 Inch Netbook Black Sleeve Case with Pockets for Dell Latitude E6220 12.5"" Includes EnvyDeal Velcro Cable Tie"	256
18720	Black Red Ultimate Smart Travel Organizer Hard Nylon Durable Cover Carrying Cube Case // Airport Check-Point-Friendly // For Asus Eee PC 1015PN Netbook Notebook 10.1 inch Screen	256
11272	LeatherBay Cambridge Briefcase	256
6256	Acer Aspire One AOA110-1995 8.9-Inch Netbook Carrying Bag Case with Wall Charger - Dark Blue / Grey	256
6256	Acer Aspire One AOA150-1505 8.9-Inch Netbook Carrying Bag Case - Dark Blue / Grey	256
4380	Orange - Kroo Smart Accord Case with Built-in Stand fits BLU Life Pure Mini	256
6584	"MOBILE EDGE #MEEN14 Express Carrying Case Briefcase for 14.1"" Notebook, Ultrabook - Black"	256
17005	"Popular Customized Fashion Animal Laptop Bag For Men's Gift 15""15.4""15.6"" For Macbook Pro Lenovo ThinkPad ASUS Apple DELL acer HP Microsoft SAMSUNG TOSHIBA - CB-15-8958"	256
40997	JxSar Laptop Case for Macbook Pro 13.3 Inch Material Plastic Texture Smooth Color Metallic Purple	256
13960	Everki Agile Slim Laptop Bag - Briefcase, Fits up to 16-Inch (EKB424)	256
43042	Red Laptop Bag for 15 inch Gateway NV58-T6600 Notebook + An Ekatomi Hook.	256
42439	Speck Products See Thru Hard Shell Case for MacBook Pro 13-Inch Aluminum Unibody Only, Cobalt SPK-A0467 	256
43042	Blue Laptop Bag for 15.6 inch Lenovo Z575-129925U Notebook + An Ekatomi Hook.	256
18014	Unisex Large Print School Shoulder Bag Hiking Daypack Laptop Computer Backapck Red 	256
8540	"SOLO Classic 15.6"" Leather Rolling Case"	256
43042	"Kroo Fashion Business Waterproof PVC Leather Briefcase Laptop Case Messenge Shoulder Bag Eco-friendly Green Checkpoint-Friendly for Lenovo-IdeaPad Ultrabook 14"" Touch-Screen Laptop U430 TOUCH - 59371574"	256
10515	Case Logic KNL2 Koskin Computer Briefcase	256
11272	"Mobile Edge Genuine 15.4"" Select Briefcase Black"	256
2989	Acer AOD250-1025 10.1-Inch Purple Netbook - Over 3 Hours Battery Life (Windows 7 Starter)	256
32645	"Mcklein 15.4"" Halsted Brown Double Compartment Notebook Case 15.4"" Halsted Brown Double Compartment Notebook Case 17.4000"" L X 15.6000"" W X 5.4000"" H X"	256
35225	"MBLMESFBC20-MOBILE EDGE MESFBC2.0 16"" SCANFAST TM BRIEFCASE"	256
15183	"Mobile Edge Alienware Vindicator Carrying Case Briefcase for 17.1"" Notebook - Black - Weather Resistant Exterior, Scratch Proof Interior - Nylon - Alien Head Logo - Checkpoint Friendly - AWVBC17"	256
43042	Red Laptop Bag for 15 inch Sony VAIO PCG-FX215 Notebook + An Ekatomi Hook.	256
11272	Mobile Edge MEB17P 17.3-Inch Premium Laptop Briefcases	256
34060	CODi 4-Digit Combination Notebook Computer Titanium Cable Lock for Mac and PC	256
4229	MOBILE EDGE Scanfast Briefcase Black 16 / MESFBC2.0 /	256
42835	"HP DFArtistic Work of Fish Pattern Transparent PC Hard Case for MacBook Pro Assorted Colors , Blue , 13.3"""	256
23271	Targus TLE300 15.4 Leather Notebook Case	256
7234	Lenovo 78000851 Mobile Edge ScanFast Element Checkpoint Friendly Briefcase - Notebook carrying case - 16 inch - green, brown	256
42835	"HP DF Artistic Work Pattern Transparent PC Hard Case for MacBook Pro (Assorted Colors) , Blue , 15.4"""	256
14263	MGM Galaxy 13 13.3 inch Waterproof Laptop Briefcase Handbag Carry Case with Shoulder Strap for Apple Macbook Pro Retina Air Acer Dell Lenovo HP Samsung Laptop /NoteBook	256
8540	Hercules Eplug Solo 200	256
43042	Red Laptop Bag for 10 inch Lenovo ThinkPad 183927U Netbook , Lenovo 06517HU Netbook+ An Ekatomi Hook.	256
17005	"Cool Print Custom ( Animals dog jumps water hunting running splash ) Laptop Bag For Men's Gift (15""15.4""15.6"") For Macbook Pro Lenovo ThinkPad ASUS Apple DELL acer HP Microsoft SAMSUNG TOSHIBA - CB-15-10393"	256
7234	Mobile Edge Briefcase - notebook carrying case MEEBC1 -	256
4681	MT.MIT Men's Transverse Genuine Leather Portable Business Laptop Briefcase Coffee	256
30263	McKleinUSA SPRINGFIELD 86595 Black Leather Fly-Through(TM) Checkpoint-Friendly 17 Laptop Case	256
11272	"Mobile Edge ScanFast Checkpoint Friendly Women's Element Laptop Bag - 16""PC /"	256
31632	"Easygoby Rubberized Rubber Coated Hard Case for 13-Inch MacBook Pro 13.3"" Model No.A1278 Shell Cover - Skull"	256
8540	Dakine Re-gen Laptop Case, (Large, Greyfir)	256
11272	Mobile Edge Select V-Load 2.0- 17.3-Inch	256
2748	Acer Aspire One AO751h-1378 11.6-Inch Netbook Executive Laptop Carrying Bag with 12v Car Charger	256
43042	Brenthaven Prostyle Ultralite Tsa X-Ray Friendly case for 12-14 inch Ultrabook	256
17005	"Cool Print Custom ( Animals lion grins cry game baby ) Laptop Bag For Men's Gift (15""15.4""15.6"") For Macbook Pro Lenovo ThinkPad ASUS Apple DELL acer HP Microsoft SAMSUNG TOSHIBA - CB-15-16633"	256
41563	North End Environmental Conscious Polyester Black Green Business Computer Briefcase T2Z5 	256
6256	Acer Aspire One AOA150-1447 8.9-Inch Netbook Carrying Bag Case - Dark Blue / Grey	256
10515	Case Logic VNCI-215BLK Case Logic Vnci-215Blk 15.6 Notebook Case Blk	256
1508	Vintage Leather Bazaar Handmade Goat Leather Briefcase Laptop Bag 14 Inch Brown	256
28645	Wonderful Life Rubberized Hard Shell Cover Case (Grey) For 13.3-inch Apple MacBook Pro	256
1508	Piel Leather Computer Briefcase	256
43042	Zero Halliburton Geo Aluminum Large Laptop Case	256
16816	Mobile Edge Mebcnp1 16 Nylon Notebook Briefcase (Premium)	256
43042	Bellino Russo Laptop Briefcase	256
23271	TARGUS CityLite Notebook Case / TBT053US /	256
4380	HP Mini 110-1113NR 10.1-Inch Netbook Carrying Bag Case Classic Series - Dark Blue / Black	256
23271	Targus TVR300 Premiere Notebook Case	256
11272	MOBILE EDGE MEA2600 UrgentPower	256
22765	New Bugatti Brown Nappa Leather Laptop Briefcase	256
11273	be.ez LA Robe SeaFood Lifestyle Bag for 15 inch Apple MacBook Pro	256
30263	McKleinUSA GLENVIEW 94745 Black Leather Ladies' Laptop Case by McKleinUSA	256
43042	Piel Leather Ladies Laptop Tote with Pockets	256
22765	Business Laptop Attache Case	256
7234	"Mobile Edge 16"" Deluxe Leather Notebook Briefcase"	256
43042	"Gino 10"" 10.1"" 10.2"" Black Notebook Laptop Shoulder Bag Case + Handle for HP TouchPad"	256
42835	"HP DF Mind-mapping Pattern Transparent PC Hard Case for MacBook Pro Assorted Colors , Yellow , 15.4"""	256
44518	"Coosbo? Golden Matt Rubberized Hard Cover Case for 13"",15"" Macbook Pro"	256
23531	Soho PadFolio Smart Stand Alone Cover Case Durable Premium Design For Sony Xperia S / Z Android 9.4-inch Touch Screen Mobile Tablet Computer	256
7514	Fabric Business Briefcase Laptop Bag Notebook Computer Tablet Bag For 15 Inch Laptop Batman Batgirl Print.	256
1705	"Vintage Design Flower Pattern Full-Body Protective Plastic Case for MacBook Pro 13""/15"" (Non-Retina)"	256
43042	Red Laptop Bag for 15.6 inch Lenovo ThinkPad t60-1953 Notebook + An Ekatomi Hook.	256
22038	INFON 7028X Rare Crazy Horse Leather Men's Briefcase Laptop Bag	256
43911	Red Laptop Bag for 10 inch Acer Aspire One AOD257-1497, AOD250-1116 Netbook + An Ekatomi Hook.	256
42503	"Mancini Italian Leather 15.4"" Laptop Briefcase - Brown"	256
11273	At-Baby Rock Band Custom Durable Case Carrying Bag for Apple Macbook pro Air Notebook Laptop Sleeve Fits All 15 inch Notebook Laptop(Twin sides)	256
30263	McKleinUSA MIDWAY 86605 Black Leather Fly-Through(TM) Checkpoint-Friendly 17 Detachable Wheeled Laptop Case by McKleinUSA	256
42835	"HP DF New Metal Color PC Hard Case for MacBook Pro 15.4""(Assorted Colors) , Blue , 15 inch"	256
40997	JxSar Laptop Case for Macbook Pro 15.4 Inch Material Plastic Texture Frosted Color Green	256
6256	Acer Aspire One AOA110-1137 8.9-Inch Netbook Carrying Bag Case - Dark Blue / Grey	256
43042	Black Laptop Bag for 15.6 inch Acer AS5750-6636 Notebook + An Ekatomi Hook.	256
4380	HP Mini 1000 XP 10.2-Inch Netbook Carrying Bag Case - Classic Series - Black	256
42468	"12.5"" 13"" 13.1"" Tree Snow One Compartment Notebook Laptop Sleeve Bag"	256
11272	Mobile Edge 16 Inch Eco Friendly Casual Tote - Black	256
16088	"Peacock 13"" 13.3"" Inch Notebook Laptop Case Sleeve Carrying Bag with Hidden Handle"	256
19035	"Dog 15"" 15.4"" 15.6"" Inch Notebook Laptop Case Sleeve Carrying Bag with Hidden Handle for Macbook Pro 15 15.4 Retina/dell Inspiron 15r Vostro XPS Alienware M15x /Asus A55 K55 N56 X54 /Sony E15 S15 El2 /Lenovo Thinkpad E530 /Hp Acer/toshiba Satellite"	256
19703	Manberce Men's Leather Business Briefcase Laptop Bag, Gray, One Size	256
43042	"Gino 10"" 10.1"" 10.2"" Blue Neoprene Notebook Laptop Sleeve Bag Case for Toshiba Thrive"	256
31968	At-Baby Custom My little pony Durable Case Carrying Bag for Notebook Laptop Sleeve Macbook Air 17 inch (Twin sides)	256
30263	"McKlein Genuine 17"" Brown West Town Leather ""Fly-Through"" Checkpoint-Friendly Detachable-Wheeled Notebook Case"	256
23271	Targus 18K6572 SlipSkin Notebook Case, Black	256
17760	Frosted Folio Hard Shell Laptop Case for MacBook Pro 13.3'' (Assorted Colors)	256
40091	Manhattan Times Square Notebook Computer Briefcase	256
6256	Acer Aspire One AOA150-1887 8.9-Inch Netbook Carrying Bag Case with 12v Car and Wall Charger - Black / Grey	256
4380	Red Cube Case for Toshiba Mini NB205-N325BL 10.1-Inch Royal Blue Netbook	256
11272	Mobile Edge TPS Geneva- 16-Inch PC/17-Inch MacBook Pro	256
42468	"13"" 13.3"" Black Brown Notebook Laptop Shoulder Bag w Handle for Macbook Pro/Air"	256
8692	Siamod CARUGETTO 45296 Cherry Red Leather Detachable-Wheeled Laptop Case	256
36634	Everki Usa Inc. Make The Advance Laptop Briefcase Your Everyday Bag. Its Slim Profile Contempor	256
43042	Blue Laptop Bag for 15.6 inch Gateway NV59-C09U Notebook + An Ekatomi Hook.	256
16088	At-Baby Doctor who tardis Custom Durable Case Carrying Bag for Apple Macbook pro Air Notebook Laptop Sleeve Fits All 13 inch Notebook Laptop(Twin sides)	256
4380	MSI Wind U100-451US 10-Inch Netbook Carrying Bag Case Classic Series - Dark Blue / Black 	256
43042	Blue Laptop Bag for 15.6 inch Asus K53SV-DH51 Notebook + An Ekatomi Hook.	256
34327	"Coosbo? Matt Rubberized Hard Cover Case for 11"" 13"" Mac Macbook Air Assorted Color"	256
4380	Dell Inspiron Mini 1010 IM10v-USE032AM 10.1-Inch Netbook Carrying Case Deluxe Bag - Black	256
11272	"Wenger 16"" Pillar Notebook Briefcase"	256
4229	"MOBILE EDGE, Mobile Edge ScanFast Onyx MESFOBP Checkpoint Friendly 16"" Notebook Case Catalog Category: Accessories / Carrying Cases"	256
43042	Laptop Briefcase	256
22765	Male Brown Vintage England Style Leather Business Handbag Briefcase Laptop Bag 811025 	256
22038	"15"" Men's Genuine Leather Messenger for laptop, office, book School Bag B 172"	256
67	"2015 Combat Retina 13 Inch Hard Case for Macbook Pro Retina 13.3"" Matte Shell Cover Blue"	256
9384	McKlein USA Beverly Leather Laptop Case	256
4380	Notebook Carrying Case by HP	256
11272	"Mobile Edge - Sumo Red 15"" Purse"	256
23271	Targus CNP1 Case Notepac Plus	256
43042	Fujitsu LifeBook AH572 3D 15.6 Inch Notebook Laptop Nylon Carrying Case with Extra Internal and External Compartment Pockets Color Black / Grey + NuVur  Keychain (ND15PNK1)	256
33613	Asus Eee PC 1000HE-BLU002X 10.1 Inch Netbook Laptop Hard Nylon Case with External Micro Suede Pocket, Color Black / Blue + NuVur  Keychain (ND10LXB1)	256
40997	JxSar Laptop Case for Macbook Pro 15.4 Inch Material Plastic Texture Smooth Color Green	256
19778	Shaista Handicraft Vintage Leather Macbook Briefcase Office Laptop Bag 18 Inches Brown	256
22765	Whatland Vintage Leather Briefcase Laptop Messenger Bag Tote	256
43042	Magenta / Pink Laptop Bag for 10 inch Asus Eee Pad SL101-B1-BR, 1016PT-BU37, T101MT-EU47 Netbook + An Ekatomi Hook.	256
2055	Slimline Executive Leather Laptop Briefcase Color: Café	256
42835	"Incase Nylon Sleeve w/ Handles for MacBook Pro 15""- Graphite"	256
42835	"HP DFSpecial Circles Pattern Transparent PC Hard Case for MacBook Pro (Assorted Colors) , Purple , 15.4"""	256
42835	Kroo® Blu Life Pure Cases Safari PU Leather Pattern Wallet	256
42835	"HP DF Fire Pattern Transparent PC Hard Case for MacBook Pro Assorted Colors , Blue , 15.4"""	256
40637	"Targus - CityLite Laptop 15.6"" Laptop Case, 13-1/4 x 3-1/2 x 16-1/2, Black"	256
43042	Toshiba 13.3 inch notebook laptop Portege R830-s8320 Carry Case	256
11272	MOBILE EDGE express notebook case MEEN01	256
2055	"Hidesign Charles Leather 15"" Laptop Compatible Briefcase Work Bag"	256
2748	Acer Aspire One AO751h-1145 11.6-Inch Netbook Executive Laptop Carrying Bag with 12v Car and Wall Charger	256
19035	"Planet Tree 15"" 15.4"" 15.6"" Inch Notebook Laptop Case Sleeve Carrying Bag with Hidden Handle for Macbook Pro 15 15.4 Retina/dell Inspiron 15r Vostro XPS Alienware M15x /Asus A55 K55 N56 X54 /Sony E15 S15 El2 /Lenovo Thinkpad E530 /Hp Acer/toshiba Satellite"	256
30263	McKleinUSA ASHBURN 15145 Black Leather Leather Laptop Case	256
17005	"Popular Customized Fashion Animal Laptop Bag For Men's Gift (15""15.4""15.6"") For Macbook Pro Lenovo ThinkPad ASUS Apple DELL acer HP Microsoft SAMSUNG TOSHIBA - CB-15-15918"	256
42835	"HP DF Mind-mapping Pattern Transparent PC Hard Case for MacBook Pro (Assorted Colors) , Yellow , 13.3"""	256
43042	Blue Laptop Bag for 15.6 inch Asus K52F-BBR9 Notebook + An Ekatomi Hook.	256
17760	Frosted Folio Hard Shell Laptop Case for MacBook Pro 13.3'' (Assorted Colors)	256
19035	Wonderful Life Iceage Bag with Hidden Handle for 15-inch MacBook, Acer, ASUS, Dell, HP, Lenovo, Sony, Toshiba	256
11272	The Bostonian Checkpoint Friendly Leather Laptop Computer Briefcase - Black	256
42835	"HP DF Artistic Work of Grids Pattern Transparent PC Hard Case for MacBook Pro (Assorted Colors) , Green , 15.4"""	256
37923	"Lenovo 4X40E77325 PROFESSIONAL Carrying Case (Briefcase) for 15.6"" Notebook"	256
4475	"Samsonite Corporation Business Laptop Briefcase, 16-3/4""X4-1/2""X12', Black"	256
43042	Black Laptop Bag for 15.6 inch Dell Vostro-1510 Notebook + An Ekatomi Hook.	256
42835	"HP DF Modern Life Pattern Transparent PC Hard Case for MacBook Pro (Assorted Colors) , Rose , 13.3"""	256
40091	Manhattan 421560 Notebook Briefcase by Manhattan Products	256
4380	ARCHOS 10 10.2-Inch Netbook Carrying Case - VersaSport Bag - Black	256
16816	"Mobile Edge - 16"" Pc/17"" Macbook(R) Select V-Load Nylon Case (5 Pieces) - Mobile Edge - 16"" Pc/17"" Macbook(R) Select V-Load Nylon Case Fits Notebooks With Up To 16"" Screens Or Macbook(R) With Up To 1"	256
22765	"ArcEnCiel® 17"" Laptop Notebook Bag Briefcase School Handbag"	256
23558	Mobile Edge MECTEK1 Mobile Edge Mectek1 16 Komen Eco-Friendly Tote	256
21516	Mebont Hard Case for Macbook Pro 13'' Art Pattern Rubber Coated Laptop Computer Shell Cover MMP13 A1278	256
11272	"Mobile Edge Mebppt Premium Carrying Case for 17.3"" Notebook, Black/Camo"	256
43402	"TARGUS CN616US / CN616US Carrying Case (Briefcase) for 16"" Notebook - Black, Red"	256
25961	American Shield computer notebook Laptop backpack.ASBZ1630-E1	256
32645	Full Grain Leather 4 Pipes & Tobacco Case with Compartment Columbus	256
6256	Acer Aspire One AOA110-1831 8.9-Inch Netbook Carrying Bag Case with 12v Car and Wall Charger - Black / Grey	256
43042	Red Laptop Bag for 15 inch Gateway NV58-320 Notebook + An Ekatomi Hook.	256
22765	Scully Glazed Calf Leather Laptop Briefcase H250, Brown	256
42770	Jack Georges Platinum Collection Flapover Leather Laptop Briefcase	256
43402	VanGoddy Wave Briefcase / Messenger Bag for Toshiba 14 to 15.6-inch Laptops (Magenta)	256
17005	"Popular Customized Fashion Animal Laptop Bag For Men's Gift (15""15.4""15.6"") For Macbook Pro Lenovo ThinkPad ASUS Apple DELL acer HP Microsoft SAMSUNG TOSHIBA - CB-15-16158"	256
25961	American Shield computer notebook Laptop backpack.ASBZ1630-E1	256
10515	"Case Logic Vnci-215blk Notebook Case 15.6"""	256
40091	"17"" Empire Notebook Computer Briefcase - Black"	256
16372	"Premium Ultimate Work Tote, Business Women's Laptop Tote Bag With Padded Removable Compartment For Computer Up To 14.5"" - RED"	256
2748	Acer Aspire One AO751h-1080 11.6-Inch Travel Laptop Carrying Bag	256
42503	Expandable Laptop Briefcase - Black	256
43042	"iView 780PTV Portable 7"" 16:9 ATSC LCD TV KROO Cube Case Carrying Bag Sleeve Briefcase Pouch Eva Blue + Includes a 4-inch Determination Hand Strap"	256
11272	Mobile Edge Women?s Netbook Briefcase - notebook carrying case MEUWBC -	256
22112	Treasure Valley Pc Rainbow Hard Case for Macbook Pro 13.3 Inch A1278.macbook Pro Case Macbook A1278 Case Rainbow 	256
19703	MWS03 Business Briefcase Laptop Shoulder Bag Additional Color Men's Handbag Casual Leather Satchel Messenger...	256
42503	"Targus TSB702US Drifter II Plus TSB702US Carrying Case for 16"" Notebook, Black/Gray"	256
13645	Uniquely designed SumacLife Brand Black Ultra Durable Reinforced 13 Inch Cady Hard Shell Sports Bag for all models of the Acer Aspire S5 13.3 Inch Ultrabook Acer Aspire, S3 Series, Windows 8, S3-391-6676, Champagne	256
19242	Canyon Outback Leather Willow Rock 16-Inch Leather Computer Briefcase - Brown	256
25961	American Shield computer notebook Laptop Daypack Backpack.ASBZ1630-C6	256
4380	Dell Inspiron Mini IM10-USE024AM 10.1-Inch Netbook Carrying Case Deluxe Bag - Black 	256
6584	"Samsonite Quantum Rolling Toploader Laptop Bag - Notebook carrying case - 15.6"" - black - QUANTUM WHEELED CASE 15.6IN LAPTOPS BLK"	256
1508	Vintage Leather Bazaar Real Goat Hide Laptop Leather Brifecase Bag 14 Inch Brown	256
21516	Mebont Hard Case for Macbook Pro 13'' Color Pattern Rubber Coated Laptop Computer Shell Cover MMP13 A1278	256
11273	At-Baby Gravity falls mystery Custom Durable Case Carrying Bag for Apple Macbook pro Air Notebook Laptop Sleeve Fits All 15 inch Notebook Laptop(Twin sides)	256
10515	Case Logic ZLC-116 Professional 16-Inch Laptop Case Black	256
20485	HP ProBook 6360B-LG633ET Laptop Case - Red Awesome Bloom	256
17005	Tucano Tema MacBook Pro Bag	256
28645	Wonderful Life Rubberized Hard Shell Cover Case Sky Blue For 15.4-inch Apple MacBook Pro	256
22765	Clava Vachetta Leather XL Laptop Briefcase	256
42835	"HP DFArtistic Work of Fish Pattern Transparent PC Hard Case for MacBook Pro (Assorted Colors) , Green , 13.3"""	256
42439	Speck Products SmartShell Case for MacBook Pro Retina 15-Inch, Poppy Red (SPK-A2359)	256
4380	rooCASE 2n1 Netbook Carrying Bag with 12v Car Charger for Toshiba Mini Notebook NB305-N410BL 10.1-Inch Blue (Versasport Series - Black)	256
36727	Patent Croc Laptop Briefcase Color: Brown	256
43402	Laptop Bag,CoolBELL® Polyester Bubble Padded 14 - 14.4 Inch Laptop / Notebook / MacBook / Netbook / Chromebook Computer Carrying Case Briefcase Shoulder Bag with Strap and Handles - Blue	256
22765	Zettino Mini-Messenger Bag Briefcase Nubuck Brown Leather Bag	256
43042	"Kroo Fashion Business Waterproof PVC Leather Briefcase Laptop Case Messenge Shoulder Bag Eco-friendly Green Checkpoint-Friendly for Gigabyte-14"" Ultrabook U2442N"	256
11272	Mobile Edge MESSM1-15 15	256
25961	American Shield computer notebook Laptop Daypack Backpack.ASBZ1630-E2	256
16816	Mobile Edge Mewhcs Herringbone Briefcase For 14.1 Notebooks (Small) (Mobile Edge MEWHCS)	256
11272	"MOBILE EDGE MEBCT8 14.1"" PC/15"" MacBook R Tech Briefcase, Brown"	256
10515	"CASE LOGIC VNA-210B 10"" Netbook Case"	256
10515	Case Logic 16 Notebook Shuttle Black	256
8540	Solo Tech Collection CheckFast Laptop Portfolio Case, Clamshell Design, Airport Security-Friendly Case for Laptops up to 15.6 Inches, Black, TCB310-4	256
67	"2014 Blossom Retina 15 Inch Flower Blossom Hard Case for Macbook Pro Retina 15.4"" Matte Shell Cover"	256
25492	Gene Autry - Advanced Graphics Life Size Cardboard Standup	256
4380	rooCase Acer Aspire Timeline AS3810T-8640 13.3-Inch Laptop Carrying Case - Black Deluxe Bag	256
42835	HP DF Novelty Deerskin Foldable PC Body Protact Case for 13.3 Macbook Pro (Assorted Colors) , Purple	256
18720	Black Briefcase Carrying Case for 14/ 15.4 inch laptops	256
32137	16 Laptop Briefcase 16in Professional Laptop Briefcase	256
4380	rooCASE Netbook Carrying Bag for Acer Aspire One 10.1-Inch AOD260-2440 Netbook - Deluxe Black	256
8540	Solo US Luggage Checkfast Laptop Sleeves w/Grip Solo	256
41563	MT.MIT Men's Transverse Business Portable Briefcase Laptop Bag Coffee	256
19157	SumacLife Cady Briefcase Carrying Bag for HP Pro Slate 10 EE G1 10.1-inch Tablet	256
9384	McKlein USA Irving Park 15.4 Laptop Case	256
42439	Speck Products See Thru Hard Shell Case for MacBook Pro 15-Inch Aluminum Unibody Only, Raspberry SPK-A0469	256
30263	Royce Leather Vaquetta Triple Compartment Laptop Briefcase Black	256
11272	Mobile Edge Express Notebook Case- 16-Inch PC/17-Inch Mac	256
42503	Royce Leather 17 Laptop Briefcase - Black	256
14694	"Caseflex HP X360 Stream Premium Protective 11.6"" Laptop Shoulder Bag Carry Case - Black"	256
33613	Asus Eee PC Seashell 1001PX 10.1 Inch Netbook Laptop Hard Nylon Case with External Pocket, Color Grey + NuVur  Keychain (ND10N2E1)	256
2255	Macbook Pro 15inch Case Cover,Beebiz Full Body Plastic Rubberized Hard Case for 15-Inch MacBook Pro 15'' Cover Shell(Love)	256
43042	Designer Leather Laptop Briefcase Tote Bag with Shoulder Strap, Large, Black	256
43042	Blue Laptop Bag for 15.6 inch Dell M5030-2792B3D Notebook + An Ekatomi Hook.	256
6256	Acer Aspire One AOD250-1610 10.1-Inch Netbook Carrying Bag Case with 12v Car and Wall Charger - Dark Blue / Grey	256
