40091	Manhattan 421560 Notebook Briefcase	256
9612	Soho PadFolio Smart Stand Alone Cover Case Durable Premium Design For Ematic EGLIDE Pro X / XL Pro / XL Pro II / 4 XL / Pro Series EXLB3B / EXLP3P / XL Pro II Android Touch Screen Tablet Mobile Computer + Includes a Windshield Car Mount with Auxilary Cable AUX 	256
43042	"Kroo Fashion Business Waterproof PVC Leather Briefcase Laptop Case Messenge Shoulder Bag Eco-friendly Green Checkpoint-Friendly for Asus-Vivobook 14"" Touch-Screen Laptop S400CA-DB51T"	256
4380	Promax DC-236 Carrying Bag for Models MC-377 and MC-277 Spectrum Monitor	256
36634	Basico 15.6-inch Laptop and Tablet Computer Briefcase	256
4380	Targus 10.2 Intersection Netbook Case	256
22765	LB1 High Performance New Leather Briefcase for HP Pavilion DM4-1162US Notebook Laptop Dark Brown Full-grain Leather Laptop Messenger Bag Business Travel Crossbody Case	256
11272	Mobile Edge Heritage Select Briefcase - notebook carrying case MEBCS1 -	256
19035	"Flower Feather 15"" 15.4"" 15.6"" Inch Notebook Laptop Case Sleeve Carrying Bag with Hidden Handle for Macbook Pro 15 15.4 Retina/dell Inspiron 15r Vostro XPS Alienware M15x /Asus A55 K55 N56 X54 /Sony E15 S15 El2 /Lenovo Thinkpad E530 /Hp Acer/toshiba Satellite"	256
43042	TOSHIBA 13.3 inch Notebook Laptop Case Portege R705-P42 Carrying Case with Pockets Choose Your Favorite Color + EnvyDeal Velcro Cord Tie	256
43042	Green Bella Russo Leather Laptop Briefcase Color: Honey	256
9384	McKlein USA Siamod Serra Leather Ladies Laptop Tote - Black	256
4380	HP Mini 1010NR 8.9-Inch Netbook Carrying Bag Case Classic Series - Dark Blue / Black	256
17005	"Cool Print Custom ( Animals eagle hares art bird feathers mountains ) Laptop Bag For Men's Gift (15""15.4""15.6"") For Macbook Pro Lenovo ThinkPad ASUS Apple DELL acer HP Microsoft SAMSUNG TOSHIBA - CB-15-11353"	256
42439	Speck Products SmartShell Case for MacBook Pro Retina 13-Inch, Ultraviolet Purple (SPK-A2355)	256
20485	Kenneth Cole Reaction R-Tech Laptop Notebook Computer Flap Over Briefcase - Black	256
25961	American Shield computer notebook Laptop backpack.ASBZ1630-C1	256
43042	Sumo Men's Laptop Case	256
43402	Evecase Dell Latitude D630, E6420 14/14.1-Inch Notebook PC Nylon Polyester Blend Carrying Bag with Handles and Shoulder Strap - Gray	256
19242	Stebco Black Rolling 17-inch Laptop Business Case	256
22765	"Men's Genuine Leather Business Case Briefcase Portfolio Tote Attache 13"" Laptop Bag Blue"	256
1508	Stebco Leather Look Computer Briefcase	256
16088	Mesh Slim Line Carrying Bag Case for HP Spectre XT Pro 13.3-inch Ultrabook Laptop	256
19242	Solo Sterling Executive Rolling Computer Case with Telescoping Handle for 16-Inch Laptops STL905-4	256
36634	Nine States 14.4 Inch Slim Fit Shakeproof Computer Laptop Bag Tablet Briefcase Notebook Handbag Green	256
4380	rooCASE Netbook Carrying Bag for Dell Inspiron Mini iM1012-738IBU 10.1-Inch Netbook Ice Blue (Classic Series - Red)	256
17005	"Popular Customized Fashion Animal Laptop Bag For Men's Gift (15""15.4""15.6"") For Macbook Pro Lenovo ThinkPad ASUS Apple DELL acer HP Microsoft SAMSUNG TOSHIBA - CB-15-16638"	256
30263	McKleinUSA OHARE 86534 Brown Leather Fly-Through(TM) Checkpoint-Friendly 17  Detachable Wheeled Laptop Case	256
40997	SwitchEasy Cocoon Plastic Case for 13-Inch MacBook Pro, Milky White SW-COCPRO13R-W 	256
36634	Nine States 14 Inch Slim Fit Computer Laptop Bag Tablet Briefcase Grey	256
40091	MANHATTAN Times Square Notebook Computer Briefcase 421430 	256
23444	Adrienne Vittadini Doctors Briefcase Laptop Tote	256
9774	Genuine Leather Laptop Shoulder Bag Briefcase Color: Chocolate	256
4380	Dell Inspiron Mini IM10v-USE006AM 10.1-Inch Netbook Carrying Bag Case Classic Series - Red / Black 	256
11846	Rioni Signature Brown - Laptop Briefcase Roller	256
43042	Red Laptop Bag for 15 inch Asus A53E-TH52 Notebook + An Ekatomi Hook.	256
40997	JxSar Laptop Case for Macbook Pro 13.3 Inch Material Plastic Texture Smooth Color Dark blue	256
8540	UNITED STATES LUGGAGE D5353 Executive Leather Briefcase, 16quot;, 16 1/2 x 5 x 13, Espresso	256
18720	Red Cube Case for ASUS Eee PC Seashell 1001P-PU17-WT 10.1-Inch White Netbook	256
43042	Red Laptop Bag for 15 inch Dell Vostro-1500 Notebook + An Ekatomi Hook.	256
10515	Case Logic 16 Brown Slimline Laptop Attaché	256
14694	"Caseflex Asus X205TA Premium Protective 11.6"" Laptop Shoulder Bag Carry Case - Black"	256
22765	LB1 High Performance New Leather Briefcase for HP Pavilion DV4-1275MX Notebook Laptop Dark Brown Full-grain Leather Laptop Messenger Bag Business Travel Crossbody Case	256
22765	LB1 High Performance New Leather Briefcase for Toshiba PA3465U-1BRS Notebook Laptop Dark Brown Full-grain Leather Laptop Messenger Bag Business Travel Crossbody Case	256
4380	rooCASE Netbook Carrying Bag for HP Mini 210-2150NR 10.1-Inch Netbook Silver - Classic Series Dark Blue / Black	256
43042	Black Laptop Bag for 15.6 inch Asus K52F-BBR9 Notebook + An Ekatomi Hook.	256
11272	"Mobile Edge ScanFast Checkpoint Friendly Women's Element Laptop Bag - 16""PC /"	256
43042	12 Inch Netbook Red Case with Pockets for Dell Latitude E6220 Includes EnvyDeal Velcro Cable Tie	256
10515	"ALIENWARE AWP01 11.6"" M11x Portfolio Netbook Case"	256
10515	"Case Logic Computer Briefcase, Holds 15.4"" Laptops, Color: Black."	256
43042	Red Laptop Bag for 15 inch Lenovo G570-43342KU Notebook + An Ekatomi Hook.	256
36634	Johnston & Murphy Slim Zip Top Laptop Briefcase Black	256
6256	Acer Aspire One AOA150-1690 8.9-Inch Netbook Carrying Bag Case with Car Charger - Black / Grey	256
8540	"Solo - Solo 28 Wand Shutoff Valve"""	256
2055	Simulated Leather Executive Briefcase Laptop	256
25961	American Shield computer notebook Laptop backpack.ASBZ1630-C6	256
18720	Grey/SilverDell Latitude E6320 13-Inch Nylon Laptop Carrying Cover Case with Durable Handle and External Pocket...	256
16088	Tekit Briefcase for 13-inch Macbook Pro & Macbook Air & Ipad Bag (Brown)	256
36634	Nine States 13.3 Inch Slim Fit Shakeproof Computer Laptop Bag Tablet Briefcase Notebook Handbag Black	256
40997	JxSar Laptop Case for Macbook Pro 15.4 Inch Material Plastic Pattern Yellow Leopard	256
4380	rooCASE Netbook Carrying Bag for Samsung 10.1-Inch N150-JP06 Netbook - Deluxe Black / Pink	256
1658	G-LIFE Men's Genuine Leather Business Briefcase Casual Laptop Toting Messenger	256
25961	American Shield computer notebook Laptop backpack.ASBZ1630-E1	256
22765	"Tanboo Exquisite Laptop Case Handbag Bag for 13"" Notebook Laptop (Black)"	256
42468	"13"" 13.3"" Heart Pattern Laptop Sleeve Bag Case Pouch w Hidden Handle for HP Folio"	256
11273	At-Baby Twenty one pilots Custom Durable Case Carrying Bag for Apple Macbook pro Air Notebook Laptop Sleeve Fits All 15 inch Notebook Laptop Twin sides	256
20485	Faux Leather Cube Briefcase For HP Pavilion 13 x2 Spectre x2 Split x2 w/ base 13.3-inch Tablet PC	256
6584	"Mobile Edge 16"" SlipSuit - Notebook carrying case - 16"" - black, platinum"	256
26436	New Rivacase 8120 Nylon Padded Shock-Absorbing Bag For 13.3 Inch Netbook, Dark Grey	256
42835	Kroo® Blu Life Pure Mini Cases Safari PU Leather Pattern Wallet	256
10515	"V7 - Professional 13"" Front-Loading Notebook Case"	256
43042	Blue Laptop Bag for 15.6 inch Samsung RF511-S04AU Notebook + An Ekatomi Hook.	256
11272	"Mobile Edge - 15.4"" Select Briefcase Black"	256
4380	rooCASE Netbook Carrying Bag for ASUS Eee PC 1005PEG-MU17-BK 10.1-Inch 3G Netbook Black - Classic Series Black	256
43042	Dell Inspiron 15R 15.6 Inch Notebook Laptop Nylon Carrying Case with Extra Compartment Pockets Color Black / Green + NuVur  Keychain (ND15SEG1)	256
22765	Clava Vachetta Leather XL Laptop Briefcase	256
43402	"Premium Notebook Case Golla BLOCK-15,4"" Laptop Bag Designed in Finland - Brown"	256
43042	"Kroo Fashion Business Waterproof PVC Leather Briefcase Laptop Case Messenge Shoulder Bag Eco-friendly Green Checkpoint-Friendly for Lenovo-IdeaPad Ultrabook 14"" Laptop 43762CU"	256
36727	Charisma Leather Laptop Briefcase Color: Brown	256
34327	"Coosbo? Matt Rubberized Hard Cover Case for 13"" 15"" Mac Macbook Pro (Assorted Color)"	256
43042	Black Laptop Bag for 10 inch HP mini 110-3530NR, mini 210-2060NR Netbook + An Ekatomi Hook.	256
43042	RivaCase 8132 15.6 inch Bag for Laptop - Brown	256
9774	Genuine Leather Laptop Bag for Men	256
43042	"12 Inch Netbook Red Case with Pockets for Samsung 12.1"" Chromebook XE500C21-A04US Includes EnvyDeal Velcro Cable Tie"	256
11272	"MOBILE EDGE 17"" geneva large notebook handbag (black) MEGN1L"	256
24777	Eastide Briefcase Style Bag	256
2989	Acer Aspire One AO532H-2742 10.1 Inch Netbook Silver Matrix 	256
42835	"HP DF Fire Pattern Transparent PC Hard Case for MacBook Pro (Assorted Colors) , Black , 13.3"""	256
8540	"Solo Pro 16"" Laptop Slim Brief, Black, CLA116-4"	256
43889	KENSINGTON 62533 Contour Balance Netbook Case,18w x 9d x 13-1/2h, Black	256
22765	Haoyue® Leather Men's Brown Laptop Bag Briefcase Handbag Messenger Brown	256
42835	"HP DF Modern Life Pattern Transparent PC Hard Case for MacBook Pro (Assorted Colors) , Black , 13.3"""	256
6256	Acer Aspire One AOD150-1920 10.1-Inch Lightweight Checkpoint Friendly Netbook Bag with Home Wall Charger - Grey Black	256
6256	Acer Aspire One AOD150-1669 10.1-Inch Lightweight Checkpoint Friendly Netbook Bag with Home Wall Charger - Blue Black	256
9774	Zenness Genuine Leather Men's Briefcase Laptop Handbag Travel Shoulder Bag	256
26677	"Customized Creative Flowing Color Series Colorful Swirl Special Design Water Resistant Hard Case for Macbook Air 11"" (Model A1370/a1465)"	256
4681	Allstate Leather Men's AL2600 Leather Duster	256
4502	Ostrich Series Multi-functional Notebook Women's Tote PU Leather Handle Briefcase Handbag Office Tote Laptop Bag for 14-inches Dell/ Hp/ Lenovo/ Sony/ Toshiba/ Asus/ Acer/ Samsung Laptop/ 13-inches Macbook Air MacBook Pro - Red	256
13960	Everki Advance Laptop Bag - Briefcase, Fits up to 16-Inch EKB407NCH	256
29782	Excellent Travel Gear computer notebook Laptop teblet inch Backpack.SA8089-C1	256
4380	rooCASE 2n1 Netbook Carrying Bag with Wall Charger for MSI Wind U123-025US 10.2-Inch Netbook Red (Versasport Series...	256
4380	Acer Aspire One AO751h-1346 11.6-Inch Deluxe Netbook Carrying Case - Black	256
43042	12 black-Red Trim Laptop Case + SumacLife TM Wisdom Courage Wristband	256
1658	Yowamushi Pedal Genuine Leather Pass Case Print Hakone Gakuen C school Anime	256
4380	Acer Aspire AS1410-2285 11.6-Inch Netbook Carrying Bag Case Classic Series - Dark Blue / Black 	256
32137	"16.5"" Cowhide Leather Pro Briefcase Laptop Case L66 - Coffee Brown"	256
10515	CASE LOGIC LNEO-12B 12'' NETBOOK ATTACH? CASE LOGIC LNEO-12B 12'' NETBOOK ATTACH?	256
4229	MOBILE EDGE MESFEBX 16quot; PC/17quot; MacBook R ScanFast TM Element Briefcase Pink Suede	256
6584	"Mobile Edge Signature Tote - Notebook carrying case - 15.6"" - faux crocodile black"	256
1705	"Blue Butterfly Design Full-Body Protective Plastic Case for MacBook Pro 13""/15"" (Non-Retina)"	256
22765	LB1 High Performance New Leather Briefcase for HP Pavilion DV4-2170US Notebook Laptop Dark Brown Full-grain Leather Laptop Messenger Bag Business Travel Crossbody Case	256
43042	Black Laptop Bag for 15.6 inch Dell M5030-2792B3D Notebook + An Ekatomi Hook.	256
11272	Mobile Edge Alienware Vindicator	256
22765	LB1 High Performance New Leather Briefcase for Hp Compaq 572032-001 Notebook Laptop Dark Brown Full-grain Leather Laptop Messenger Bag Business Travel Crossbody Case	256
9612	Soho PadFolio Smart Stand Alone Cover Case Durable Premium Design For Ematic EGLIDE Pro X / XL Pro / XL Pro II / 4 XL / Pro Series EXLB3B / EXLP3P / XL Pro II Android Touch Screen Tablet Mobile Computer + Includes a Windshield Car Mount with Auxilary Cable AUX 	256
20485	Navitech Black Sleek Premium Water Resistant Shock Absorbent 13 to15.6 Laptop/ Netbook/ Notebook Carry Bag Case For ACER Aspire 5742Z , Acer Aspire TimelineX 5830T, Acer Aspire TimelineX 4830T	256
11272	Mobile Edge Alienware Orion ScanFast Checkpoint Friendly Tactical Briefcase AWBC17C	256
42468	"Red 13"" 13.3"" Notebook Laptop Double Zipper Sleeve Bag Case w Handle for HP"	256
43042	Sumdex Altitude II Laptop Briefcase	256
19035	"Racing Car 15"" 15.4"" 15.6"" Inch Notebook Laptop Case Sleeve Carrying Bag with Hidden Handle for Macbook Pro 15 15.4 Retina/dell Inspiron 15r Vostro XPS Alienware M15x /Asus A55 K55 N56 X54 /Sony E15 S15 El2 /Lenovo Thinkpad E530 /Hp Acer/toshiba Satellite"	256
15183	"Mobile Edge Alienware Vindicator Carrying Case Tote for 17.1"" Notebook - Black - Scrape Resistant Interior, Scratch Resistant Interior, Weather Resistant Exterior - Nylon - Alienware Logo, Alien Head Logo - AWVSC17"	256
14263	Kinmac 2015 New Design Bohemian Laptop Briefcase Laptop Sleeve for Macbook Air/macbook Pro/dell/hp/lenovo/sony/toshiba/ausa/acer/samsung Laptop Case (New Bohemian laptop briefcase without handle, 15inch/15.6inch/macbook pro 15)	256
16816	Mobile Edge Slimline Ultrabook Briefcase for 14.1-Inch PC/13-Inch Mac, fits all iPad generations including iPad4 Black/Orange	256
32137	"Vagabond Traveler 16.5"" Cowhide Leather Pro Briefcase Laptop Case L64. Black"	256
22765	Samsonite Business Cases Leather Expandable Portfolio Laptop Computer Case	256
32137	"16.5"" Oil Tanned Cowhide Leather Pro Briefcase Laptop Case. L41.BLK"	256
15183	Kensington SaddleBag Black Trim - Notebook carrying case - black 64079 *	256
43042	Black Laptop Bag for 15.6 inch Lenovo G570-43344QU Notebook + An Ekatomi Hook.	256
1705	"Flower Design Full-Body Protective Plastic Case for MacBook Pro 13""/15"" (Non-Retina)"	256
7514	Fabric Business Briefcase Laptop Bag Notebook Computer Tablet Bag For 15 Inch Laptop Batman Logo Print.	256
40997	JxSar Laptop Case for Macbook Pro 13.3 Inch Material Plastic Pattern Purple Leopard	256
8540	"Solo Premium Leather 16"" Laptop Attaché, Hard-sided with Combination Locks, Black, 488"	256
43042	Black Laptop Bag for 15 inch Dell Alienware M15X-211CSB Notebook + An Ekatomi Hook.	256
17005	"Popular Customized Fashion Animal Laptop Bag For Men's Gift (15""15.4""15.6"") For Macbook Pro Lenovo ThinkPad ASUS Apple DELL acer HP Microsoft SAMSUNG TOSHIBA - CB-15-24798"	256
22765	Piel Leather Vertical Laptop Tote	256
32137	"SOLO Classic 16"" Leather Briefcase Briefcase Black"	256
4380	rooCase 3n1 Combo - Dell Inspiron Mini IM10-USE010AM 10.1-Inch Netbook Carrying Bag Case with 12v Car and AC Adapter Wall Charger - Dark Blue / Black Classic Series	256
43042	"Acer 13.3"" AS3830T-6870 Laptop Hard Carry Case Bag + An Ekatomi Hook."	256
43042	Targus Corporate Traveler Topload Case for 14 Inch Laptops, Checkpoint Friendly (CUCT02UA14S)	256
6021	Laptop Briefcase Color: Grey	256
2989	Acer Aspire One 10 inch Netbook Extra Pocket Blue Case with Handle + SumacLife TM Wisdom Courage Wristband for Netbooks	256
6256	ASUS Eee PC 900HA 8.9-Inch Lightweight Checkpoint Friendly Netbook Bag + Screen Protector - Tan Black	256
6584	"Boyt Harness TAC100, Patrolman's Briefcase with Padded 15.4""Laptop Pocket - Black"	256
2748	Acer Aspire One AO751h-1153 11.6-Inch Netbook Executive Laptop Carrying Bag	256
22765	Aerovation CPFR-2A 17 Brown Leather Checkpoint Friendly Laptop Bag	256
19035	"Chocolate Beans 15"" 15.4"" 15.6"" Inch Notebook Laptop Case Sleeve Carrying Bag with Hidden Handle for Macbook Pro 15 15.4 Retina/dell Inspiron 15r Vostro XPS Alienware M15x /Asus A55 K55 N56 X54 /Sony E15 S15 El2 /Lenovo Thinkpad E530 /Hp Acer/toshiba Satellite"	256
17005	"Popular Customized Fashion ( Animals elk ) Laptop Bag For Men's Gift (15""15.4""15.6"") For Macbook Pro Lenovo ThinkPad ASUS Apple DELL acer HP Microsoft SAMSUNG TOSHIBA - CB-15-1758"	256
2748	Acer Aspire 15.6 inch laptop carrying case for Acer Aspire AS5734Z-4725 AS5532-5509 Acer EX5635-6897 Black-Blue + SumacLife TM Wisdom Courage Wristband	256
20485	Faux Leather Cube Briefcase For HP Pavilion 13 x2 Spectre x2 Split x2 w/ base 13.3-inch Tablet PC	256
9612	Soho PadFolio Smart Stand Alone Cover Case Durable Premium Design For Ematic EGLIDE Pro X / XL Pro / XL Pro II / 4 XL / Pro Series EXLB3B / EXLP3P / XL Pro II Android Touch Screen Tablet Mobile Computer	256
30263	McKleinUSA KENWOOD 15564 Brown Leather Double Compartment Laptop Case by McKleinUSA	256
18720	Blue Protective Durable Hard Nylon Cube Carrying Smart Case with Handles // Airport Check-Point-Friendly // For Asus Eee PC 1000 Netbook Notebook 10.1 inch Screen	256
43042	13''13.3'' 13.4'' Inch Laptop Case For Business Fashion Laptop Bag [London Girl]	256
22765	Single Compartment Leather Briefcase w Laptop Case	256
4380	Tyla Rae Paula Series Laptop Bag for Up to 15-Inch (Paula-CB TM)	256
25492	Woman Symbol - Advanced Graphics Life Size Cardboard Standup	256
9384	McKlein USA Roosevelt Leather Detachable-Wheeled Laptop Case	256
43042	17.3 Clamshell Laptop Briefcase	256
40997	JxSar Laptop Case for Macbook Pro 13.3 Inch Material Plastic Texture Smooth Color Grey	256
21516	Mebont Hard Case for Macbook Pro 15'' Color Pattern Rubber Coated Laptop Computer Shell Cover MMP15 A1286	256
43042	"Kroo Fashion Business Waterproof PVC Leather Briefcase Laptop Case Messenge Shoulder Bag Eco-friendly Green Checkpoint-Friendly for HP EliteBook 8470p 14"" Business Notebook PC D8E80UT"	256
43402	Snakeskin-Patterned Laptop Organizer Case with Shoulder Strap, for 15-inch MacBook Pro, Green	256
43911	"Back to School Laptop Bag for 10"" Acer AOD257-1633 N570, AOD260-1270, Aspire One AOD270-1410 Netbook + An Ekatomi Hook. Summer Sale!"	256
30263	15.4 Halsted Brown Double Compartment Notebook Case	256
43042	Biztech CompuCase Laptop Briefcase	256
40091	manhattan 438896 zurich notebook computer briefcase manhattan 438896 	256
11272	Mobile Edge Sumo Women's Laptop Purse - notebook carrying case ME-SUMO99137 -	256
42503	Black Genuine Leather Woman's Laptop Briefcase w/ Cut-out Handles and Bonus Shoulder Strap	256
10515	"CASE LOGIC LNEO-12B 12"" Netbook Attach"	256
44518	"Coosbo? Golden Matt Rubberized Hard Cover Case for 13"",15"" Macbook Pro"	256
11272	Mobile Edge Corporate Laptop Briefcase Black	256
11272	Niño Edge Kushions, Brown	256
43911	Green Laptop Bag for 10 inch HPMini 210-2130NR, mini 210-3060NR Netbook + An Ekatomi Hook.	256
43042	Pink Laptop Bag for Pandigital Novel Android 10 inches. Bonus Ekatomi Stylus	256
4380	Acer Aspire One AO751h-1145 11.6-Inch Netbook Carrying Case Deluxe Bag - Red / Black 	256
16816	"MOBILE EDGE MESFEB9 16"" SCANFAST-MBLMESFEB9"	256
1439	Last Innovation Purple Metallic Hard Case for MacBook Pro 15.4 inch (A1286)	256
8540	Paperthinks Fuchsia San Francisco-Oakland Bay Bridge Large Slim Recycled Leather Notebook, 4.5 x 6.5-inches	256
41339	MLB Tan Leather Porthole Laptop Briefcase	256
22765	LB1 High Performance New Leather Briefcase for HP ProBook 6550B Notebook Laptop Dark Brown Full-grain Leather Laptop Messenger Bag Business Travel Crossbody Case	256
10515	"CASE LOGIC MLA-114GRY 14.1"" Notebook AttachŽ Gray"	256
23271	Targus Citylite Black Grey Nylon Notebook Case Top Loading	256
30263	Mancini Leather Goods Double Compartment Laptop/ Tablet Briefcase Black 	256
42503	Supra Cordura Ballistic Nylon Double Zipper Laptop Briefcase	256
43402	Lowepro Transit Briefcase S Notebook Case with Adjustable and Removable Shoulder Strap (DRET-T-BRIEFCASE-S-6PK) by Lowepro	256
11272	"MOBILE EDGE MECBC1 16"" PC/17"" MacBook R Canvas ECO Briefcase, Black"	256
6256	Acer Aspire One AOD250-1706 10.1-Inch Netbook Carrying Bag Case with Wall Charger - Black / Grey	256
11273	At-Baby Marvel Custom Durable Case Carrying Bag for Apple Macbook pro Air Notebook Laptop Sleeve Fits All 15 inch Notebook Laptop(Twin sides)	256
21516	Mebont Hard Case for Macbook Pro 15'' Art Pattern Rubber Coated Laptop Computer Shell Cover MMP15 A1286	256
10515	"Case Logic 15.6"" Top-Loading Laptop Briefcase, Bl"	256
37320	Dakine School Case, Domain	256
43042	"Winn Harness ""Colombian"" Leather Checkpoint-Friendly Laptop BriefCase"	256
1498	Sage Brown Genuine Leather Brown Kingston Briefcase	256
1658	Andrew Philips Genuine Leather Airline Ticket/Passport Case	256
43042	"NingB Red Mickey Mouse Laptop Bag for 14.1"" Laptop"	256
40091	MANHATTAN 15.6-Inch Empire II Notebook Briefcase (421577)	256
28645	Primitive Pantry Still Life Canvas	256
32137	"Vagabond Traveler 16.5"" Cowhide Leather Pro Briefcase Laptop Case L66. Black"	256
19703	Zenness Canvas Leather Men's Briefcase Crossbody Bag Tote Bag	256
4380	rooCASE 2n1 Netbook Carrying Bag with 12v Car Charger for Samsung N220-11 10.1-Inch Netbook Green Pointillism Pattern (Versasport Series - Black)	256
36727	Old Leather Laptop Briefcase Color: Cognac	256
2989	Acer Aspire One 522-BZ465 10.1 Inch Netbook Laptop Hard Nylon Case with External Pocket, Color Grey + NuVur  Keychain (ND10N2E1)	256
6256	Acer Aspire One AOD250-1924 10.1-Inch Netbook Carrying Bag Case with Car Charger - Black / Grey	256
25961	American Shield computer notebook Laptop backpack.ASBZ1630-C6	256
23623	"Gun Metal Aluminum 17"" Laptop Case/ Aluminum Briefcase"	256
43042	"15"" Black Shoulder Handbag Notebook Laptop Carry Case"	256
4380	Pink Cube Case for Toshiba Mini 300 Series NB305-N310 10.1-Inch Netbook - Black Onyx	256
23271	Targus Targus Leather Notebook Case-carrying Case-black	256
39011	"Juzihao Rubberized Snap-on Hard Shell Plastic Case Shell Cover Skins for Macbook Pro 13"" (Peony Flower Pattern)"	256
43042	Blue Laptop Bag for 15.6 inch Acer AS5750-6636 Notebook + An Ekatomi Hook.	256
4681	Blueblue Sky Men's Excellent Vintage Leather Laptop Briefcase Chocolate Brown#7167q	256
42835	"HP DF Primitive Battle Pattern Transparent PC Hard Case for MacBook Pro (Assorted Colors) , White , 13.3"""	256
20485	Targus Checkpoint-Friendly Mobile Elite Laptop Bag for 15.4 Inch Laptops TBT045US Black	256
11272	Mobile Edge Premium Tote Case - Top-loading - Mic	256
8540	"SOLO 15.6"" Laptop Rolling Case"	256
19703	Cateep Professional Leather Full Grain Briefcase Messneger Shoulder Bag	256
22765	Commuter Leather Laptop Briefcase, CHOCOLATE, Size 1 Size	256
30263	McKlein USA Roseville - Fly-Through Checkpoint-Friendly Removable Rolling Ladies Laptop Case Orange - McKlein USA Ladies' Business	256
6584	Giorgio Fedon 1919 - Italian Leather Laptop Case - Dark Brown	256
21516	Mebont Hard Case for Macbook Pro 15'' galaxy Pattern Rubber Coated Laptop Computer Shell Cover MMP15 A1286	256
10515	"CASE LOGIC VNCI-215BLK NOTEBOOK CASE 15.6"""	256
34327	"Coosbo? Matt Rubberized Hard Cover Case for 13"" 15"" Mac Macbook Pro (Assorted Color)"	256
43042	Biztech CompuFlyer Laptop Briefcase	256
22765	Netpack Leather Laptop Business case	256
14263	Abbi Mina Slim Briefcase for MacBook Pro 17-inch Ivory	256
42835	"HP DF Solid Color Frosted PC Hard Case for MacBook Pro 15""(Assorted Colors) , Yellow"	256
8540	"SOLO 16"" Laptop Slim Brief"	256
32645	"McKlein - 17"" Walton Expandable Double Compartment Leather Laptop Case with Removable Sleeve"	256
20485	Targus Checkpoint-Friendly Mobile Elite Laptop Bag for 15.4 Inch Laptops TBT045US Black	256
1705	"Vintage Flower Design Full-Body Protective Plastic Case for MacBook Pro 13""/15"" (Non-Retina)"	256
4380	HP Mini 110-1115NR 10.1-Inch Netbook Carrying Bag Case Classic Series - Dark Blue / Black 	256
43042	Black Laptop Bag for 15.6 inch Asus N53SV-A2 Notebook + An Ekatomi Hook.	256
32137	"Vagabond Traveler 14"" Medium Leather Briefcase Laptop Bag L39.Vintage Brown"	256
17005	"Cool Print Custom ( Animals dog puppy grass ) Laptop Bag For Men's Gift (15""15.4""15.6"") For Macbook Pro Lenovo ThinkPad ASUS Apple DELL acer HP Microsoft SAMSUNG TOSHIBA - CB-15-9673"	256
4229	2296132 ONYX WOMEN LAPTOP BRIEFCASE - CHECKPOINT FRIENDLY - HOLDS 16 PC OR 17 MAC SCREEN	256
43042	Red Laptop Bag for 15 inch Sony VAIO PCG-FRV37 Notebook + An Ekatomi Hook.	256
43042	Green Laptop Bag for 15.6 inch Gateway EC58-01U Notebook + An Ekatomi Hook.	256
42835	HP DF Fashion Solid Color Foldable Case for 13.3 Macbook Retina (Assorted Colors) , Green	256
6256	Acer Aspire One AOD150-1669 10.1-Inch Netbook Carrying Bag Case with 12v Car and Wall Charger - Dark Blue / Grey	256
4380	Acer Aspire One AOA150-1635 8.9-Inch Netbook Carrying Case Deluxe Bag - Red / Black 	256
11272	"Mobile Edge 16"" Scanfast Briefcase"	256
4380	Acer AOD250-1197 10.1-Inch Netbook Carrying Bag Case Classic Series - Dark Blue / Black 	256
4380	rooCASE 2n1 ASUS Eee PC Seashell 1005HA-MU17-BK 10.1-Inch Black Netbook Carrying Bag Case with AC Adapter Wall Charger - Classic Series - Dark Blue / Black	256
34327	"Coosbo? Matt Rubberized Hard Cover Case for 13"" 15"" Mac Macbook Pro (Assorted Color)"	256
67	"2014 Rainbow 11 Inch Rubberized Hard Case for Macbook Air 11.6"" Matte Shell Cover Aqua Blue"	256
4380	rooCASE 2n1 Lenovo S10-2 10.1-Inch White Netbook Carrying Bag Case with AC Adapter Wall Charger - Classic Series - Dark Blue / Black	256
42146	Andrew Philips Vaqueta Napa Dowel Rod Laptop Briefcase	256
43042	Black Laptop Bag for 15.6 inch Dell N5030-17230BK Notebook + An Ekatomi Hook.	256
36025	Royce Leather 644-5 Black Executive Rolling Laptop Briefcase Black	256
10515	Case Logic Reflexion Case for 17-Inch Laptop RUL-117	256
43042	ONA The Kingston Laptop Briefcase	256
4229	MOBILE EDGE 16 Laptop Brief Case Black / MEBCNP1 /	256
11272	MOBILE EDGE 14.1 cutebug hipster notebook case (pink/burgandy) (#MPCHB01)	256
42835	"HP DF Warm House Pattern Transparent PC Hard Case for MacBook Pro (Assorted Colors) , Rose , 15.4"""	256
31632	"Easygoby Rubberized Matte Silky-Smooth Soft-Touch Hard Case for 13-Inch MacBook Pro 13.3"" Model No.: A1278 Shell Cover - Green"	256
43042	Kroo Fashion Business Waterproof PVC Leather Briefcase Laptop Case Messenge Shoulder Bag Eco-friendly Green Checkpoint-Friendly for Panasonic Toughbook F9 Laptop Notebook	256
8540	"Solo Classic 15.6"" Laptop Tote, Black, K708-4/12"	256
4380	rooCASE Netbook Carrying Bag for Dell 10.1-Inch Latitude 2110 n-series Netbook - Classic Series Black / Dark Blue	256
6256	ASUS Eee PC 904HA 8.9-Inch Lightweight Checkpoint Friendly Netbook Bag + Screen Protector - Grey Black	256
811	PORTER ANGLE 2way Briefcase Business Bag W (B4 Compatible) Black	256
