40091	Manhattan 421560 Notebook Briefcase	256
4380	rooCASE Laptop Carrying Bag for AS3830T-6417 13.3-Inch Laptop - Red Deluxe Bag	256
9384	McKlein USA Hazel Crest Leather 15.4 Laptop Case	256
4380	rooCASE Netbook Carrying Bag for Acer TravelMate TM8172T-3519 Timeline 11.6-inch VersaSport Bag - Black	256
15183	Dell Professional Business Case - notebook carrying case 469-1468 -	256
4315	TUODAWEN(TM) Shockproof 13-Inch Laptop Computer Bag Sleeve Briefcase	256
43042	Black Laptop Bag for 15.6 inch Asus UL50AG-A2 Notebook + An Ekatomi Hook.	256
43042	Kroo SD Card EVA Case (Green)	256
43042	Kroo Fashion Business Waterproof PVC Leather Briefcase Laptop Case Messenge Shoulder Bag Eco-friendly Green Checkpoint-Friendly for Panasonic Toughbook 53 Laptop Notebook	256
43911	Green Laptop Bag for 10 inch Toshiba NB505-N508TQ Netbook + An Ekatomi Hook.	256
6256	Acer Aspire One AOD250-1738 10.1-Inch Netbook Carrying Bag Case with 12v Car and Wall Charger - Black / Grey	256
32616	Crazy Horse Leather Men Briefcase Laptop Bag in Brown	256
17005	"19""Carry Case Laptop Bag For DELL TOSHIBA ACER HP 18.4"""	256
42503	Targus Notebook Case - Top-Loading - Telescoping Handle - Polyester - Black	256
4380	rooCASE Netbook Carrying Bag for Acer Aspire One 10.1-Inch AOD255-2107 Netbook - Deluxe Black / Red	256
10515	"16"" Full-Size Checkpoint Friendly? Executive Notebook Case"	256
43402	"V7 NOTEBOOK CARRYING CASES V7 14.1"" Edge Ultra Slim Laptop Bag with Red Trim. EDGE TOPLOADER RED TRIM FOR 14.1IN LAPTOP CASE. Top Loading - Shoulder Strap - 14.1"" Screen Support - Red"	256
32137	"Cocoon CLB404BR Grid-it Case for up tp 16"" Laptop, Brown"	256
25961	American Shield computer notebook Laptop backpack.ASBZ1630-C4	256
11272	"MOBILE EDGE MESFBP2.0 17.3"" SCANFAST TM BACKPACK-MBLMESFBP20"	256
4380	rooCASE 2n1 Gateway LT2115u 10.1-Inch White Netbook Carrying Bag Case with AC Adapter Wall Charger - Classic Series - Dark Blue / Black	256
32137	Mancini Italian Leather Laptop Briefcase - Brown	256
11272	"Mobile Edge ScanFast Checkpoint Friendly Women's Element Laptop Bag - 16""PC /"	256
36634	Nine States 14.4 Inch Slim Fit Shakeproof Computer Laptop Bag Tablet Briefcase Notebook Handbag Black	256
14694	"Caseflex Asus S200E-CT157H Premium Protective 11.6"" Laptop Shoulder Bag Carry Case - Black"	256
2055	"American Genuine Leather 17"" Laptop Slim Briefcase Color: Black"	256
1658	Haoyue Men's Genuine Leather Business Briefcase Shoulder Cross-body Satchel Case 46	256
4380	rooCASE Netbook Carrying Bag for Acer Aspire AO721-3620 11.6-Inch Netbook Black - Classic Series Dark Blue / Black	256
4380	Acer Aspire One 531h 10.1-Inch Netbook Carrying Case Deluxe Bag - Black 	256
4380	Cocoon Innovations Netbook Cases - Black, 13L x 3W x 9frac12;H, Netbook Case	256
43042	Dark Blue Laptop Bag for 15.6 inch Asus G53SX-SZ061V Notebook + An Ekatomi Hook.	256
40997	JxSar Laptop Case for Macbook Pro 15.4 Inch Material Plastic Texture Smooth Color Gold	256
43042	Red Laptop Bag for 15.6 inch Dell Inspiron i15R-2031MRB Notebook + An Ekatomi Hook.	256
29782	Excellent Travel Gear computer notebook Laptop 12-17 inch Backpack.1511-C2	256
4315	TUODAWEN(TM) Shockproof 13-Inch Laptop Computer Bag Sleeve Briefcase	256
16088	PINE-SOL DISINF ALL PURP CLNR 144OZ BTL 3/CASE	256
1508	Vintage Leather Bazaar Leather Briefcase Goat Laptop Macbook Bag Lunch Boxes Chargers & Adapters Carrying Cases Bag 16 Inch Brown	256
43042	Red Laptop Bag for 15 inch Toshiba C655-S5335 Notebook + An Ekatomi Hook.	256
43042	Targus Intersection Netbook Case for up to 10.2 Inch Netbooks Burgundy TSS09601US	256
40997	JxSar Laptop Case for Macbook Pro 13.3 Inch Material Plastic Pattern UK Flag	256
29782	Excellent Travel Gear computer notebook Laptop 12-17 inch Backpack.1511-C3	256
43042	"Kroo Fashion Business Waterproof PVC Leather Briefcase Laptop Case Messenge Shoulder Bag Eco-friendly Green Checkpoint-Friendly for GammaTech-DURABOOK 14"" Laptop ES14I052R5IM7M9"	256
1508	Vintage Leather Bazaar Leather Large Briefcase Laptop Macbook 14 Inch Brown	256
43042	"Kroo Fashion Business Waterproof PVC Leather Briefcase Laptop Case Messenge Shoulder Bag Eco-friendly Green Checkpoint-Friendly for HP-ENVY TouchSmart Ultrabook 14"" Touch-Screen Laptop 4-1115dx refurb"	256
40091	Manhattan 421560 Notebook Briefcase	256
42835	HP DF Novelty Solid Color Metal Foldable Case for 13.3 Macbook Pro (Assorted Colors) , Blue	256
42835	"HP DFLeaves Circles Pattern Transparent PC Hard Case for MacBook Pro (Assorted Colors) , Green , 15.4"""	256
7234	Mobile Edge Mebcv1 16In Quick Briefcase Blk	256
31632	"Seaview AIR 13-inch BLUE Rubberized Hard Case for MacBook Air 13.3"" (A1466 & A1369) (Latest model) Shell Cover - Blue"	256
16816	Mobile Edge Ladies Briefcase for Notebooks METBC1	256
26677	"Customized Famous Painting Series Vincent Van Gogh Starry Night Special Design Water Resistant Hard Case for Macbook Pro 13"" with Cd-rom Drive (Non-retina Display) Model A1278"	256
43042	HP ProBook 530 15.6 Inch Notebook Laptop Nylon Carrying Case with Extra Internal and External Compartment Pockets Color Black / Grey + NuVur  Keychain (ND15PNK1)	256
10515	Case Logic Vnc-218 Notebook Case 17 - 18.4 	256
42439	Speck Products See Thru Hard Shell Case for MacBook Pro 13-Inch Aluminum Unibody Only, Cobalt SPK-A0467	256
16816	"MOBILE EDGE MEBCNS1 16"" PC/17"" MacBook R Nylon Notebook Briefcase Select"	256
13497	"16"" Black Laptop Briefcase"	256
40091	SwissGear JETT 16 Computer Notebook Briefcase	256
40997	JxSar Laptop Case for Macbook Pro 13.3 Inch Material Plastic Texture Frosted Color Rose red	256
40091	Manhattan 421560 Notebook Briefcase	256
30263	McKleinUSA OAK GROVE 96639 Pink Leather Fly-Through TM Checkpoint-Friendly Ladies' Briefcase	256
33613	Asus Eee PC 1011PX 10.1 Inch Netbook Laptop Hard Nylon Case with External Pocket, Color Grey + NuVur  Keychain (ND10N2E1)	256
11272	"Mobile Edge 13"" & 14.1"" Tablet & Notebook Slimline Briefcase Black With White Stitching"	256
10515	"16"" Black Professional Notebook Briefcase"	256
42835	"HP DF Artistic Work of Grids Pattern Transparent PC Hard Case for MacBook Pro Assorted Colors , Blue , 15.4"""	256
43042	Black Laptop Bag for 15.6 inch Asus A53E-XE3 Notebook + An Ekatomi Hook.	256
10515	"16"" Full-Size Checkpoint Friendly Executive Notebook Case"	256
42835	"HP DFCar Accident Pattern Transparent PC Hard Case for MacBook Pro (Assorted Colors) , Green , 15.4"""	256
10515	Case Logic VNC-13 13-inch Value Slimline Laptop Case Black	256
15183	"Mobile Edge Alienware Vindicator Slim Carrying Case - 14"""	256
13645	Uniquely designed SumacLife Brand Lime Green Ultra Durable Reinforced 13 Inch Cady Hard Shell Sports Bag for all models of the Acer Aspire S5 13.3 Inch Ultrabook Acer Aspire, S3 Series, Windows 8, S3-391-6676, Champagne + 2 Cable Holder Organizers + Earphones + USB Mouse	256
27821	"Popular Customized Fashion ( Animals hmelion Green on a branch ) Laptop Bag For Men's Gift (10 Inch) For 9.7""iPad Air 2-iPad 1 2 3 4 5-Samsung Galaxy Tab 3 S T700-Note 10.1-Tab PRO-Google Nexus 10 - CB-10-13278"	256
43042	Crumpler The Harry Hoard Laptop Briefcase Bag, Olive/Lt Olive	256
4380	- Form Fitting Leather Carrying Case for Dell Inspiron Mini 12 Netbook {+ 1pc name tag}	256
43042	"Kroo Fashion Business Waterproof PVC Leather Briefcase Laptop Case Messenge Shoulder Bag Eco-friendly Green Checkpoint-Friendly for ThinkPad 14"" Notebook X1 3460BZ8"	256
9384	McKlein USA S Series Ashburn Leather Laptop Case - Cognac	256
10515	Case Logic 16-Inch Professional Laptop Briefcase ZLC-216	256
30263	McKleinUSA BEVERLY 15444 Brown Leather Laptop Case by McKleinUSA	256
43042	HP 2710p 12.1 Inch Executive Laptop Carrying Bag	256
4380	rooCASE 2n1 Asus Eee PC 1005HA-PU17-BU 10.1-Inch Royal Blue Netbook Carrying Bag Case with AC Adapter Wall Charger - Classic Series - Dark Blue / Black	256
20485	Targus Checkpoint-Friendly Mobile Elite Laptop Bag for 15.4 Inch Laptops TBT045US Black	256
42383	Targus CityGear Netbook Case for up to 10.2 Inch Netbooks- Black and Grey TSM097US	256
4380	rooCASE 2n1 Netbook Carrying Bag with Wall Charger for Acer Aspire One AO532h-2268 10.1-inch (Versasport Series - Black)	256
42835	"HP DFModern Life Pattern Transparent PC Hard Case for MacBook Air Assorted Colors , Blue , 11.6"""	256
17005	"Popular Customized Fashion Animal Laptop Bag For Men's Gift (15""15.4""15.6"") For Macbook Pro Lenovo ThinkPad ASUS Apple DELL acer HP Microsoft SAMSUNG TOSHIBA - CB-15-12318"	256
1705	"I Like You Design Full-Body Protective Plastic Case for MacBook Pro 13""/15"" (Non-Retina)"	256
21916	"Bombata Doppio 15"" Laptop Briefcase Black & Pink"	256
16816	"MOBILE EDGE MEVLU1 16"" ULTRA V-LOAD NOTEBOOK CASE"	256
43042	Designer Sleeves 14-Inch City Life Executive Laptop Bag 14ES-CL	256
17005	Tucano Tema MacBook Pro Bag	256
16088	At-Baby Legend of zelda 1 Custom Durable Case Carrying Bag for Apple Macbook pro Air Notebook Laptop Sleeve Fits All 13 inch Notebook Laptop(Twin sides)	256
16088	13 Inch Laptop Sleeve / Bag with Hidden Carrying Handle for 12.5 13 13.3 Chromebook or Ultrabook 13 Inch, Dark Mini Butterfly 	256
41339	Leather Laptop Briefcase Color: Tan	256
43042	Scully Hidesign Laptop H282 Briefcase	256
2748	Acer Aspire One AO751h-1373 11.6-Inch Netbook Travel Laptop Carrying Bag with Car Charger	256
30263	Mancini Black Italian Leather Lawyer/doctor Briefcase Laptop	256
36634	Nine States 14 Inch Shockproof Computer Laptop Bag Tablet Briefcase Grey	256
9774	Genuine Leather Laptop Shoulder Bag Briefcase Color: Red	256
43042	Black Laptop Bag for 15.6 inch Asus N55SF-A1 Notebook + An Ekatomi Hook.	256
43402	Case Logic, Inc 14 LAPTOP ATTACHE - BROWN - CL4189	256
32137	"Vagabond Traveler 16"" Professional Briefcase Leather Laptop Bag L49. Reddish"	256
14263	MGM Galaxy 13 13.3 inch Waterproof Laptop Briefcase Handbag Carry Case with Shoulder Strap for Apple Macbook Pro Retina Air Acer Dell Lenovo HP Samsung Laptop /NoteBook	256
1658	Lotuff Men's Genuine Leather And Canvas Fabric Laptop Briefcase One Size Black	256
43042	"Kroo Fashion Business Waterproof PVC Leather Briefcase Laptop Case Messenge Shoulder Bag Eco-friendly Green Checkpoint-Friendly for Asus-Ultrabook 14"" Touch-Screen Laptop S400CA-BSI3T12"	256
42835	Kroo® Blu Life Pure Mini Cases Safari PU Leather Pattern Wallet	256
42383	Compaq Mini CQ10-112NR 10.1 Inch Netbook Laptop Hard Nylon Case With External Micro Suede Pocket, Color Black / Blue + Nuvur  Keychain (ND10LXB1)	256
43042	Dell Inspiron 15R 15.6 Inch Notebook Laptop Nylon Carrying Case with Extra Compartment Pockets Color Black / Green + NuVur  Keychain ND15SEG1	256
22112	Iunio Matte PC Hard Case For Macbook Pro 13 inch 13.6 Inch A1278	256
30263	American West Cattle Drive 3 Compartment Briefcase Studded Chocolate Leather	256
2989	Acer Aspire Timeline AS4810T-8480 14-Inch Aluminum Laptop - 8+ Hours Battery Life	256
1508	Piel Leather Computer Briefcase	256
4380	rooCASE 2n1 Acer AO532h-2309 10.1-Inch Garnet Red Netbook Carrying Bag Case with AC Adapter Wall Charger - Classic Series - Dark Blue / Black	256
811	PORTER REAL 2way Briefcase (B4 Compatible) Black	256
35225	"MOBILE EDGE MESFBC2.0 16"" PC/17"" MacBook R ScanFast TM Briefcase"	256
27821	Cool Print Custom Sophie Marceau Laptop Bag For Men's Gift (17 17.3 Inch) with Hidden Handle and Adjustable Shoulder Strap For Lenovo ThinkPad ASUS Apple DELL acer HP Microsoft SAMSUNG TOSHIBA - CB-17-1273	256
43042	"Kroo Fashion Business Waterproof PVC Leather Briefcase Laptop Case Messenge Shoulder Bag Eco-friendly Green Checkpoint-Friendly for Samsung- 14"" Laptop GCRF-NP520U4C-A01UB"	256
21516	Mebont Hard Case for Macbook Pro 13'' Art Pattern Rubber Coated Laptop Computer Shell Cover MMP13 A1278	256
43042	Black Laptop Bag for 15.6 inch Acer AS5253-BZ602 Notebook + An Ekatomi Hook.	256
13960	Everki Advance Laptop Bag - Briefcase, Fits up to 18.4-Inch EKB407NCH18	256
42503	"Targus Group International - Targus Notebook Case - Clamshell - Detachable Shoulder Strap - Nylon - Black ""Product Category: Accessories/Carrying Cases"""	256
29782	Excellent Travel Gear computer notebook Laptop teblet inch Backpack.SA9360-C2	256
4380	Acer Aspire One AOD250-1610 10.1-Inch Deluxe Netbook Carrying Case - Black	256
40637	Mobile Office Notebook Case, Nylon, 17-1/2 x 9 x 14, Black	256
4380	rooCASE Acer Aspire Timeline AS1810TZ-4174 11.6-Inch Netbook Carrying Bag Case - Black Classic Series	256
42835	"HP DF Solid Color Frosted PC Hard Case for MacBook Pro Retina 15""(Assorted Colors) , Purple"	256
4380	rooCASE Netbook Carrying Bag for Acer Aspire One AO532h-2997 10.1-inch (Classic Series - Red)	256
43042	"Kroo Fashion Business Waterproof PVC Leather Briefcase Laptop Case Messenge Shoulder Bag Eco-friendly Green Checkpoint-Friendly for ASUS ViVoBook V400CA-DB31T 14.0"" Touchscreen Ultrabook"	256
1658	Haoyue® Men's Business Bag/handbag/suitcase/briefcase	256
21516	Mebont Hard Case for Macbook Pro 13'' galaxy Pattern Rubber Coated Laptop Computer Shell Cover MMP13 A1278	256
4229	"MOBILE EDGE #MECBC1 Eco-Friendly Carrying Case Briefcase for 17"", Notebook - Black"	256
13645	kroo Laptop carrying sleeve with Extra pocket and Built in Handles for All models of ASUS Eee PC 10-inch Netbooks -- Blue + Vangoddy tm, Live*Laugh*Love wrist band!!!	256
9384	McKlein USA NORTH PARK I Series Leather Laptop Briefcase	256
40997	JxSar Laptop Case for Macbook Pro 13.3 Inch Material Plastic Pattern Yellow Leopard	256
42503	Business OC24T482BK Carrying Case Briefcase for Notebook - Black	256
13645	Uniquely designed SumacLife Brand Baby Blue Ultra Durable Reinforced 12 Inch Cady Hard Shell Sports Bag for all models of the Acer Aspire S7 11.6 Touchscreen Ultrabook Acer Aspire S7-191-6640, 11.6 Inch Ultrabook, Windows 8 Touchscreen Ultrabook	256
40091	Manhattan 421560 Notebook Briefcase	256
16088	At-Baby Mickey Mouse and Donald Duck Custom Durable Case Carrying Bag for Apple Macbook pro Air Notebook Laptop Sleeve Fits All 13 inch Notebook Laptop Twin sides	256
6256	Acer Aspire One AOA150-1690 8.9-Inch Lightweight Checkpoint Friendly Netbook Bag with Home Wall Charger - Tan Black	256
43402	Laptop Bag,CoolBELL® Polyester Bubble Padded 15 - 15.6 Inch Laptop / Notebook / MacBook / Netbook / Chromebook Computer Carrying Case Briefcase Shoulder Bag with Strap and Handles - Tiffany Blue	256
8540	Solo Ballistic Laptop Smartstrap Portfolio	256
11272	Mobile Edge MESS1-15 15.4	256
24687	"Mobile Edge Scanfast Carrying Case Briefcase For 15"" Ultrabook, Notebook, Tablet, Macbook Pro - Black/White - Koskin, Faux Leather - Herringbone - Checkpoint Friendly ""Product Category: Accessories/Carrying Cases"""	256
43042	Kroo Fashion Business Waterproof PVC Leather Briefcase Laptop Case Messenge Shoulder Bag Eco-friendly Green Checkpoint-Friendly for Lenovo ThinkPad E431 Laptop	256
21516	Mebont Hard Case for Macbook Pro 13'' Color Pattern Rubber Coated Laptop Computer Shell Cover MMP13 A1278	256
36634	Nine States 14 Inch Water Resistant Laptop Bag Computer Shoulder Bag Tablet Briefcase Red	256
4380	rooCASE Netbook Carrying Bag for ASUS Eee PC 1015PEM-MU17-BK 10.1-Inch Netbook Black - Classic Series Red / Black	256
18720	Pink Cube Case for ASUS Eee PC Seashell 1005PE-PU17-BK 10.1-Inch Black Netbook	256
20485	Targus Checkpoint-Friendly Mobile Elite Laptop Bag for 15.4 Inch Laptops TBT045US Black	256
16816	"MOBILE EDGE MEBCNS1 16"" PC/17"" MacBook R Nylon Notebook Briefcase Select"	256
43042	10 Items	256
9774	1ST Genuine Leather Men's Laptop Bag Business Briefcase Handbag Brown,M6	256
43042	Black Laptop Bag for 15.6 inch Asus N53SV-B1 Notebook + An Ekatomi Hook.	256
8540	"Solo Classic 17.3"" Laptop Rolling Case, Black, PT136-4"	256
22765	Pratesi Italian Leather Raffaello Italian Croco King Leather Laptop Briefcase	256
43042	Dark Blue Laptop Bag for 15.6 inch Sony VAIO VPC-EB42FX Notebook + An Ekatomi Hook.	256
13314	Mobile Edge 16-Inch Premium Nylon Laptop Briefcase - Black (MEBCNP1) by Unknown	256
22765	16.5 Professional Leather Briefcase Laptop Case L65	256
4380	rooCASE Netbook Carrying Bag for Acer Aspire One 10.1-Inch AOD255-2184 Netbook - Deluxe Black / Pink	256
43628	Pratesi Raffaello big Laptop case 17''- S166/17 Santa Croce	256
6584	"Mobile Edge - MEBCNP1 - ""16"""" Laptop Brief Case Black"""	256
9384	McKlein USA Damen Leather Detachable-Wheeled Laptop Case - Black	256
4229	Mobile Edge 16-Inch Premium Nylon Laptop Briefcase - Black MEBCNP1	256
43042	Blue Laptop Bag for 15.6 inch Samsung NP700Z5AH-S04US Notebook + An Ekatomi Hook.	256
2989	Suede Trim Piece 11 Inch x8-1/2 Inch - Black	256
4229	Everki Flight Checkpoint Friendly Laptop Bag/Briefcase for 16-Inch MacBook EKB419	256
4380	rooCASE Netbook Carrying Bag for Acer Aspire One AO532h-2742 10.1-inch - Deluxe Black	256
43042	Red Laptop Bag for 15.6 inch Toshiba C655-S5225 Notebook + An Ekatomi Hook.	256
8540	Solo US Luggage Checkfast Laptop Sleeves w/Grip Solo 	256
9774	Tiding leather handbag cross-body bag men briefcase laptop bag , Brown, One Size	256
11272	"MOBILE EDGE #MEBCT8 SUMO The Tech Carrying Case Briefcase for 15"" Notebook - Brown Bump Resistant, Scratch Resistant - Vegan Leather"	256
20485	HP ProBook 6360B-LJ478UT Laptop Case - Red Awesome Bloom	256
22765	Clelo Men's Canvas Genuine Leather Messenger Bag Handbag, Leisure Notebook Laptop Briefcase	256
18014	Black the Conversion Computer Brief Bag	256
10515	"V7 - Professional 13"" Front-Loading Notebook Case"	256
2748	Acer Aspire One AO751h-1145 11.6-Inch Netbook Travel Laptop Carrying Bag with Wall Charger	256
4315	TUODAWEN(TM) Shockproof 13-Inch Laptop Computer Bag Sleeve Briefcase	256
14694	"Caseflex Asus Transformer Book T200TA Premium Protective 11.6"" Laptop Shoulder Bag Carry Case - Black"	256
6256	"Red Cube Case for Acer Aspire One AOD257-13450 10.1"" Netbook"	256
6256	Acer Aspire One AOA150-1178 8.9-Inch Netbook Carrying Bag Case - Dark Blue / Grey	256
4380	Red Cube Case for Toshiba NB505-N508TQ 10.1-Inch Netbook Turquoise	256
9612	Soho PadFolio Smart Stand Alone Cover Case Durable Premium Design For Azpen A1020, A920, A9, A940 Android 9 to 10.1 inch Touch Screen Tablet Mobile Computer Device + Includes a Windshield Car Mount with Auxilary Cable AUX 	256
43402	Myheartgoon Laptop Case 15 Inch Laptop Bag / Notebook Computer Briefcase Bag Pouch Sleeve,Rose	256
4380	Red Cube Case for Dell Inspiron iM1012-799OBK Mini 1012 10.1-Inch Netbook	256
6152	"Professional 16"" Front-Loading Notebook Case"	256
22038	INFON 7155R Classic Genuine Cow Leather Men's Briefcase Laptop Handbag Messenger Bag	256
22765	LB1 High Performance New Leather Briefcase for HP EliteBook 2540P Notebook Laptop Dark Brown Full-grain Leather Laptop Messenger Bag Business Travel Crossbody Case	256
15183	"ECO STYLE Tech Pro Carrying Case for 16.1"" Notebook - Red - Ethylene Vinyl Acetate EVA - Checkpoint Friendly - ETPR-RD15-CF-WB"	256
43042	Kroo Fashion Business Waterproof PVC Leather Briefcase Laptop Case Messenge Shoulder Bag Eco-friendly Green Checkpoint-Friendly for Lenovo ThinkPad L440 Laptop	256
1439	Last Innovation Dark Purple Matte Hard Case for MacBook Pro 13.3 inch (A1278)	256
1498	VanGoddy Genuine Leather Briefcase Messenger Bag for HP Pavilion / Stream / Chromebook 11.6-inch Laptops	256
43042	Sportex-2 Laptop Briefcase	256
10515	Case Logic Zlc-216 16 Professional Notebook & Ipad R Briefcase	256
8540	"Solo Premium Leather 16"" Laptop Attaché, Hard-sided with Combination Locks, Black, 488"	256
20485	"V7 13"" Professional Front Loading Shock and Water Resistant Notebook Bag For Dell, ASUS, HP, Acer, Toshiba, Apple, Lenovo notebooks and laptops CCP4-9N - BLACK"	256
42835	"HP DF Solid Color Frosted PC Hard Case for MacBook Pro 15""(Assorted Colors) , Purple"	256
21516	Mebont Hard Case for Macbook Pro 13'' Color Pattern Rubber Coated Laptop Computer Shell Cover MMP13 A1278	256
40091	"Manhattan 17"" Empire Notebook Computer Briefcase"	256
4380	rooCASE Netbook Carrying Bag for Acer Aspire One 10.1-Inch AOD260-2203 Netbook - Deluxe Black / Red	256
11272	Mobile Edge Men's ScanFast Checkpoint and Eco Friendly Briefcase- 16-Inch PC/17-Inch MacBook	256
42835	"HP DF Modern Life Pattern Transparent PC Hard Case for MacBook Pro (Assorted Colors) , Yellow , 13.3"""	256
40091	Manhattan 421560 Notebook Briefcase	256
4380	rooCASE 2n1 Netbook Carrying Bag with Wall Charger for Toshiba Mini Notebook NB255-N245 10.1-Inch Black (Versasport Series - Black)	256
43042	Laptop Briefcase	256
17005	"Popular Customized Fashion Animal Laptop Bag For Men's Gift (15""15.4""15.6"") For Macbook Pro Lenovo ThinkPad ASUS Apple DELL acer HP Microsoft SAMSUNG TOSHIBA - CB-15-9438"	256
43042	Red Laptop Bag for 15.6 inch Asus UL50AG-A3B Notebook + An Ekatomi Hook.	256
4229	V7 Black 15.6-Inch Checkpoint Friendly Premium Toploader Laptop Case	256
43042	Professional Protect Bag Inner Bag for 8 Inch Laptop	256
8540	"Solo Classic 17.3"" Laptop Rolling Case, Black, PT136-4"	256
43042	Dark Blue Laptop Bag for 15 inch Asus N55SF-S2342V Notebook + An Ekatomi Hook.	256
11272	Mobile Edge Faux Croc Portfolio- 14.1-Inch PC/15-Inch MacBook Pro White	256
43402	"City Carrying Case Briefcase for 15"" MacBook Pro, iPhone - Black"	256
43042	Kroo Fashion Business Waterproof PVC Leather Briefcase Laptop Case Messenge Shoulder Bag Eco-friendly Green Checkpoint-Friendly for Lenovo ThinkPad T430s Laptop	256
6401	"Naneu Military Tech MT13 13"" Laptop Briefcase Blue"	256
42835	"HP DF Modern Life Pattern Transparent PC Hard Case for MacBook Pro (Assorted Colors) , Yellow , 15.4"""	256
4380	Life Industries Corporation Sealant Lifeseal Black Cartridge	256
19703	MT.MIT Mens Vertical Leather Business Portable Briefcase Cross-body Shoulder Bag Coffee	256
22765	LB1 High Performance New Leather Briefcase for Toshiba PA3818U-1BRS Notebook Laptop Dark Brown Full-grain Leather Laptop Messenger Bag Business Travel Crossbody Case	256
40091	"MANHATTAN 421560 17"" Empire Notebook Computer Briefcase"	256
43042	"Kroo Fashion Business Waterproof PVC Leather Briefcase Laptop Case Messenge Shoulder Bag Eco-friendly Green Checkpoint-Friendly for HP-EliteBook 14"" Laptop d8e81ut"	256
42439	Speck Products See Thru Hard Shell Case for MacBook Pro 15-Inch Aluminum Unibody Only, Raspberry SPK-A0469 	256
19703	Teemzone Men's Genuine Leather Business Briefcase Shoulder Tote Laptop Bag	256
30263	McKleinUSA ROCKFORD 86515 Black Leather Fly-Through(TM) Checkpoint-Friendly 17 Laptop Case	256
36634	Nine States 15Inch Water Resistant Laptop Bag Computer Shoulder Bag Tablet Briefcase Pink	256
40997	JxSar Laptop Case for Macbook Pro 13.3 Inch Material PU Leather Texture Crazy Horse Color Pink	256
30263	McKleinUSA WENONAH 96669 Pink Leather Ladies' Briefcase	256
8540	Solo - SOLO Laptop Slim Brief	256
30263	McKleinUSA HAZEL CREST 15604 Brown Leather Double Compartment Laptop Case	256
16088	"GMYLE Charcoal Grey & Brown Wool Felt Sleeve Bag for MacBook Pro 13"" (NPL560055)"	256
37740	Preferred Nation Extra Size Laptop Briefcase	256
30263	"15.4"" Halsted Brown Double Compartment Notebook Case"	256
33613	Asus Eee PC X101 10.1 Inch Netbook Laptop Hard Nylon Case with External Pocket, Color Grey + NuVur  Keychain (ND10N2E1)	256
18720	Black Red Ultimate Smart Travel Organizer Hard Nylon Durable Cover Carrying Cube Case // Airport Check-Point-Friendly // For Dell Inspiron Duo 1090 Netbook Notebook 10.1 Inch Screen	256
7514	Fabric Business Briefcase Laptop Bag Notebook Computer Tablet Bag For 15 Inch Laptop Super Man Print.	256
34327	"Coosbo? Matt Rubberized Hard Cover Case for 13"" 15"" Mac Macbook Pro (Assorted Color)"	256
43042	"Kroo Fashion Business Waterproof PVC Leather Briefcase Laptop Case Messenge Shoulder Bag Eco-friendly Green Checkpoint-Friendly for Samsung ATIV Book 5 NP540U4E-K01US 14"" Touchscreen Ultrabook PC"	256
11272	TRIPP LITE 10-Port USB2.0 Mobile Hi-Speed Hub Notebook Laptop (U223-010)	256
1658	Habik Wardmaster Multifunctional Men's Handbags Microfiber PU Leather Office Briefcase for Laptop 13-inch Green	256
11272	"Mobile Edge - MEBCS1 - ""15.4"""" Select Briefcase Black"""	256
43042	Green Laptop Bag for 15.6 inch Acer AS5560-6344G Notebook + An Ekatomi Hook.	256
9384	McKlein USA W Series Willowbrook Leather Detachable Wheeled Women's Laptop Case	256
43042	Kroo Waterproof PVC Leather Briefcase Laptop Case Messenge Shoulder Bag Neon Green Checkpoint-Friendly for Lenovo IdeaPad Y410p 14-inch	256
42383	Fujitsu LifeBook MH380 10.1 Inch Netbook Laptop Hard Nylon Case With External Micro Suede Pocket, Color Black / Blue + Nuvur  Keychain (ND10LXB1)	256
6256	Acer Aspire One AOA150-1690 8.9-Inch Netbook Carrying Bag Case with 12v Car and Wall Charger - Dark Blue / Grey...	256
14263	Professional Versatile 1.2x25mm Pentagon Screwdriver for MacBook Pro 13.3 inch / for MacBook 13 inch	256
36727	Leather Laptop Briefcase Color: Brown	256
9384	Siamod SETTEMBRE 35526 Cherry Red Leather Medium Ladies' Laptop Brief	256
9384	Siamod Novembre Ladies Vertical Detachable-Wheeled Italian Crocco Leather Laptop Case - Black	256
8540	Paperthinks Mint San Francisco-Oakland Bay Bridge Large Slim Recycled Leather Notebook, 4.5 x 6.5-inches	256
42439	Speck Products SeeThru Case for MacBook Pro Retina 15-Inch, Raspberry Pink (SPK-A1498)	256
42439	Speck Products SeeThru Case for MacBook Pro Retina 15-Inch, Hot Lips Pink (SPK-A2731)	256
43042	Black and Grey Laptop Briefcase Bag for 15.6 inch Asus A52F-XA4 Notebook + An Ekatomi Hook.	256
36634	Nine States 15 Inch Shockproof Computer Laptop Bag Tablet Briefcase Green	256
4229	"Mobile Edge MECBC9 Olive Eco-Friendly Carrying Case Briefcase for 16"" Notebook"	256
2055	Clava Executive Laptop Briefcase	256
6152	"Edge 16.1"" Top-Loading Notebook Case"	256
8540	Solo Classic Collection Leather CheckFast Rolling Case for Laptops up to 15.6 Inches, Black D529-4 Color: Black PC, Personal Computer	256
43042	AWM 18Pc Bbq Set W Mould Case By Chefs Basics Select HW5231	256
811	PORTER STAGE 2way Briefcase B4 Compatible Navy	256
17005	Sellse Men's Vintage Crazy Horse Leather File Package Laptop Bag for MacBook Air or Apple Ipad	256
