25075	ZCL3 mini 1 charger box/samsung/HTC blackberry white	352
25075	GG 3 mini 1 charger box/samsung/HTC blackberry white 	352
30432	YANWind up Charger for Cell Phones Multi-Color	352
25075	SOL 3 mini 1 charger box/samsung/HTC blackberry white 	352
30432	JOEWind up Charger for Cell Phones Multi-Color	352
37505	ZCL Multi Function Charge Dock for Samsung with Memory Card Reader White	352
16953	ORICO 2 in 1 Super Charging Desktop Docking Station with 2 AC Sockets and 5 USB Ports for Home Office Hotel School Hospital Uses, Comptaible for Computers, TV, Washing Machines, Refrigerators, iPhone iPad Samsung Nexus HTC Motorola LG Android Phones Tablets and Other Electronic Devices - White	352
16064	LIMME OTG Smart Multi Function Combo Charger Dock with Card Reader White/Black , White	352
30432	JAJAY Wind up Charger for Cell Phones Multi-Color	352
25075	JAJAY 3 mini 1 charger box/samsung/HTC blackberry white	352
16953	ORICO 2 AC Outlets + 4 x 5V 2.4A USB Ports Power Strip Charging Station + Socket Plug Adapter for Home Office Hotel School Hospital Computers, TV, Washing Machines, Refrigerators, iPhone iPad (Black)	352
30432	ZCLWind up Charger for Cell Phones Multi-Color	352
