15557	Belkin Snap Shield Secure case for web tablet (Catalog Category: Supplies & Accessories / SUPPLIESA)	508
6584	Angelstar 13743 Let Your Dreams Take Flight Small Tablet Ipad Case, Mini	508
232	rooCASE Slim-Fit Black Folio Case Cover and Black Capacitive Stylus for Asus Transformer Pad TF300T 10.1-Inch Tablet NOT Compatible with TF201 and TF101	508
2333	Striped Mouse Table Lamp,Cute Pink Cloth	508
30088	MiniSuit Buddy Skin Case Back Cover for Smart Cover on The New iPad 3, 3rd Gen, iPad 2 Mojito Green	508
9756	Incipio Nylon Sleeve Designed for Microsoft Surface MRSF-019 	508
9756	Incipio Nylon Sleeve Designed for Microsoft Surface MRSF-021	508
16662	"rooCASE Kindle Fire HDX 8.9"" Dual-View Folio Case w/ Stylus"	508
11948	Breed BTR-001 iPad Control Case with Built-In Bluetooth Keyboard Black	508
18720	RED Protective Durable Limited Edition Hard Nylon Cube Carrying Smart Case with Handles For Samsung Galaxy Note 8.0 Tablet	508
15557	Belkin Cinema Dot Folio with Stand - case for web tablet Catalog Category: Supplies & Accessories / SUPPLIESA 	508
11948	2PL0386 - Amzer Silicone Skin Jelly Case - Red For The new iPad	508
32405	Hard Candy Cases Street Skin Case for Apple iPad 2 and New iPad, Black RU-IPAD2-BLK 	508
8015	Black / White Zebra Design Dauphine Edition Protective Leather Case Cover for Visual Land Prestige 7 Internet...	508
42503	"Brand New Mobile Edge Llc Neogrid Sleeve For Ipad And 10In Tablets - Black W/Blue Stitchingneoprene ""Product Category: Laptop / Carrying Cases"""	508
13850	RUNWAY KIT, J-BOLT, 2 EA	508
11948	Innovative Technology iPad Case With Bluetooth Keyboard	508
30088	Brand New iPad 2 / iPad 3 Smart Case for LA Lakers Fans-by Allthingsbasketball	508
36758	ILUV CREATIVE TECHNOLOGY, iLuv Carrying Case (Sleeve) for Tablet PC - Black (Catalog Category: Accessories / Carrying Cases)	508
5053	jVose Bluetooth Keyboard Case with Built-in Speakers for iPad 2/3 (Black)	508
7315	[Aftermarket Product] Brand New Universal Faux Leather Case Cover+USB Keyboard For 7 inch Android Tablet PC	508
8015	BoxWave Sony Reader Daily Edition Case - BoxWave Nero Sony Reader Daily Edition Leather Envelope Premium Synthetic Leather Carrying Sleeve	508
36758	"PC TREASURES, PC Treasures SlipIt! 07633 Carrying Case for 15"" Notebook - Black Catalog Category: Accessories / Carrying Cases"	508
898	AWM Belkin F5L114Ttc00 The New Ipad R 3Rd Gen/Ipad R 2 Keyboard Folio Black - Ipad3 Cases	508
6152	Lifedge - Lifedge Rokk Adjustable Deck Mount Kit f/Waterproof iPad Case	508
18720	PINK Protective Durable Limited Edition Hard Nylon Cube Carrying Smart Case with Handles Fits Apple iPad Tablets Models + Home and Car Charger	508
21933	"TARGUS Flipview THD03903US Carrying Case Flip for 9.7"" iPad - Crimson Red / THD03903US /"	508
23271	i-tec Electronics T6036 Safe Shield for iPad	508
30088	MiniSuit Buddy Skin Case Back Cover for Smart Cover on The New iPad 3, 3rd Gen, iPad 2 Mojito Green	508
232	Premium Black Leather case + 2 packs of Clear Screen Protector + 3 packs of Stylus Pen for Acer Iconia Tab A500 10.1-Inch Tablet	508
11738	Ipad Mini Christmas 3D Art Print Design Phone Back Case Use Your Own Photo Hard Shell Protection AQ064356	508
37698	Luxury Aluminum Edge Hard Shell Luggage Suitcases Durable Full Set Outdoor Sport Travel Carry-ons Retractable Trolley Cart Storage Carrying EVA Case with Custom EVA Foam for DJI Inspire 1 Quadcopter - Silver Fits Extra Accessories	508
898	Tribeca FVA4993 Folio for iPad 2, Georgia, U of - Black	508
37146	36900-VOE-21F Catalog Category: Corded Telephones / Basic Telephones	508
232	Acer Folio Case for Acer A500 10-inch tablet Black	508
7579	rooCASE Samsung Galaxy Tab 3 10.1: Origami Folio Case w/ Stylus Navy	508
4381	PINK Travel Aero Bump Protection Slim Micro-Suede Carrying Sleeve Case For Nikon D, J, V Cameras + 4GB Memory Card + Screen Protector	508
42503	"Toshiba, Lightweight Carrying Case Notebook Carrying Case 16"" Black With Silver Accents For Satellite C55, C55d, C55dt, C55t, L305 ""Product Category: Supplies & Accessories/Notebook Carrying Cases"""	508
8015	(Candy Colorful Stripes) Dauphine Edition Protective Book-Style Canvas Carrying Case for Coby Kyros MID7035-4 / MID7033-4 7-Inch Android 4.0 4 GB 16:9 Touchscreen Widescreen Internet Tablet + 8GB Micro SD Memory Card with Adapter	508
2333	Striped Mouse Table Lamp,Cute Pink Cloth	508
18720	Blue Protective Durable Hard Nylon Cube Carrying Smart Case with Handles // Airport Check-Point-Friendly // For Dell Inspiron Mini 1018 Netbook Notebook 10.1 Inch Screen + Includes a Accessory Pack Of Slim Wireless Bluetooth Keyboard with USB Mini Mouse	508
18720	E-Stand KHE-HARDCASE-RB-2 Red and Black Hard Protective Smart Case	508
18720	BLACK Protective Durable Limited Edition Hard Nylon Cube Carrying Smart Case with Handles For Sony 7 inch Portable DVD Player Model DVP-FX780 + Includes an eBigValue TM Determination Hand Strap	508
2820	jVose Bluetooth Keyboard Case for 9-Inch to 10-Inch Tablet Black	508
9612	RED Protective Durable Limited Edition Hard Nylon Cube Carrying Smart Case with Handles For The Sony DVP-FX970 9-Inch Portable DVD Player	508
11948	NEW Flip Turn Case Backlit for iPad Mini, Mini 2, Mini 3 - Clamshell Bluetooth Backlit Keyboard Case Better than Clamcase Silver	508
10515	Verbatim Universal Folio Case for 10-Inch Tablets and e-Readers 98540	508
2333	Striped Mouse Table Lamp,Cute Pink Cloth	508
18720	Microsuede BLACK with Purple Edge and Rear Pocket Carrying Sleeve For Toshiba Excite 10 & Toshiba Excite 10 LE + Bluetooth Speaker	508
41145	ZAGGmate Aluminum iPad 1 Case with Integrated Bluetooth Keyboard 	508
8015	Red Hydei Edition Nylon Sleeve Cover for Coby Kyros 7-Inch Android 4.0 4 GB 16:9 Capacitive Multi-Touchscreen Widescreen Internet Tablet MID7035-4 / MID7042-4 + Black 3.5mm Hifi Noise Reducing Headphones with Mic	508
36758	"INLAND PRODUCTS INC, Inland Carrying Case (Sleeve) for 7"" Tablet PC - Pink (Catalog Category: Accessories / Carrying Cases)"	508
37146	36900-VOE-21F Catalog Category: Corded Telephones / Basic Telephones	508
2333	Striped Mouse Table Lamp,Cute Pink Cloth	508
23391	"Kroo Durable Tablet Sleeve Diamond Cover Red with Accessory Compartment for HP-SlateBook 2-in-1 10.1"" Touch-Screen tablet x2 10-h010nr + a Mini Stylus Pen"	508
4380	rooCASE Super Bubble Neoprene Orange / Black Sleeve Case for iomega Prestige 1 TB Portable Hard Drive Compact Edition 34866	508
23850	Targus, Truss Sleeve for Tablet/e-Read Catalog Category: Bags & Carry Cases / iPad Cases	508
2236	XtremeMac XtremeMac Tuffwrap Shine Case for iPad 2 & iPad 3 Pink Catalog Category: Accessories / Notebook & Tablet	508
2333	Striped Mouse Table Lamp,Cute Pink Cloth	508
8015	Candy Colorful Stripes Dauphine Edition Protective Book-Style Canvas Carrying Case for Coby Kyros MID7012 4G / MID7022 4G 7 inch Android Tablet	508
8015	(Black White Zebra) VG Animal Print Carrying Case with Faux Fur Exterior for Barnes & Noble Nook HD 7-inch Tablet + Black 3.5mm Hifi Noise Reducing Headphones with Mic	508
6584	Marilyn Monroe Photo Collage Signature iPad 1 2 3 Netbook Tablet Sleeve Case Cover Skin	508
23850	Kensington Technology Kensington K62684 SmartFit Adjustable Keyboard Platform Catalog Category: Accessories / Accessories 	508
5053	jVose Ultra-Thin Bluetooth Keyboard Case for iPad mini (Green) (Black)	508
23391	"Corsair - Individually Sleeve Gen2 Wh Fd ""Product Category: Cases & Power Supplies/Accessories"""	508
43043	ID Maker Secure Printer Soft Carrying Case	508
4380	"rooCASE Xtreme Super Foam Sleeve w/ Stylus for 7"" Tablet"	508
9756	Incipio Nylon Sleeve Designed for Microsoft Surface MRSF-020 	508
6152	V7 NOTEBOOK CARRYING CASES TA37GRN-2N SLIM TRI-FOLD FOLIO STAND FOR IPAD2 NEW IPAD W/ SLEEP AWAKE GRN	508
40670	"STONG Plug-in Bluetooth Keyboard Case with stand for 9""-10"" Tablets Pink"	508
11948	"Pink Genuine Original LePan Mini 8"" Case with Bluetooth 3.0 Keyboard, Compatible with iPad Mini, LePan Mini and other 8"" Tablets"	508
6152	V7 NOTEBOOK CARRYING CASES V7 SLIM FOLIO Carrying Case Folio for iPad - Green. SLIM TRI-FOLD FOLIO STAND FOR IPAD2 W/ SLEEP/AWAKE FEATURE GREEN. Polyurethane	508
898	"Brand New Hammerhead - Hammerhead Folio Case for iPad - Black ""Ctg: iPad 4 Cases"""	508
7579	"Fintie Nextbook 8"" Model NEXT8P12 & NEXT8D12F Tablet Folio Case Cover with Stylus Holder 3 Years Warranty - Red"	508
232	Premium 3 Packs of LCD Clear Screen Protector + 6 Feet Micro USB Cable + Wall Travel Charger + 3.5mm Retractable Cable + 3 Packs of Touch Screen Stylus Pen + Black Earphone Headset with mic + Black Laptop Carrying Case for Toshiba Thrive 10.1 Tablet By Skque	508
23271	Targus Commuter Leather Case Designed to Protect 17-Inch Laptops TET028US Black	508
23850	XtremeMac XtremeMac Ultra-Thin Folding Micro Folio with Intelligent Cover for iPad 2 or 3 Latte - Faux Leather Catalog Category: Accessories / Notebook & Tablet	508
18720	26x21cm 10x8inch Mousepad Cloth Eco Friendly durable black veil brides	508
6584	Kensington iPad 2 Case with Wireless Bluetooth Keyboard for Apple iPad 2 3G Tablet, WIFI Model K39521US	508
38303	Hard Candy Cases Sleek Skin Case for Apple iPad, Orange, SK-IPAD-ORN 	508
8015	(Candy Colorful Stripes) Dauphine Edition Protective Book-Style Canvas Carrying Case for Visual Land Prestige 7L Android Tablet + Black 3.5mm Hifi Noise Reducing Headphones with Mic	508
36758	Targus Targus Impax 16 Notebook Carrying Case Green Catalog Category: Accessories / Bags	508
42503	"Targus, Spruce Ecosmart Topload Notebook Carrying Case 15.6"" Black, Green ""Product Category: Supplies & Accessories/Notebook Carrying Cases"""	508
6584	New Black Leather Case with Mini USB Interface Keyboard for 7 inch Tablet	508
32405	YourType Folio, Removable Keyboard, for iPad 2/3, Black by BELKIN COMPONENTS Catalog Category:	508
18720	B&K Precision LC 12 Dual Compartment Carrying Case for Generators	508
7579	Kroo Universal Rotating Folio Case for 6 to 8-Inch Tablet MU08ARB1-7335	508
9756	Incipio Nylon Sleeve Designed for Microsoft Surface MRSF-017 	508
6157	(Black White Zebra) VG Animal Print Carrying Case with Faux Fur Exterior for Visual Land Prestige 7 Internet Tablet (ME-107-8GB) + Black 3.5mm Hifi Noise Reducing Headphones with Mic	508
37698	Hard Candy Cases Bubble Shell 13-inch MacBook Pro Hard Case - Blue by Hard Candy Cases	508
727	"Win8 Bluetooth 10.1 ""tablet computer clavier to bluetooth keyboard leather case"	508
23271	Deluxe Carrying Case for iPad - Black	508
36758	"INLAND PRODUCTS INC, Inland Carrying Case (Sleeve) for 7"" Tablet PC - Black (Catalog Category: Accessories / Carrying Cases)"	508
23271	SOLO CASES Tech Padfolio iPad Case	508
9756	Incipio Nylon Sleeve Designed for Microsoft Surface MRSF-019	508
