44243	Human-Computer Etiquette: Cultural Expectations and the Design Implications They Place on Computers and Technology Supply Chain Integration Modeling, Optimization and Application [Hardcover]	60
23558	Web Usability For Dummies For Dummies Computers [Paperback]	60
24495	Computers Helping People with Special Needs: 11th International Conference, ICCHP 2008, Linz, Austria, July 9-11, 2008, Proceedings Lecture Notes in ... Applications, incl. Internet/Web, and HCI Paperback	60
23558	Computers For Seniors For Dummies [Paperback]	60
11421	Foundations Of Quantum Mechanics: From Photons To Quantum Computers [Hardcover]	60
6109	Computers Without Machine Code: A New Type of Computer [Paperback]	60
7659	Computers Helping People with Special Needs: 13th International Conference, ICCHP 2012, Linz, Austria, July 11-13, 2012, Proceedings, Part II Lecture ... Applications, incl. Internet/Web, and HCI [Paperback]	60
5665	Computer Service and Repair: A Guide to Upgrading, Configuring, Troubleshooting, and Networking Personal Computers, Instructor's Manual Paperback – 2008	60
16297	Kermit Learns How Computers Work A Muppet Computer Book Hardcover	60
38879	Understanding Computers: Today & Tomorrow, Comprehensive [Paperback]	60
34265	Introduction to Computers and Information Technology Hardcover – January 1, 2011	60
16830	Socially Intelligent Agents: Creating Relationships with Computers and Robots Multiagent Systems, Artificial Societies, and Simulated Organizations [Hardcover]	60
23558	Mail 4 U Kiddo: Computers and Kindergarten Paperback	60
42365	Cengage-Hosted Emerge with Computers 4.0 Printed Access Card-	60
30598	Discovering Computers 2011: Introductory Available Titles Skills Assessment Manager SAM - Office 2007 Paperback – February 25, 2010	60
42714	Innovations First RETAIL-AIO-017 All In One Stand Accs F/ Generic Desktop Computers	60
30598	CourseMate Printed Access Card for Morley's Understanding Computers in a Changing Society, 5th	60
34166	Computers in the Laboratory: Current Practice and Future Trends (Acs Symposium Series)	60
71	DNA Based Computers: Proceedings of a Dimacs Workshop April 4, 1995 Princeton University Dimacs Series in Discrete Mathematics and Theoretical Computer Science v. 1 [Hardcover]	60
141	Windows on Mathematical Meanings: Learning Cultures and Computers Mathematics Education Library Paperback – June 30, 1996	60
24643	The New Division of Labor: How Computers Are Creating the Next Job MarketFrank Levy	60
30598	Bundle: Discovering Computers and Microsoft Office 2010: A Fundamental Combined Approach + Computer CourseMate with eBook Printed Access Card [Paperback]	60
29811	Introduction to Computers for Healthcare Professionals, Fourth Edition [Bargain Price] [Paperback]	60
