1404	WCI Quality Mini Handheld Wireless Presenter Keyboard With Touch Mouse Pad - For PC, Laptop, TV, Presentations. Meetings, Classrooms, Etc.	74
6902	Cute Design Soft USB Heated Mouse Pad / Hand Warmer Yellow 	74
901	LLsai Eco-Friendly Clownfish Pattern Folding Shopping Bag	74
37320	- Eco Series Notebook, Eco-Green Vote Cover, Ruled, 11-3/4 x 8-3/8, White, 192 Pgs	74
901	Black Rhino 00125 10-Inch Multi Pattern Snips	74
42468	Guang 103 USB Wired Dustproof Foldable Keyboard Assorted Colors 	74
901	LLsai Eco-Friendly Clownfish Pattern Folding Shopping Bag	74
21969	Simply Media Craft Projects CD-ROM Case Pack 60	74
41697	Cartoon Pattern USB 2.0 Optical Scroll Wheel Mouse/Mice for Laptop/PC(Light Blue)	74
45021	Bargoose Natural Cotton Top Port A Crib/Utility Pad	74
19074	Superb Choice 120W Replacement Laptop AC Adapter Charger Power Supply for HP/Compaq Business Notebook 6710b Business Notebook 6710s Business Notebook 6715b Business Notebook 6715s Business Notebook 6720S Business Notebook 6720t Business Notebook 6730b Business Notebook 6730s Business Notebook 6735b Business Notebook 6735s	74
41697	KENSINGTON 2.4ghz wireless presenter w/laser pointer	74
24746	E-913 Classic Style Blue Pattern 2.4GHz 10M USB Wireless Optical Mouse White	74
37534	Biscuits Design USB Powered 50-degree Celsius Keep-warm Pad	74
