43042	Hello Kitty Back Pack Style 15.4 Laptop Bag - Black KT4337B	172
18014	Colorful Grids Backpack Laptop Bag From Pomelo	172
29268	Snoogg 15.6 Inch Nylon Laptop Backpack School Backpack Casual Daypack With Compartments	172
34667	Altosy 18 Inch Laptop Backpacks for School Students for 16 Inch Latop 9049	172
34060	ful Payload Backpack, Black	172
44234	"15.6"" Laptop and Tablet Backpack - Anthracite"	172
29268	Manhattan Portage Morningside Backpack	172
44518	"Realize Your Dreams Design Full-Body Protective Plastic Case for MacBook Pro 13""/15"" (Non-Retina)"	172
29268	Snoogg 15.6 Inch Nylon Laptop Backpack School Backpack Casual Daypack With Compartments	172
3359	"NEW 16"" Laptop Backpack DGray Bags & Carry Cases"	172
43402	Work / Travel Backpack / Rucksack Laptop Bag with Detachable Strap (Black)	172
34667	Back to School Summer Sale! For students or professional use. Blue Candy Backpack Laptop Bag for 15.6 inch Gateway...	172
29547	"- Spruce EcoSmart Backpack 17"", 19 1/2 x 13 x 6 3/4, Black"	172
18014	For Laptop 12.1-15.6 inch MAC tablet Backpack Folding Bag portable Waterproof DayPacks Bike Travel Hiking	172
6021	J World New York Benson Laptop Backpack	172
7405	Built NY E-BPL-BLK Built Large Laptop Back Pack Black	172
15443	Juice Action Women's Fashionable Unique Design World Map Backpack Travel Bag Brown	172
18014	For U Designs Leisure Big Bookbag 18 Inch School Laptop Backpack Travel for Men Woman	172
15831	VMWorld 2015 Computer Backpack	172
40637	"Groove Carrying Case Backpack for 17"" Notebook - Black"	172
16816	Targus XL Notebook Backpack Targus XL Notebook Backpack	172
43627	Barsty Backpack Hiking Bags Students School Shoulder Backpacks 15.6 Inch Laptop Macbook Computer Business Bag	172
9612	VanGoddy 3 in 1 Shoulder Bag Backpack and Messenger Bag Briefcase for ASUS Transformer Book T100TAF 13.3 / Samsung ATIV Book 9 Plus 13.3'' Laptop PC (Blue) + Pink VG Headphone + Red Wireless Mouse	172
43627	Meffort Inc 15 15.6 inch Canvas Laptop Computer School Backpack with Side Air Mesh Pocket - England Flag	172
1351	MayaStone Business and Casual Travel Gear Swiss Style fashion computer notebook Laptop teblet 15 inch sports outdoor school Daypack Backpack.SA9264-C1 Black	172
18014	DXRacer GG/Dx001/R Burgundy Red Ergonomic Sport Backpack Bag	172
44518	"Winter is Coming Design Full-Body Protective Plastic Case for MacBook Pro 13""/15"" (Non-Retina)"	172
8760	kmbuy - Unique Linenette Style Unisex Fashionable Casual School Travel Shoulder Backpack bag with laptop Compartment / 40cm*28cm*13cm	172
21488	Santimon Laptop Business Travel Backpack School Bags For Outdoor Hiking Camping Orange Medium	172
10056	Tigernu Waterproof Laptop Backpack Computer Notebook Business Bag	172
18014	Fashion Vintage Plaid Backpack Casual Shoulders Bag with Lovely Heart Patch Blue	172
25628	Urban Junket Kathy Laptop Backpack	172
25161	EcoCity Unisex Bohemia Style Fashion Travel School Laptop Backpack Bookbags	172
14442	Timbuk2 Slate Laptop Backpack	172
43042	Asus X52JT 15.6 Inch Notebook Laptop CheckPoint Friendly Reinforced Hard Shell Backpack with Internal Nylon Compartment Pockets Color Black / Blue + NuVur  Keychain (NBAGCAB1)	172
22765	"18"" CEO Leather Large Briefcase Backpack Travel Bag L31.BLK"	172
37320	Dakine Campus Laptop Backpack	172
32405	Mobile Edge MEBPW0 Onyx Backpack - Notebook carrying backpack - black	172
14769	Creativebags Laptop Daily Backpacks for Men Women Teenagers School Travel Hiking Camping Outdoor Sports	172
30018	"Hello Kitty KT4337R Backpack Style 15.4"" Laptop Case, Red"	172
31718	Swissgear 27316060 SWISS GEAR IBEX 17IN / 43 CM COMPUTER BACKPACK BLUE	172
15831	National Geographic Ng S5403 Day Pack Laptop Notebook Backpack Bag Cool Gray	172
29268	CustomHomme Men's Toppu Textured Laptop Backpack	172
29110	Pink outdoor travel knapsack Canvas Rucksack Vintage Flower Backpack School Campus Book Bag	172
29268	WeHeart 14K Gold Plated Metal Pedlock Backpack	172
15183	"Mobile Edge MEBPE7 16"" Express Backpack Bk/Red MEBPE7 "	172
43042	LeatherBay Backpack With Pockets Black	172
42503	Targus SafePORT - protective case for web tablet THD045US -	172
4858	Heys USA ePac02 Laptop Backpack Purple	172
43627	Victoriacross 17 inch Laptop macbook backpack. notebook tablet computer,knapsack,rucksack bag Comfortable back Ergonomic shoulder straps for man woman travelling,camping,Hiking business and casual Travel school.LARGER CAPACITY. VC17KING-Black	172
23271	GO! SAC backpack black	172
9612	VanGoddy Bonni Collection Laptop Backpack for Dell 13.3 to 15.6-inch Laptops + 16GB Memory Card + USB Mouse + Headphones (Navy Blue)	172
15183	"Kensington K62622WW Cool Gray Carrying Case (Backpack) for 15.6"" Notebook, Tablet"	172
44518	"Tree Flowers Sepia Design Full-Body Protective Plastic Case for MacBook Pro 13""/15"" (Non-Retina)"	172
15831	GeLiVShop Molle Laptop Notebook Computer Backpack Shoulder Bag Carry Case Woodland	172
18014	Eastpak Ekspres Laptop Backpack One Size Motion Blue	172
29268	Snoogg Shocker Face Laptop Backpack Casual School Backpack	172
31718	"SwissGear by Wenger the Granite 16"" Computer Laptop Backpack"	172
43627	ECO STYLE ECO STYLE BACKPACK ACCOMMODATES UP TO 15.6 INCH LAPTOP WITH ADDITONAL COMPARTMEN ELUX-BP14	172
41080	Bronze Times(TM) Unisex Vintage Canvas School Bag Laptop Backpack Rucksack	172
36823	Biao123 Vintage Canvas and Leather Backpack Schoolbag Travel bag Daypacks Laptop Backpack for Outdoor Sports	172
29268	R & R Collections Laptop Backpack	172
17347	"Pelican ProGear S100 Carrying Case Backpack for 17"" MacBook Pro, Netbook, Digital Text Reader, Ultrabook - Orange"	172
14442	Timbuk2 Jones Laptop Backpack	172
43042	CANDY Hard Shell Nylon Backpack Check Point Friendly Bag with Multiple Compartments fits most Acer TravelMate Timeline 6595T-6896 Acer TravelMate Timeline 8571-8537 Acer TravelMate Timeline 8573T-6834 Acer TravelMate Timeline 8573T-6853 Acer TravelMate TimelineX 8573T-6497 Gateway NV 55C34u Laptop + Tablet Stylus + EnvyDeal Cable Tie (NBAGCAB1)	172
16816	Targus XL Notebook Backpack	172
29110	Chelsea FC Outdoor Backpack School Book Bag Backpack CFC-BP5S09+Sackpack	172
23271	Targus - tbb012us - zip thru air traveler backpack	172
17760	"Leopard Patterns Patterns Folio Plastic Protective Hard Shell Case for Macbook Air 13"""	172
18014	Fashion Expandable Notebook Backpack For Up to 16-Inch Laptop Grey/Red	172
37303	"Executive Laptop Backpack, 17.3"", 13 3/4 x 7 x 19 1/2, Black"	172
29268	CalPak Grand Tour Laptop Backpack	172
43435	Vaude Terkum II Backpack Black, 55+10 L	172
42503	"Eco Style Carrying Case Backpack For 16.4"" Notebook - Red, Black - Ballistic Polyester - Checkpoint Friendly ""Product Category: Accessories/Carrying Cases"""	172
20215	minycoo Korean Flower Floral Printed Canvas Daypacks College Student Bookbags Laptop Backpack	172
37320	Dakine Frankie Laptop Backpack	172
25543	MEYKISS Lightweight Canvas Laptop Backpack Cute School Bags	172
19159	Burton Traction Laptop Backpack - 1465cu in	172
44518	"Summer Tree Design Full-Body Protective Plastic Case for MacBook Pro 13""/15"" (Non-Retina)"	172
11272	Mobile Edge Mesfbp2.0 17.3 Scanfast tm Backpack	172
29268	Snoogg 15.6 Inch Nylon Laptop Backpack School Backpack Casual Daypack With Compartments	172
29268	Snoogg 15.6 Inch Nylon Laptop Backpack School Backpack Casual Daypack With Compartments	172
29268	Snoogg 15.6 Inch Nylon Laptop Backpack School Backpack Casual Daypack With Compartments	172
15183	"Mobile Edge SUMO MEBPE22 Express Carrying Case Backpack for 17"" MacBook, Notebook - Black, Silver - Ballistic Nylon"	172
17347	Pelican Products 0S1000-0003-110 ProGear Sport Laptop Backpack for 15-Inch Ultrabooks/17-Inch MacPro/Camera Black	172
23271	Targus RG0322 5.4 Matrix Notebook Backpack Fits up to 15.4-Inch Screens, Metallic Black RG0322	172
29268	CalPak Alpine Laptop Backpack	172
10515	"Case Logic BPEP-115BLACK Polyester Carrying Case Backpack for 15.6"" Notebook, Tablet - Black"	172
18014	Laptop Backpack Black Large Capacity Travel Backpack Nylon Backpack Waterproof	172
12282	Green/Green The North Face Router Backpack - 2502cu in	172
15812	Everki EKP129 GLIDE LAPTOP BACKPACK, FITS UP TO 17.3	172
14442	Timbuk2 Command Laptop TSA-Friendly Backpack	172
14558	RCD 3060 OS Mini OSD FPV Module	172
23004	Ancipe Vintage Canvas Leather Trim School Bag Laptop Travel Rucksack Backpack	172
37123	Artone MH Series Unisex-Adult Eco Purple Linen Laptop Backpack	172
44518	"Don't Worry and Be Happy Design Full-Body Protective Plastic Case for MacBook Pro 13""/15"" (Non-Retina)"	172
30986	OGIO Ruck 22 Laptop Backpack	172
43627	Unisex Casual Canvas Camping Backpack Travel Shoulder School Bag Case for Apple MacBook Pro with Retina display 13'' 15'' / HP / Dell /Lenovo / ASUS / Toshiba / Acer /Sony 15.6 inch Laptops England Flag Design	172
23271	Targus Geo 13.3-Inch Tablet or Laptop Backpack Sling, Gray/Black TSB80704	172
10515	"Case Logic Berkley Plus 15.6"" Laptop + Tablet Backpack - notebook carrying backpack -"	172
3320	"Distressed Leather 17"" Laptop Backpack"	172
43042	"Laptop Bag fits Lenovo ThinkPad W530 [Sky Blue / Pink / Yellow Floral with Brown Handles] Universal Fit for Laptops between 12.5"" - 15.1"" + NextDia Cable Wrap"	172
16860	"Su.B - Model Assel13RW: 13""Inches Dutch Design Women's Professional Laptop Shoulder Bag Handbag. Made of Genuine Split Leather - Red and White"	172
43627	Victoriacross 12-15 inch Laptop macbook Organizer backpack. with Audio Interface. notebook tablet computer,knapsack,rucksack bag Comfortable back Ergonomic shoulder straps for man woman travelling,camping,Hiking business and casual Storage Clear Containers VC418-C-Black	172
44518	"Just Do it Design Full-Body Protective Plastic Case for MacBook Pro 13""/15"" (Non-Retina)"	172
23271	Microsoft MT Backpack for 16-Inch Laptops Red Trim	172
11272	Selected Eco Backpack up to 17.3 Blk By Mobile Edge	172
21488	Oflamn Unisex-adult Canvas Backpack Bags Coffee	172
29268	Digital Camo Laptop Backpack	172
23271	Targus CityGear Backpack Case for 17 Inch Notebooks TCG216 Black with Grey	172
43042	"Laptop Bag fits Apple MacBook Air MC966LL/A [Sky Blue / Pink / Yellow Floral with Brown Handles] Universal Fit for Laptops between 12.5"" - 15.1"" + NextDia Cable Wrap"	172
29268	Snoogg 15.6 Inch Nylon Laptop Backpack School Backpack Casual Daypack With Compartments	172
29268	Solid Quilted Backpack Hp	172
23271	Targus TBB012USP1-BRO Zip-Thru Air Traveler Backpack - Notebook carrying backpack - 16 inch - black	172
41819	Black The North Face Router Charged Laptop Backpack - 2502Cu In	172
29268	Snoogg 15.6 Inch Nylon Laptop Backpack School Backpack Casual Daypack With Compartments	172
18014	Swiss Army Backpack Military 15.6 Inch Laptop Backpack Notebook Computer Bag Men Travel Fashion Casual Rucksack School Bags for Boys	172
29268	Chevron/Patterned Zipper Closure Backpack with Pockets	172
11272	"V7 Edge Cbd2 Carrying Case Backpack For 17.3"" Notebook Black , Black"	172
44518	"Vintage Bird Design Full-Body Protective Plastic Case for MacBook Pro 13""/15"" (Non-Retina)"	172
44518	"Bat Design Full-Body Protective Plastic Case for MacBook Pro 13""/15"" (Non-Retina)"	172
29268	Snoogg 15.6 Inch Nylon Laptop Backpack School Backpack Casual Daypack With Compartments	172
23004	Gumstyle® Vintage Solid Color Pu Leather Leisure Laptop Backpack for College	172
22063	Piel Leather Slim Computer Backpack	172
29268	Snoogg 15.6 Inch Nylon Laptop Backpack School Backpack Casual Daypack With Compartments	172
11416	Targus TBB013US Spruce EcoSmart Backpack, 13 x 8 1/4, x 18 3/4, Black	172
44518	"Phone Booth And Falling Snow on The City Design Full-Body Protective Plastic Case for MacBook Pro 13""/15"" (Non-Retina)"	172
29268	Snoogg Shiva Dumroo Laptop Backpack Casual School Backpack	172
40637	"Kensington K62617ww LS150 Laptop Backpack for 15.6"" Notebook/Tablet, Black"	172
30400	Duluth Pack 17-Inch Laptop Book Bag	172
1709	"Solo Pro 16"" Laptop CheckFast Backpack with removable sleeve, Black, CLA703-4"	172
29268	Snoogg 15.6 Inch Nylon Laptop Backpack School Backpack Casual Daypack With Compartments	172
17347	Pelican U105 Lite Laptop Backpack Black pel-u105-bk	172
4426	JanSport Super Student Backpack Black	172
31718	Swissgear 67329140 SWISS GEAR LEGACY 16IN / 41 CM COMPUTER BACKPACK GREY	172
14442	Timbuk2 Telegraph Laptop Backpack Night Blue/Pacific	172
1709	"Solo Pro 16"" Laptop CheckFast Backpack with removable sleeve, Black, CLA703-4"	172
18014	Ecogear Mohave Tui II Backpack Color: Aqua / Blue	172
29268	Snoogg Chihuahua Haha Laptop Backpack Casual School Backpack	172
29110	Chelsea FC Outdoor Backpack School Book Bag Backpack CFC-BP5S07	172
10515	Case Logic Security Friendly Notebook Backpack	172
1705	Statue of Liberty Design Full-Body Protective Plastic Case for 11-inch/13-inch New MacBook Air	172
29268	Eastpak Floid Laptop Backpack	172
10515	"Case Logic Berkley Plus 15.6"" Laptop + Tablet Backpack - Notebook carrying backpack - 15.6"" - wasabi"	172
36274	"Rikki Knight ""Everton"" Name - Cute Blue Owl on Branch with Personalized Name Design Lightning Series Gaming Mouse Pad (MPSQ-RK-11043)"	172
29782	2014 Swiss Gear new style 15.6 inch computer notebook Laptop teblet backpack.SA1009-Green	172
25708	Alienware Awvbp17 Vindicator 17In Backpack	172
37923	"HP Essential Carrying Case Backpack for 15.6"" Notebook H1D24AA"	172
19141	Laptop Backpack, Spigen® 13 inch Laptop Backpack [Klasden 2 Backpack] [Gray] Laptop Bag fits up to 13 inch Laptop	172
19159	Keef Burton Traction Laptop Backpack - 1465Cu In	172
42503	"Targus TSB193US Trek Carrying Case (Backpack) for 16"" Notebook - Black, Yellow, White Accent - Polyester"	172
44518	"Albert Einstein Quotes Design Full-Body Protective Plastic Case for MacBook Pro 13""/15"" (Non-Retina)"	172
1664	Bubble Laptop Computer Backpack - Black	172
34667	EcoCity STAR Girls Cute Backpack Bookbags Laptop Back pack Red	172
18014	Trans Jansport Megahertz Laptop Computer Backpack Tie Dye Blue Red Orange Yellow Green	172
43042	Laptop Computer Accessories from VanGoddy Presents This Kroo Carbon Fiber Look Blue EVA Shell Backpack for Samsung Series 9 15 Inch Notebooks + VanGoddy LIVE*LAUGH*LOVE Wristband + Supertooth Disco Bluetooth Speaker + Retractable USB Mouse + 6 Foot HDMI Cable	172
37320	Dakine Explorer Pack Laptop Backpack, Blocks	172
31718	"SwissGear by Wenger the Granite 16"" Computer Laptop Backpack"	172
29268	Snoogg Sailor'S Delight Laptop Backpack Casual School Backpack	172
43042	Toshiba Satellite 15.6 Inch Notebook Laptop CheckPoint Friendly Reinforced Hard Shell Backpack with Internal Nylon Compartment Pockets , Fits models P755-3DV20, P755D-S5266, P755-S5268, P755-S5270, P755-S5272, P755-S5380, P755-S5395, P755-S560, T4500 Color Black / Blue + NuVur  Keychain (NBAGCAB1)	172
15183	"Mobile Edge Genuine 16"" Express Backpack Bk/Yellow"	172
18014	Laptop 15.6 Inch School Bags Men and Women Travel Business Computer Backpack Case Bags Multifunction Travel Bag	172
10515	"17"" Backpack Asst Colors Case - 24 Pk."	172
15443	Yens® Fantasybag Eco-Green School Canvas Backpack ,BP-8512	172
17347	Pelican Ou1050-0003-110 15.6 Lite Progear R U105 Notebook Backpack	172
29268	Pacific Gear Horizon Rolling Laptop Backpack	172
43042	Apple Macbook Pro 15 Inch Notebook Laptop CheckPoint Friendly Reinforced Hard Shell Backpack with Internal Nylon Compartment Pockets Color Black / Blue + NuVur  Keychain (NBAGCAB1)	172
44518	"The Fierce Tiger Design Full-Body Protective Plastic Case for MacBook Pro 13""/15"" (Non-Retina)"	172
42503	"Targus Quash TSB618 Carrying Case Backpack for 15.6"" Notebook - Black"	172
19159	Burton Traction Laptop Backpack - 1465cu in	172
31718	"15.6"" Laptop Backpack"	172
29268	Coleman RTX 3500 35L Backpack with Laptop Pocket	172
43627	Tigernu Unisex Business Laptop Backpack 15.6 Inch/Yellow	172
41361	Hornettek, LLC DataShell Robust Armor Backpack for 15-Inch Laptop CBP-AT15-SR	172
25365	HP Business Backpack	172
44518	"Oil Painting Lovers in the Rain Design Full-Body Protective Plastic Case for MacBook Pro 13""/15"" (Non-Retina)"	172
11272	"Mobile Edge SUMO MEBPE82 Express Carrying Case Backpack for 17"" MacBook, Notebook - Lavender Mobile EdgeMEBPE82"	172
11272	Mobile Edge Express Backpack , Black, Yellow	172
43042	TMNT Shell Backpack	172
44518	"Russia Flag and Emblem Design Full-Body Protective Plastic Case for MacBook Pro 13""/15"" (Non-Retina)"	172
24122	Everest Deluxe Laptop Backpack Color: Black	172
15443	Deercon Womens Canvas Travel Satchel Shoulder Bag Laptop Backpack School Book Rucksack(Light blue)	172
43042	Reinforced Red Hard Carbon Fiber Laptop Backpack for School and Daily Life College , Motorcycle , Business for All Models of Acer 15.6-Inch Laptops AS5253-BZ602, Aspire TimelineX AS5820T-6401 ..ect + 3mm Black Earbud Earphones with microphone + Quality USB Retractable Mouse + Live * Laugh * Love Vangoddy Wrist band!!!	172
37303	"* Executive Laptop Backpack, 17.3"", 13 3/4 x 7 x 19 1/2, Black"	172
4229	Red Candy Backpack Laptop Bag for 15.6 inch Samsung NP300V5A-A04US Notebook + An Ekatomi Hook.	172
21488	Santimon - Canvas Large Capacity Travel School Laptop Backpack Bags Red Medium	172
28386	6 Pack USB MINI GLITTER LAVA LAMP (SILVER) (Catalog Category: COMPUTER-EQUIPMENT / COMPUTER ACCESSORIES)	172
29268	HEX Coast Laptop Backpack	172
29268	Snoogg 15.6 Inch Nylon Laptop Backpack School Backpack Casual Daypack With Compartments	172
18014	Bronze Times 15 inch Notebook Laptop Polyester Backpack	172
34643	Americian Shield Travel Gear School Gear computer notebook Laptop teblet inch Backpack.ASTA68-C3 Red	172
14442	Timbuk2 Blackbird Laptop Backpack	172
42503	Targus Flipview - Protective case for web tablet - polyurethane, polycarbonate, twill - midnight b *	172
22063	Piel Leather Half-Moon Laptop Backpack	172
44518	"Pretty Flowers Design Full-Body Protective Plastic Case for MacBook Pro 13""/15"" (Non-Retina)"	172
43627	Solo Vintage Colombian Leather Laptop Backpack, Holds Notebook Computer up to 15.6 Inches, Espresso VTA701-3	172
44518	"Pretty Flowers Design Full-Body Protective Plastic Case for MacBook Pro 13""/15"" Non-Retina"	172
31718	"Swiss Gear ""MARS"" 16"" Laptop Backpack - Navy/Red"	172
23004	Cfanny Unisex Smart Rucksack Laptop Backpack College Bag with Clasp,Blue,One Size	172
37303	Jill.e Designs Just Dupont 15-Inch Laptop Backpack, Black (464101)	172
23271	Targus C4 Backpack for Laptops up to 16-Inch TSB70902US Blue/Black	172
9612	miim 15.6-Inch Laptop Backpack (Red) with Padded Shoulder Straps / Free Gift Pouch Fast Shipping	172
11272	"Mobile Edge 17.3"" Premium Backpack Slv/bk mebpp2 -"	172
6021	J World New York Elemental Laptop Backpack	172
29268	Snoogg 15.6 Inch Nylon Laptop Backpack School Backpack Casual Daypack With Compartments	172
11272	Mobile Edge Men's ScanFast Checkpoint and Eco Friendly Backpack- 17.3-Inch PC/17-Inch MacBook	172
44518	"Paris Sightseeing Design Full-Body Protective Plastic Case for MacBook Pro 13""/15"" (Non-Retina)"	172
39406	2015 NEW Swiss Gear 15.6 inch new style classic computer notebook Laptop teblet Daypack Backpack.SA6661-C1-Red	172
30986	OGIO International Bandit Laptop Backpack	172
29268	CalPak Orbit 18-inch Deluxe Laptop Backpack	172
1351	Business and Casual Travel Gear fashion computer notebook Laptop Daypack Backpack.B7703-C1	172
4229	Wolf horse canvas shoulder bag Korean leisure bag computer bag backpack school students	172
3291	Real Madrid Cristiano Ronaldo 7 Bag Casual Laptop Backpack Cosplay Schoolbag Sky Black	172
18014	Anime K-on! Yui Hirasawa Backpack Bag	172
29268	Snoogg Easy Anchor Laptop Backpack Casual School Backpack	172
29268	Snoogg 15.6 Inch Nylon Laptop Backpack School Backpack Casual Daypack With Compartments	172
14442	Timbuk2 Moby Laptop Backpack	172
29268	Snoogg Paisley Print Blue Laptop Backpack Casual School Backpack	172
1705	Nymeria 19 Customized New York City New Diy Design Sleeve For Macbook Pro 13 Two Sides GN-227	172
12282	Brown The North Face Router Backpack - 2502cu in	172
29268	Snoogg 15.6 Inch Nylon Laptop Backpack School Backpack Casual Daypack With Compartments	172
42503	"Wenger SHERPA Carrying Case Backpack for 16"" Notebook - Gray - Foam - 28016050"	172
43627	Tide Student Canvas Backpack for for Laptops / Notebooks 15.6 Inch	172
10515	"EVA Backpack for Toshiba Satellite C50 15.6"" Laptop"	172
10515	"Green Travel On-The-Go Wheeled Rolling 15.6"" Laptop Backpack - Black & Red"	172
44518	"Water Colorful Vortex Design Full-Body Protective Plastic Case for MacBook Pro 13""/15"" (Non-Retina)"	172
15443	Deercon Women Canvas Casual Travel Satchel Shoulder Bag Laptop Backpack School Rucksack(sky blue)	172
15443	Deercon Women Canvas Casual Travel Satchel Shoulder Bag Laptop Backpack School Rucksack(Light blue)	172
23271	Targus Volarix Backpack for 15.6-Inch Laptops, Black TSB780US	172
44518	"Wildflower Design Full-Body Protective Plastic Case for MacBook Pro 13""/15"" (Non-Retina)"	172
29268	Snoogg 15.6 Inch Nylon Laptop Backpack School Backpack Casual Daypack With Compartments	172
10515	Lenovo 78001170 Case Logic 15.6 inch Laptop & Tablet Slim-profile Backpack - Notebook carrying backpack - 15.6 inch - black	172
14442	Timbuk2 Slate Laptop Backpack	172
44518	"Pink Autumn Forest Design Full-Body Protective Plastic Case for MacBook Pro 13""/15"" (Non-Retina)"	172
44518	"Purple Texture Design Full-Body Protective Plastic Case for MacBook Pro 13""/15"" (Non-Retina)"	172
14769	Creativebags Laptop Daily Backpacks for Men Women Teenagers School Travel Hiking Camping Outdoor Sports	172
43042	Red - Black Hard Shell Nylon Backpack Check Point Friendly Bag with Multiple Compartments fits most Acer Aspire 5732Z-4598 Acer Aspire 5734Z-4512 Acer Aspire 5736Z-4826 Acer Aspire 5740-5749 Acer Aspire 5741-3541 Laptop + EnvyDeal Cable Tie (NBAGCAR1)	172
4229	Red Candy Backpack Laptop Bag for 15.6 inch Acer AS5253-BZ656 Notebook + An Ekatomi Hook.	172
44518	"Wolf Design Full-Body Protective Plastic Case for MacBook Pro 13""/15"" (Non-Retina)"	172
18014	YIYINOE Brand Casual Nylon Waterproof 14 inch Notebook Computer Laptop Bag Laptop Backpack for Men Women Travel Business School Backpack Red	172
44518	"Albert Einstein Quotes Design Full-Body Protective Plastic Case for MacBook Pro 13""/15"" (Non-Retina)"	172
37551	SENDIWEI S-208W Nylon Waterpfoof Laptop Computer Backpack Fits Most 15 Inch Laptops 3#	172
44518	"Pixar Up Design Full-Body Protective Plastic Case for MacBook Pro 13""/15"" (Non-Retina)"	172
31718	"Wenger SwissGear THE SPARK 16"" Laptop Computer Backpack= Black"	172
35852	"18"" Genuine Leather Laptop Backpack"	172
37320	Dakine Explorer Laptop Backpack	172
43627	Powerlogic Citi:Trip Laptop Backpack / Bag Medium Graphite	172
33182	Incase Campus Compact Backpack - Purple/Warm Gray - CL55469	172
29268	Forever Collectibles NFL Primetime Laptop Backpack	172
39406	CHOOCI 14-Inch notebook computer Backpack CU0120 black and red	172
23271	Targus Genuine Zip Thru Air Traveler Backpack	172
11272	Mobile Edge Express Backpack 2.0 - T - MEBPE22	172
43042	Boblbee Disney Mickey Mouse Hard Shell Backpack Scarabee	172
37320	Dakine Crossroads Laptop Backpack	172
43042	"Laptop Bag fits Lenovo G510 [Sky Blue / Pink / Yellow Floral with Brown Handles] Universal Fit for Laptops between 12.5"" - 15.1"" + NextDia Cable Wrap"	172
29268	HP PROFESSIONAL BACKPACK	172
15443	Fjallraven Rucksack No. 21 Small Ochre OS -Kids	172
3617	"Laptop Backpack, 17.3"", 13""x9-1/2""x18-1/2"" ,Black/Blue, Sold as 1 Each"	172
15831	SINPAID Shoulders Computer Bag SP-250 Laptop Backpack Computer Book Bag Gray	172
29268	Snoogg 15.6 Inch Nylon Laptop Backpack School Backpack Casual Daypack With Compartments	172
43042	20L Water Resistant Nylon Child Reflective Rucksack Laptop Backpack (38*25*15cm) Blue	172
10515	"Case Logic Griffith Park - Notebook carrying backpack - 15.6"" - black"	172
17151	Real Madrid Cristiano Ronaldo 7 Bag Casual Laptop Backpack Cosplay Schoolbag Camouflage Blue	172
23271	"New - CityGear 16"" Commuter Backpack by Targus - TBB018US"	172
15443	Deercon Women Canvas Backpack Satchel Rucksack Shoulder Bag Laptop Travel School Bag(rose Red)	172
15831	SINPAID Men/Women's Computer Laptop Notebook Backpack Carrying Laptop Case Notebook Bag	172
19141	Timbuk2 Yield Laptop Backpack, Peat Green/Algae Green/Peat Green, One Size	172
14442	Timbuk2 Amnesia Laptop Backpack	172
23271	Targus CityGear Chicago Backpack Case for 16-Inch Notebooks, Black TCG650	172
37123	Artone Leisure Lightweight Campus Backpack Candy Color School Bag With Laptop Compartment	172
17347	S100 Sport Elite Laptop Backpack S100 Sport Elite Laptop Backpack	172
11272	Mobile Edge Premium Backpack Yellow/Black MEBPP4	172
3264	"* Active Laptop Backpack, 17.3"", 12 1/2 x 6 x 18 3/4, Black"	172
30986	OGIO charger 17-inch laptop backpack BLIZZARD	172
14442	Timbuk2 Parkside Laptop Backpack	172
15831	Sinpaid Shoulders Computer Bag SP-250 Laptop Backpack Computer Notebook Bag	172
6021	J World New York Willow Laptop Backpack Pink	172
15443	Deercon Womens Canvas Travel Satchel Shoulder Bag Laptop Backpack School Book Rucksack(Black)	172
29268	Snoogg Dog'S Make Friends Laptop Backpack Casual School Backpack	172
18014	"Deluxe 15.4"" Laptop Computer School Backpack- Camo by Superdeals Store"	172
9612	Dell Half-Day 15.6-Inch Backpack 32DF1	172
29268	Zeepac Laptop Backpack	172
43627	Jiyaru Unisex Canvas Zip Bohemia Boho Style Backpack School Laptop Bag Purple	172
10515	Case Logic Berkeley BPCA-114 14-Inch Laptop Backpack (Anthracite)	172
4229	Korean canvas shoulder bag computer bag backpack school students	172
15443	Sumdex X-sac Travel Smart Laptop Backpack	172
10515	Case Logic DSS-103 Luminosity Large Sling Backpack (Black)	172
29268	Snoogg 15.6 Inch Nylon Laptop Backpack School Backpack Casual Daypack With Compartments	172
29268	Fjallraven Kanken Laptop Backpack	172
31718	SwissGear Computer Backpack	172
44518	"Snakes Skin Design Full-Body Protective Plastic Case for MacBook Pro 13""/15"" (Non-Retina)"	172
