15831	Sinpaid TKGO Korean Style Bag HB8-06 Travel Notebook Casual Case Backpack Young Gray	172
37320	Dakine Frankie Laptop Backpack	172
40726	"SLAPPA Stovepipe Duffle 16"" Laptop Backpack Black Ballixtix"	172
6584	"Affordable, Stylish Ballistic Nylon Computer Briefcase in Black, Accommodates up to 15.4"" Laptops - 19"" X 17"" X 6"""	172
17347	Pelican PEL-U140-BK U140 Elite Tablet Backpack Black	172
23271	Monoprice 16-Inch Torx Laptop Backpack - Black (110760)	172
15443	"Chinatera GRID-IT 15"" Organizer Double Shoulder Travel Bag Laptop Backpack"	172
43042	DDI Laptop / Portfolio / Backpack In One - Black Case Pack 6	172
6584	Spruce Ecosmart Backpack 13 X 8-1/4 X 18-3/4 Black	172
15443	Deercon Women Canvas Casual Travel Satchel Shoulder Bag Laptop Backpack School Rucksack(Beige)	172
18014	YIYINOE Brand Double Shoulder Designer 15 15.6 inch Men Women Notebook Computer Laptop Backpack for Travel Laptop Bag Student School Bag Grey	172
1098	Mens Business Bag Laptop Backpack Large Capacity Travel BAG	172
15443	Deercon Unisex Canvas Travel Satchel Shoulder Bag Laptop Backpack School Rucksack(Gray)	172
31718	"Black 16"" Sidebar Computer Backpack With Tablet / eReader Pocket"	172
30426	Creativebags Waterproof Laptop Backpacks School Notebook Rucksacks Women Girls Travel	172
14442	Timbuk2 Amnesia Laptop Backpack	172
37303	Contour Laptop Backpack, Nylon, 15 3/4 x 9 x 19 1/2, Black	172
43627	Veevan Large Laptop Backpack for Business/ College	172
29268	Razors Humble 7 Backpack 2014 Black-Blue	172
23271	Targus RG0322 5.4 Matrix Notebook Backpack Fits up to 15.4-Inch Screens, Metallic Black RG0322	172
23271	"1 - 16"" Komen Paris Backpack Black"	172
34327	The Leopard Design Full-Body Protective Plastic Case for 11-inch/13-inch New MacBook Air	172
40726	"Baida Unisex Black Laptop Backpack Fits up to 16"" Laptop"	172
29268	Snoogg Funny Face Inserted Laptop Backpack Casual School Backpack	172
44518	"Ferris Wheel Design Full-Body Protective Plastic Case for MacBook Pro 13""/15"" (Non-Retina)"	172
23271	Lenovo 78004336 TARGUS GS CASE 13.3IN HARD SIDED LAPTOP	172
12148	Lovely Women Backpack Angel Wings Satchel PU Leather Optional Shoulder Bag x1pcs	172
41080	Fashion Canvas Backpack Rucksack Schoolbag, Green	172
43042	DDI - Laptop / Portfolio / Backpack In One - Black Case Pack 6	172
5295	HotStyle 924s Classic Canvas Retro Rucksack Backpack 19L - With Padded Laptop Sleeve Khaki	172
23271	Backpack With Double Speakers - LED Directional Sign Lights	172
11272	Mobile Edge Express Backpack- 16-Inch PC/17-Inch Mac Black/Yellow	172
29268	Snoogg Aztec Pattern Mustard Laptop Backpack Casual School Backpack	172
8760	Artone Unisex Water Resistant Oxford Fashion Dots Laptop Backpack School Daypack With Laptop Compartment Blue	172
31718	"15.6"" Laptop Backpack"	172
10515	Case Logic BPEP-115BLACK Polyester Carrying Case Backpack for 15.6 Notebook Tablet - Black Case Logic BPEP-115BLACK	172
37320	Dakine Crossroads Laptop Backpack	172
18236	"Toshiba Carrying Case (Backpack) for 16"" Notebook - Black PA1493U-1BS6 by Toshiba"	172
23271	"Microsoft Rainier 39300 Nylon Notebook Backpack - Fits up to 15.6"" Black"	172
37320	DAKINE Premier Zuri Laptop Backpack	172
18014	Targus Sport Standard 15 Nylon Notebook Backpack	172
6980	Onwardpacks Laptop and Tablet Backpack - Purple - Give Towards Arts	172
23271	Targus Unofficial Backpack Case Designed for 16 Inch Laptops TSB168US Black	172
9612	Backpack 'Converse' large gray mouse + computer.	172
29268	Snoogg Wave Print Laptop Backpack Casual School Backpack	172
11416	Xenon 2 Laptop Backpack, 12.25 x 8.25 x 17.25, Nylon, Black	172
44518	"Cat with Sexy Glasses Design Full-Body Protective Plastic Case for MacBook Pro 13""/15"" (Non-Retina)"	172
14797	Lenovo Performance Backpack	172
43042	Avenues Compact Ballistic Nylon Laptop Notebook Computer Backpack - Black	172
43042	15.6 VIZAIR LAPTOP BACKPACK BLACK	172
29268	Snoogg 15.6 Inch Nylon Laptop Backpack School Backpack Casual Daypack With Compartments	172
29268	HEX Coast Laptop Backpack	172
10056	YIYINOE Brand Waterproof 100% High Quality 15 15.6 inch Men Women Notebook Computer Laptop Backpack for Business Laptop Bag Student School Bag Purple	172
29268	Victorinox Luggage Altmont 2.0 Slimline Laptop Backpack	172
29268	Snoogg 15.6 Inch Nylon Laptop Backpack School Backpack Casual Daypack With Compartments	172
6584	"JanSport Envoy Backpack - Berrylicious Purple / 19""H x 13""W x 8""D"	172
33124	Laptop Round Casual Backpack, Blue	172
15831	Sinpaid Midtown Perfect Fit Urban Laptop Backpack	172
4714	Good&god Pu Leather Laptop Backpack School Bookback Bag	172
23271	Targus RG0322 5.4 Matrix Notebook Backpack Fits up to 15.4-Inch Screens, Metallic Black RG0322	172
10515	Case Logic Berkeley Deluxe 15.6-Inch Laptop and Tablet Backpack (BPCA-215)	172
10599	"SwissGear Blue Ibex 17"" Computer Backpack, 15""L x 10""W x 19""H"	172
37320	DAKINE Capital Laptop Backpack, 23-Liter, Midnight	172
5058	Tigernu Laptop Travel Backpack Multifunction Hiking Daypack,Red	172
37923	"Zenness Business Backpack SPAD-06 for 15.6"" Laptop"	172
23271	Targus 16-Inch Ultralight Backpack, Black (TSB515US)	172
23271	Targus Targus Grove Notebook Backpack	172
10515	Case Logic 16-Inch Security-Friendly Laptop Backpack CLBS-116	172
3291	San Tokra Galaxy Star Pattern Canvas Travel Backpack School Leisure Bag	172
17347	Pelican S145 Sport Tablet Lite Backpack Orange	172
6687	Thule Crossover TCBP-317 25L Backpack for 15-Inch MacBook Pro or PC (Black)	172
11415	"Targus Conquer 16"" Backpack, 11-8/10 x 7-1/2 x 18-3/4, Black TRGTSB214US"	172
11416	-- Xenon 2 Laptop Backpack, 12.25 x 8.25 x 17.25, Nylon, Black	172
1709	"Solo Pro 17.3"" Laptop Backpack , Black, UBN701-4"	172
29268	Ferrari Active Laptop Backpack	172
29268	Snoogg 15.6 Inch Nylon Laptop Backpack School Backpack Casual Daypack With Compartments	172
29268	Snoogg 15.6 Inch Nylon Laptop Backpack School Backpack Casual Daypack With Compartments	172
21625	"HEWLETT-PACKARD Carrying Case Backpack for 15.6"" Notebook / H4J93UT /"	172
10515	2KV9432 - Case Logic MLBP-115 Carrying Case Backpack for 15.6 Notebook - Black	172
43042	Laptop Computer Accessories from VanGoddy Offers This Kroo Carbon Fiber Look Pink EVA Shell Backpack for Toshiba Satellite P750 Series 15 Inch Notebooks + VanGoddy LIVE*LAUGH*LOVE Wristband + 6 Foot HDMI Cable	172
11272	MOBILE EDGE 15.4 womens express notebook backpack pink ribbon	172
29268	Excel Laptop Backpack	172
23271	Targus Groove Notebook Backpack CVR600	172
29268	"Denco Sports Luggage NCAA Auburn University Tigers 19"" Laptop Backpack Black"	172
18236	"Victorinox Carrying Case (Backpack) for 16"" Notebook - Gray, Black 600734"	172
25073	Hetalia Axis Powers Print Backpack School Shoulder Bag	172
30986	Ogio Mercur Laptop Backpack Black	172
31187	"V7 Edge CBD2 Carrying Case (Backpack) for 17.3"" Notebook - Black - Moisture Resistant CBD2-BLK-9N"	172
44518	"Lovely Flower Design Full-Body Protective Plastic Case for MacBook Pro 13""/15"" (Non-Retina)"	172
10515	"SOLO Tech - 17.3"" Laptop and iPad Backpack"	172
10056	Aspen Men Mesh Computer Backpacks for Business Laptop Backpack School Back Packs	172
34667	Back to School Summer Sale! For students or professional use. Pink Candy Backpack Laptop Bag for 15.6 inch Samsung...	172
42503	"Eco Style Vortex Carrying Case Backpack For 16.1"" Notebook - Checkpoint Friendly ""Product Category: Accessories/Carrying Cases"""	172
29268	Ultimate Gaming Backpack	172
11272	MBLMEAWBP20 - MOBILE EDGE MEAWBP20 17.3quot; Alienware Orion Backpack	172
29268	Lux Laptop Backpack Color: Seafoam	172
14442	Timbuk2 Madrone Cycling Laptop Backpack	172
42503	"Lenovo, Thinkpad Essential Backpack Notebook Carrying Backpack 15.6"" For Thinkpad L540, T540, W540, X1 Carbon Touch, X140, X240, Thinkpad Yoga 11, 11E Chromebook ""Product Category: Supplies & Accessories/Notebook Carrying Cases"""	172
43042	STM Drifter, Laptop Backpack for 15-Inch Laptop - Graphite (stm-111-037P-16)	172
44518	"Switzerland Flag Design Full-Body Protective Plastic Case for MacBook Pro 13""/15"" (Non-Retina)"	172
7921	Sumo Combo Backpack - 14.1-Inch PC / 15-Inch MacBook Pro fits all iPad generations including iPad4	172
29268	Belkinponents Backpack For 13 Laptop	172
44518	"Street Sight Design Full-Body Protective Plastic Case for MacBook Pro 13""/15"" (Non-Retina)"	172
23271	Targus Student Essentials Backpack Bundle BUS0196 -	172
10515	Case Logic Backpack for 16-Inch Laptop ZLBS-216	172
29547	"- Storm 16"" Backpack, 18 3/4 x 6 3/4 x 13 1/2, Polyester, Black/Gray -"	172
30018	Leaper Unique Style Laptop Backpack/ School Bag/ Travel Daypack with Laptop Lining	172
11272	"Mobile Edge Alienware Orion Backpack - Notebook carrying backpack - 17.3"" - black - ALIENWARE ORION BACKPACK HOLDS 17.3IN SCREENS"	172
15183	"Case Logic 15.6 Notebook & Tablet Backpack ""Product Category: Notebook Accessories/Notebook Cases"""	172
15443	Deercon Unisex Canvas Travel Satchel Shoulder Bag Laptop Backpack Rucksack with a samll bag(green)	172
12282	Grey Osprey Packs Cyber Backpack - 1587Cu In	172
1351	Business and Casual Travel Gear fashion computer notebook Laptop Daypack Backpack.B7702-C3	172
6584	"Rosewill Red Line RL-GAMMA Carrying Case Backpack for 15.6"" Notebook - Black - Shock Absorbing Shoulder Strap - RL-GAMMA"	172
15443	Oplaza Unisex Fashionable Super Cute Canvas Backpack School Bag Laptop for Teens	172
18014	"Lifeplate Bulletproof Backpack Insert NIJ IIIa Compliant ""Book Bag Armor"" Blue 12""x15"" "	172
17347	Pelican - S105 Sport Laptop Backpack	172
30018	Daosen Casual Style Laptop Backpack Sport Bag School Bag Travel Daypack Handbag	172
29110	FC Barcelona Outdoor Backpack School Book Bag Laptop Backpack FCB-BP002+Sackpack	172
11272	Mobile Edge EVO Backpack 16 in. PC / 17 in. Mac	172
31718	"Navy / Grey Mercury 16"" Laptop Backpack"	172
42503	"Targus - TSB75001US - ""16"""" Compact Rolling Backpack"""	172
29268	Osprey Quasar Laptop Backpack	172
4229	Pink Candy Backpack Laptop Bag for 15.6 inch Lenovo G570-43347PU Notebook + An Ekatomi Hook.	172
23271	Dell Adventure Backpack Carrying Case - Fits laptops with Screen Sizes Up to 15.6-inch	172
29268	Snoogg 15.6 Inch Nylon Laptop Backpack School Backpack Casual Daypack With Compartments	172
3291	Coffee color Backpack For Student,Teenager School Back Pack,Women's Casual Daypacks,Men Canvas Laptop Backpack,Girls Female Mochila,Rucksack A2582	172
43042	Dell Vostro 15.6 Inch Notebook Laptop CheckPoint Friendly Reinforced Hard Shell Backpack with Internal Nylon Compartment Pockets , Fits models 1015, 1540, 3550 Color Black / Blue + NuVur  Keychain (NBAGCAB1)	172
39124	Business and Casual Travel Gear computer notebook Laptop teblet inch Backpack.SA9275-C2	172
18014	National Geographic Ng S5303 Day Pack Laptop Notebook Backpack Bag Bluish Green	172
21488	Santimon Canvas Leisure Beautiful flower Printing School Grils Backpack Fruitgreen Medium	172
44515	Fjallraven Laptop 17 Inch Warm Yellow OS -Kids	172
4229	New Canvas Zipper Solid Storage Bucket Bags Kitbag Backpack Black	172
10599	"SwissGear Blue Ibex 17"" Computer Backpack, 15""L x 10""W x 19""H"	172
41819	Black The North Face Surge Ii Charged Laptop Backpack - 1953Cu In	172
15831	"Duronic LB20 upto 13"" Small Backpack Case Black Rucksack Bag for Laptop Notebook Android Samsung Apple iPad tablet"	172
15831	Cenmao Unisex`s Laptop Computer Backpack Package Including 1pc Small Cotton Coin Bag As a Gift	172
18014	1Pcs New Mini USB LED Night light Camping lamp For Reading Bulb Laptops Computer Notebook Mobile Power Charger Warm White	172
4426	JanSport Air Cisco Backpack Black/Prism Purple Flashback Zebra	172
39406	"The Jupiter 16"" Laptop Computer Backpack Color: Maroon"	172
1351	Business and Casual Travel Gear fashion computer notebook Laptop Daypack Backpack.L1620-C1	172
27144	Granite Gear Echo Backpack	172
44518	"Water Colorful Elephant Design Full-Body Protective Plastic Case for MacBook Pro 13""/15"" (Non-Retina)"	172
42503	"Targus Legend IQ Backpack - Notebook carrying backpack - 16"" - black"	172
11272	"Mobile Edge 17.3"" Premium Backpack Bk/ch mebpp1 -"	172
4229	Blue Candy Backpack Laptop Bag for 15.6 inch Dell Inspiron i15R-2728MRB Notebook + An Ekatomi Hook.	172
29268	Snoogg 15.6 Inch Nylon Laptop Backpack School Backpack Casual Daypack With Compartments	172
37303	Contour Laptop Backpack, Nylon, 15 3/4 x 9 x 19 1/2, Black	172
15831	SINPAID Outside Laptop Backpack Computer Book School Travel Bag Shoulder Bag Case	172
18014	SINPAID Unisex College School Laptop Backpack Notebook Bag-Should Straps, Blue	172
11272	Mobile Edge Express Backpack 16 in. PC / 17 in. M	172
34667	Back to School Summer Sale! For students or professional use. Pink Candy Backpack Laptop Bag for 15.6 inch Asus...	172
44518	"London Wallpaper Design Full-Body Protective Plastic Case for MacBook Pro 13""/15"" (Non-Retina)"	172
30986	OGIO International Tribune Laptop Backpack	172
30400	Duluth Pack 17-Inch Laptop Book Bag	172
42503	"Toshiba Carrying Case Backpack For 14.1"" Notebook - Black, Blue - Ballistic Polyester, Ripstop Polyester ""Product Category: Accessories/Carrying Cases"""	172
10515	Case Logic VNB-217 Value 17-Inch Laptop Backpack (Black)	172
43042	Incipio Expat Nylon Backpack - Black Checked BG-100	172
41080	ENVOY Durable Backpack Travel Daypack Laptop Shoulder Bag Bookbag for School Small Size	172
18014	Portable, Rosewill Backpack for 17.3-Inch Notebook Computer RMBP-12001 Consumer Electronic Gadget Shop	172
21625	"SAMSILL #36306 Polygon Carrying Case Backpack for 17"" MacBook, Notebook - Cobalt, Gray"	172
42835	"HP Carrying Case Backpack for 17.3"" Notebook, Tablet PC, Ultrabook H5M90UT"	172
17347	Pelican ProGear U145 Tablet Backpack - Black	172
29268	Snoogg 15.6 Inch Nylon Laptop Backpack School Backpack Casual Daypack With Compartments	172
9612	VanGoddy Bonni Collection Laptop Backpack for Dell 13.3 to 15.6-inch Laptops + USB Mouse + 4GB Thumbdrive + 7 Port USB Hub (Aqua Blue)	172
39124	Swiss Travel Gear Business and Casual Travel Gear computer notebook Laptop teblet inch Backpack.SA8089-C1	172
18014	Victoriacross 17 inch VC9917B-E1 Lightweight slim fashion business and casual travel school schoolbag Laptop notebook tablet ipad macbook backpack. for travelling,camping,Hiking gift computer,knapsack,rucksack sport outdoor Teens Girls Boys man woman Unisex	172
29268	Snoogg 15.6 Inch Nylon Laptop Backpack School Backpack Casual Daypack With Compartments	172
11272	"MOBILE EDGE MEAWBP20 17.3"" ALIENWARE ORION BACKPACK"	172
6584	"Mobile Edge Alienware Vindicator Carrying Case Backpack for 14.1"" Notebook - Black - Weather Resistant - Nylon - AWVBP14"	172
15831	Sinpaid BM-3 Business Bag Men Laptop Backpack Book Case Computer New Oxford	172
6021	J World New York Vista Laptop Backpack Black/Grey	172
29268	Snoogg 15.6 Inch Nylon Laptop Backpack School Backpack Casual Daypack With Compartments	172
29268	Laptop Backpack	172
16155	S140 Sport Elite Tablet Backpack	172
29268	Snoogg 15.6 Inch Nylon Laptop Backpack School Backpack Casual Daypack With Compartments	172
43042	15.6 Legacy Notebook Backpack	172
9612	"El Prado Collection 3 in 1 Backpack and Messenger Bag for HP ElitePad 1000 / ElitePad 900 10.1"" Tablets Pink "	172
39055	EVA Backpack for Lenovo ThinkPad T530 15.6-inch Laptops	172
40166	Sannea Vintage Genuine Leather Laptop Backpack School Rucksack	172
42503	"Targus - TSB750US - ""16"""" Compact Rolling Backpack"""	172
29268	Snoogg Motif Print Blue Laptop Backpack Casual School Backpack	172
22765	Le Donne Leather Distressed Leather Laptop Backpack	172
11272	Alienware Awbp18 Orion Notebook Backpack With Scanfast	172
39406	2014 Swiss Gear new style computer notebook Laptop teblet backpack.SA5045-C2	172
6021	J World New York Project Laptop Backpack	172
37320	Dakine Factor Laptop Backpack	172
29268	Adidas AC BP CAMPUS Laptop Sleeves Backpack Bookbag Z20014	172
39747	Vanguard BIIN 50 Backpack Black	172
29268	Snoogg 15.6 Inch Nylon Laptop Backpack School Backpack Casual Daypack With Compartments	172
43042	Kroo Carbon Fiber Look Blue EVA Shell Backpack for Sony Vaio E Series 15 Inch Notebooks + VanGoddy LIVE*LAUGH*LOVE Wristband + Black Sony Vaio E Series 15 Inch Compatible Earbuds	172
43627	MOONDOSA Unisex Shockproof Canvas 14 inch Laptop Business Backpack Travel Bag	172
1351	Business and Casual Travel Gear fashion computer notebook Laptop Daypack Backpack.L1620-C2	172
29782	Amazing Gear Travel School computer notebook Laptop teblet 15.6 inch Backpack.AGHE80-C3 Red	172
9612	Targus TSB80512 Bone / Black Geo 15.6-Inch Laptop Backpack	172
17287	"Samsonite Laptop Backpack Accommodates up to 15.6"" Laptop Silver"	172
1709	"Solo Active 17.3"" Laptop Backpack. Black, TCC703-4/20"	172
14442	Timbuk2 Showdown Laptop Backpack 2013	172
39406	Roberto Amee Computer Backpack Black Case Pack 10	172
42503	V7 Professional CBP1-9N Notebook Case - 16 - Backpack	172
13314	XMLUG SLR Camera Laptop Backpack 16022, Come with Free Rain Cover, Black	172
37320	Dakine Cosmo 6.5 Liter Backpack	172
29268	Check for Lovers	172
12148	Lovely Women Backpack Angel Wings Satchel PU Leather Optional Shoulder Bag x1pcs	172
44518	"I Down You Design Full-Body Protective Plastic Case for MacBook Pro 13""/15"" (Non-Retina)"	172
11272	"Mobile Edge - MEBPWX - ""16"""" Komen Paris Backpack Black"""	172
23271	"16"" Evo Backpack - Black"	172
39323	Microsoft Summit Backpack for 15.4-Inch Laptops	172
1351	Business and Casual Travel Gear computer notebook Laptop teblet 15 inch sports outdoor school Backpack.SA9274-C1 Black	172
29268	Snoogg 15.6 Inch Nylon Laptop Backpack School Backpack Casual Daypack With Compartments	172
11272	Mobile Edge ScanFast Backpack 2.0	172
6584	TARGUS RakGear carrying backpack Black. Backpack Carrying Case - for laptop - Nylon - Shoulder strap - Black Catalog Category: Computer Accessories / Notebook / PDA Carrying Case	172
17317	"Bw & H Black Laptop Backpack Double Single Shoulder Bag For Acer Aspire S3-392 133"""	172
29268	17-inch Premium Laptop Backpack	172
29268	Snoogg 15.6 Inch Nylon Laptop Backpack School Backpack Casual Daypack With Compartments	172
39406	"The Autumn 15"" Computer Backpack Scan Express"	172
15831	Sinpaid Waterproof Laptop Backpack	172
29268	EPACK 4YR OS 4HRS 13X5 W DMR	172
30018	COMEHERE Leaper Casual Style Laptop Backpack/ School Bag/ Travel Daypack/ Handbag	172
4229	XXXX new men's and women's backpack, travel bag computer bag book student leisure canvas bag.	172
15831	SINPAID Shoulders Computer Bag BT2 5A-1 Laptop Backpack Computer Book Bag Orange	172
10515	"16"" Black Notebook Backpack"	172
15443	Deercon Women Canvas Travel Satchel Shoulder Bag Laptop Backpack School Rucksack(Purple)	172
42835	HP Business Genuine HP Black Sport Backpack	172
39406	SwissGear Mars 16-inch Pink Computer Laptop Backpack	172
43686	Harry Potter Hogwarts Crest Knapsack Back Pack Computer Laptop Bag	172
1658	G-LIFE Men's Genuine Leather Vintage School Student Laptop Backpack Travel Rucksack Shoulder Bag	172
23271	"Targus Ascend 16"" Laptop Backpack"	172
19141	Victorinox Luggage Altmont 2.0 Deluxe Laptop Backpack, Red, One Size	172
9612	VanGoddy Bonni Collection Laptop Backpack for Asus 13.3 to 15.6-inch Laptops + 16GB Memory Card + USB Mouse + Headphones (Wine)	172
23271	Targus Targus Grove Notebook Backpack	172
1351	MayaStone Business and Casual Travel Gear Swiss Style fashion computer notebook Laptop teblet inch Daypack Backpack.SA9350-C2	172
11272	Mobile Edge Mecbp1 17.3 Eco-Friendly Canvas Backpack (Black)	172
29268	Snoogg 15.6 Inch Nylon Laptop Backpack School Backpack Casual Daypack With Compartments	172
21488	Timbuk2 Option Laptop Backpack - Medium	172
23271	"Targus Tbb012us 16"" Zip-thru Air Traveler Backpack"	172
15812	Consumer Electronic Products Everki Flight Checkpoint Friendly Laptop Backpack, Fits up to 16-Inch EKP119 Supply Store	172
15443	Deercon Women Canvas Casual Travel Satchel Shoulder Bag Laptop Backpack School Rucksack(Dark blue)	172
29268	Snoogg 15.6 Inch Nylon Laptop Backpack School Backpack Casual Daypack With Compartments	172
44518	"Famous Paintings Michael Jackson Design Full-Body Protective Plastic Case for MacBook Pro 13""/15"" (Non-Retina)"	172
22765	"Whatland 3-way Men's Crazy Horse Leather Vintage Briefcase Travel Backpack 15"" Laptop Shoulder Bag Handbag"	172
3264	"- Pro Laptop Backpack, 17.3"", 12 1/2 x 7 1/2 x 18, Black"	172
3291	Whatland Specially High Density Thick Canvas Backpack Rucksack, Green	172
30018	Autofor New Retro Vintage Casual Women's Backpack School Bag Fashion Travel School PU Leather Handbag laptop ipad bag, four colors avaliable,Yellow	172
43042	HP EliteBook 8560p 15.6 Inch Notebook Laptop CheckPoint Friendly Reinforced Hard Shell Backpack with Internal Nylon Compartment Pockets Color Black / Blue + NuVur  Keychain (NBAGCAB1)	172
17347	Travelon Anti-Theft Urban Slim-Line Backpack	172
15831	National Geographic Ng S5301 Day Pack Laptop Notebook Backpack Bag Cool Gray	172
15443	Deercon Women's Canvas Travel Satchel Shoulder Bag Backpack School Rucksack Laptop Handbag(Black)	172
42383	"DELL 15.6"" Adventure Backpack / DCW55 /"	172
44518	"Quotes Worth is Not Easy Design Full-Body Protective Plastic Case for MacBook Pro 13""/15"" (Non-Retina)"	172
44518	"The Last Warrior Design Full-Body Protective Plastic Case for MacBook Pro 13""/15"" (Non-Retina)"	172
10515	"HP F3w19aa#abl 15.6"" Full Featured Backpack HPF3W19AA#ABL"	172
42503	"Hewlett-Packard - Hp Carrying Case Backpack For 15.6"" Notebook, Tablet Pc - Black ""Product Category: Accessories/Carrying Cases"""	172
43042	Icon ICON50VK-BLK Nylon Viking Notebook Backpack - Black	172
14769	Creativebags Laptop Cases Rucksack Travel Backpacks for Men Women Teenagers 30-40L	172
35738	Delmkin New Macbook 11.6/13.3 Retina/15.4 Retina Inch Portable Bag	172
3264	"-- Pro Laptop Backpack, 17.3"", 12 1/2 x 7 1/2 x 18, Black"	172
10515	"Red 15.4"""" Maxxum Notebook Backpack"	172
30058	Ushoppingcart 2014 New Style Student School Bag/Backpack Causal Laptop Bag Vintage Red	172
10056	"Dicota Laptop Computer Notebook Backpack Bag High Quality for up to 16.4"" Laptop"	172
38283	[tresette] Premium PU Casual Business Laptop Backpack TR5C7 - #Brown	172
37320	Dakine Frankie Laptop Backpack	172
17347	Pelican ProGear S130 Sport Elite Laptop/Camera Backpack	172
1549	SwissGear Computer Backpack Red	172
39406	SwissGear Marble Rugged 16-Inch Laptop Backpack Black NWT	172
43627	Simple Style Backpack / Back-to-School / New Hot Sale Unisex Canvas School Bag Travel Bag Shoulders Bag / Pop Color Black	172
6980	Onwardpacks Laptop and Tablet Backpack - Red - Give Towards Books	172
44518	"Retro Snowflake Design Full-Body Protective Plastic Case for MacBook Pro 13""/15"" (Non-Retina)"	172
29268	Snoogg 15.6 Inch Nylon Laptop Backpack School Backpack Casual Daypack With Compartments	172
18014	VictoriaCross Light Fashion Laptops backpack computer notebook tablet,knapsack,rucksack bag Comfortable back panel Ergonomic shoulder straps for man woman student waterproof - VC2081-4 Red	172
17347	S105 Progear Sport Backpack For 15in Laptops & 17in Macbook Org	172
29268	Ferrari Active Laptop Backpack	172
42503	"TARGUS TSB785US / Carrying Case Backpack for 15.6"" Notebook - Black"	172
34640	Aibag Vintage Canvas Leather Schoolbag Laptop Backpack Rucksack	172
18014	Jazz Ad-08 15'' Waterproof Laptop Backpack for Men Travel Bag (Grey)	172
24122	"17"" Checkpoint Friendly Laptop Backpack Color: Red"	172
15443	"Sannea Basic 13""-15"" Laptop Backpack Canvas School Bags"	172
9612	Vangoddy Exclusive Germini Designer Backpack for up to 15 Inch Laptops Olive Green	172
11272	Alienware Vindicator notebook carrying backpack	172
10056	Tigernu Business Backpack Red Fits 15.6'' Laptop Cushion Zone	172
14797	Lenovo 41U5254 Performance Backpack Backpack (Retail)	172
44518	"The World Pulse Design Full-Body Protective Plastic Case for MacBook Pro 13""/15"" (Non-Retina)"	172
44518	"Mustache Design Full-Body Protective Plastic Case for MacBook Pro 13""/15"" (Non-Retina)"	172
29268	Tilos Magma Dry Backpack	172
15183	"Case Logic Berkeley Deluxe Bpca-215 Carrying Case Backpack For 15.6"" Notebook, Tablet - Woodland ""Product Category: Bags & Carry Cases/Book Bags & Backpacks"""	172
23271	"Tsb007us - Targus 15.4"" Sport Backpack"	172
29268	"Hot-fans Single Layer Ostrich Feather Fan 24""x 41""for Pair, Baby Blue"	172
14442	Timbuk2 Showdown Laptop Backpack 2013	172
34667	Back to School Summer Sale! For students or professional use. Blue Candy Backpack Laptop Bag for 15.6 inch Toshiba...	172
43042	Samsung R530-11 15.6 Inch Notebook Laptop CheckPoint Friendly Reinforced Hard Shell Backpack with Internal Nylon Compartment Pockets Color Black / Blue + NuVur  Keychain (NBAGCAB1)	172
29268	Snoogg 15.6 Inch Nylon Laptop Backpack School Backpack Casual Daypack With Compartments	172
31718	Swissgear Laptop notebook tablet ipad macbook backpack. for travelling,camping,Hiking business and casual gift computer,knapsack,rucksack school sport outdoor SA3100	172
44518	"The US flag Design Full-Body Protective Plastic Case for MacBook Pro 13""/15"" (Non-Retina)"	172
23271	Targus Grove Notebook Backpack	172
21625	SwissGear GA-7310-14F00 Carrying Case Backpack for 16' Notebook - Gray	172
39316	Bronze Times (TM) Premium Shockproof Canvas Laptop Backpack Travel Bag	172
39323	"Targus, 17"" Groove Backpack Catalog Category: Bags & Carry Cases / Book Bags & Backpacks "	172
6021	J World New York Velox Laptop Backpack	172
1351	Business and Casual Travel Gear computer notebook Laptop teblet 15 inch sports outdoor school Backpack.SA9274-C1 Black	172
23271	Targus BTS Groove Backpack Blk/Gra	172
1709	"Solo Active 17.3"" Laptop Backpack. Black, TCC703-4/20"	172
4229	"Altego Canvas Backpack for 17"" Laptops, Cyan"	172
22063	Piel Leather U-Zip Backpack	172
4313	Asherbaby Causal Style Canvas Laptop Bag/ Shoulder Bag/ School Backpack/ Travel Bag/ Handbag	172
29268	"Elite 19"" Backpack with Laptop Sleeve"	172
15443	SUNROLAN School Laptop Backpack Canvas Bag Cute for School Backpacks MT888	172
10515	"CASE LOGIC VNB-217 17"" NOTEBOOK BACKPACK"	172
