43627	Iblue 17.7 Inch Waterproof Canvas Pure Color Daypack Student Laptop Backpack #E8015	172
29268	LAPTOP BACKPACK	172
3074	XCC Factory outlets 2015 new Ms. Korean unisex shoulder bag in schoolbag laptop backpack	172
32405	Mobile Edge ScanFast Backpack - notebook carrying backpack MESFBP -	172
29268	Everest Trendy Lightweight Laptop Backpack	172
17347	Pelican ProGear U100 Urban Elite 15-17 Laptop Backpack - Black	172
14442	Timbuk2 Jones Laptop Backpack	172
43042	Premium HP Envy 15 Series 15 Inch Notebook Accessories Kroo Carbon Fiber Look Pink EVA Shell Backpack + VanGoddy LIVE*LAUGH*LOVE Wristband + Retractable USB Mouse	172
23444	Wuudi® Waterproof shockproof backpack Students laptop shoulder bag for business -Black	172
23271	"Ogio - Black Bandit 17"" Backpack"	172
43042	Sony VAIO Backpack	172
19141	Swissgear Pegasus Backpack Black/Blue Fits Up To 17in Laptop	172
37123	Ancipe Lightweight Waterproof Backpack with Laptop Compartment Black	172
29268	Bantam Backpack Cd-rom Model:180200	172
17760	"Leopard Patterns Folio Plastic Protective Hard Shell Case for Macbook Pro 15"""	172
43627	VG Multiple Briefcase Messenger Backpack Shoulder Bag for Apple MacBook/ Lenovo/ Dell/ ASUS/ Acer/ HP/ Toshiba/ Samsung/ Sony/ MSI 13.3/ 14/ 14.1/ 15/ 15.4/ 15.6 inch Laptop Chrome/ Ultrabook (Gray)	172
35489	"Rhythm 17"" Polyester Laptop Backpack"	172
2820	Kensington Contour Backpack	172
4229	Blue Candy Backpack Laptop Bag for 15.6 inch Toshiba L755-S5363 Notebook + An Ekatomi Hook.	172
44518	"City Design Full-Body Protective Plastic Case for MacBook Pro 13""/15"" (Non-Retina)"	172
15831	SINPAID Shoulders Computer Bag AD-11 Laptop Case Backpack Notebook Bag	172
23004	Sami Black/Teal/Cream Women's Travel Shopping Backpack Bag Canvas PU Leather Men's Laptop Case School Bag for 11.6'' 12'' 13'' 13.3'' 14'' 15'' Laptops & Ultrabooks	172
32862	CHADA Canvas Leather Backpack for Laptop SchoolBag Dark gray	172
9612	VanGoddy Bonni Collection Laptop Backpack for Lenovo 13.3 to 15.6-inch Laptops (Aqua Blue)	172
31718	"Grey Sherpa DX 16"" Laptop Backpack with Tablet / eReader Pocket"	172
35852	"SOLO Surge 15.6"" Laptop Backpack"	172
30018	Minetom Casual Style Polka Dots Canvas/Oxford Laptop Backpack/ School Bag/ Travel Daypack/ Handbag With Laptop Lining	172
23271	Targus 17 CityGear Backpack	172
39316	Bronze Times (TM) Premium Shockproof Canvas Laptop Backpack Travel Bag	172
30986	OGIO International Rebel Laptop Backpack	172
10515	Case Logic Ibira Backpack(IBIR-115Blk)	172
10515	Case Logic Ibira Backpack (IBIR-115ANTH)	172
18014	Rolling Notebook Backpack BLK Rolling Notebook Backpack BLK	172
43042	Flower Custom New Laptop Sleeve 13 Inch Black Twin Sides Notebook Laptop W-LP42	172
43627	"[ TARGUS ] T-1212 Laptop Backpack Gray Comfortable Business Bag 15.6""-TSB80304AP"	172
25698	18.9'' Durable Full Set Outdoor Sport Travel Carrying Bag Storage Soft Case Backpack with Custom EVA Foam for DJI Phantom 3 Quadcopter - Black	172
43042	DURAGADGET Rugged Water-Resistant Nylon Rucksack / Backpack with Customizable Interior & Large Storage Space Compatible for Nikon D3300 Camera Plus A Bonus Cleaning Cloth	172
6021	J World New York Velox Laptop Backpack	172
23271	"15.6"" Gray Notebook Backpack"	172
18014	Zenness Multi-pocket Laptop Backpack Nylon Outdoor Waterproof Shoulder Bag	172
44518	"Lovely Flower Design Full-Body Protective Plastic Case for MacBook Pro 13""/15"" (Non-Retina)"	172
29268	BLACKHAWK! Laptop Backpack	172
16816	Revolution Notebook Backpack Fits Up To 15.4IN	172
43042	HP Compaq 6710b 15.4 Inch Notebook Laptop CheckPoint Friendly Reinforced Hard Shell Backpack with Internal Nylon Compartment Pockets Color Black / Blue + NuVur  Keychain (NBAGCAB1)	172
17760	"HQF® Quicksand Design Laptop Shell, Snap on Hard Shell Case for MacBook Pro 15"" with Retina Display [No CD-ROM] A1398 - Baby Pink"	172
23271	"Storm Backpack for Laptops, Fits up to 16"", Polyester Fabric, Black/Gray"	172
23271	Targus Groove Notebook Backpack TAA-CVR617	172
10515	"Case Logic 16"""" Black Checkpoint-Friendly Notebook Backpack"	172
23271	"Targus 17"" Laptop Backpack, File Compartment, Audio Player Sleeve, Black/Blue"	172
18779	Casual Graffiti Printing Canvas Polyester Fancy Backpack Bag Black	172
37923	Lenovo Thinkpad Business Backpack - Backpack - Nylon - Black	172
41080	kmbuy Classic 906s Vintage Fashion Rucksack Laptop Backpack Daypack Bag (22L) For School Campus Travel Fits MacBook Chromebook iPad Camera (purple)	172
34327	"Rose in The Dark Design Full-Body Protective Plastic Case for MacBook Pro 13""/15"" (Non-Retina)"	172
15443	Deercon Unisex Cute Travel Satchel Shoulder Bag Laptop Backpack School Book Rucksack(7 colors)	172
14882	Plusminus Unisex Computer Bag Backpack Designed for 14 Inch Laptop School Book Bag Couple Backpack (Light Gray)	172
43042	Mekko Nylon C-78 Photography Backpack Black	172
11272	Mobile Edge MESSM3-13 13-Inch Neoprene SlipSuit (Navy) by Mobile Edge	172
30018	Daosen Casual Style Laptop Backpack Sport Bag School Bag Travel Daypack Handbag	172
17347	S100 Sport Elite Laptop Backpack S100 Sport Elite Laptop Backpack	172
30986	OGIO International Phantom Wheeled Laptop Backpack	172
43627	Lalawow Unisex New Pro Multifunctional Casual Canvas Backpack Daypack Schoolbag For Computer Outdoor Student Travelling Camping Notebook Laptop IPAD 13-14Inch	172
44518	"Howard Fogg Railroad Painting Design Full-Body Protective Plastic Case for MacBook Pro 13""/15"" (Non-Retina)"	172
39406	Wenger Pegasus Computer Backpack	172
43627	Unisex Backpack Men Laptop Notebook Shoulder Bag Business-black	172
39406	Mercury Luggage Signature Series Wheeled Computer Case	172
17287	"DataShell CBP-VY15-SR Steel Silver Flying Shield up to 15.6"" Laptop Backpack, Steel Silver"	172
18014	2014 SwissGear WENGER new 15 inch Laptops backpack SA0046. computer notebook tablet,knapsack,rucksack Swiss Gear army knife bag Comfortable laptops waterproof	172
10515	"17"" Gray Notebook Backpack"	172
29268	Manhattan Portage Skillman Backpack	172
10515	"CASE LOGIC RBP-115BLACK NOTEBOOK BACKPACK 15.6"" "	172
6021	J World New York Elemental Laptop Backpack	172
14442	Timbuk2 Q Laptop Backpack 2013	172
8760	kmbuy - Unique Linenette Style Unisex Fashionable Casual School Travel Shoulder Backpack bag with laptop Compartment / 40cm*28cm*13cm	172
15831	SINPAID Man/Women's Shoulders Computer Bag 14-15.6Inch Laptop Case Backpack Computer Book Bag Blue	172
23271	"SECURITY MAN SM-1580 Pofessioa 15"" LCD CCTV Coo Moio wih Speake"	172
21488	Santimon - Grating Canvas Laptop Backpack Bags	172
23271	1085cc Hardback Case Blk Liner Up To 14in Laptops Pick N Pluck	172
17347	Pelican S105 Sport Black Laptop Backpack PEL-S105-BK	172
44518	"Dead Pool Wade Wilson Marvel Comics Design Full-Body Protective Plastic Case for MacBook Pro 13""/15"" (Non-Retina)"	172
30986	OGIO Ruck 20 Laptop Backpack	172
43402	Timerlane Laptop Rolling Business Backpack	172
32405	Mobile Edge Premium Backpack - notebook carrying backpack MEBPP1 -	172
11272	Mobile Edge Premium Backpack for 17.3-Inch Laptops Black/White Checkered	172
44518	"Bloom Rose Design Full-Body Protective Plastic Case for MacBook Pro 13""/15"" (Non-Retina)"	172
43627	Himalayan's Tibetan Style Hippie Hemp School College Backpack With Padded Laptop Pocket.	172
43042	Tough Traveler TouCom Laptop Computer Backpack - Made in USA	172
43402	Lejarue Women's Metallic Snake Embossed 13 Inch Macbook Retina Display Laptop Padded Bag - Ivory	172
17347	S105 Sport Laptop Lite Backpack Black	172
18644	"HEX Convertible Backpack - Fits up to 17"" Laptop and Tablet"	172
43627	Estarer Canvas Laptop Backpack for Laptops / Notebooks 15.6 Inch / Macbook Black	172
29268	Snoogg 15.6 Inch Nylon Laptop Backpack School Backpack Casual Daypack With Compartments	172
29268	Timuk2 Q Laptop Backpack 2014	172
29268	Backpack Shield BP3A Level IIIA Ballistic Plate	172
15183	"Case Logic Griffith Park - Notebook carrying backpack - 15.6"" - red"	172
23271	Targus Ascend Backpack for Laptops up to 16-Inch Black	172
39055	EVA Backpack for Asus Versatile Performance K46 series 14-inch Laptops	172
31718	Swissgear Laptop notebook tablet ipad macbook backpack. for travelling,camping,Hiking business and casual gift computer,knapsack,rucksack school sport outdoor SA9905 Red	172
4714	Enpi Pu Leather Laptop Backpack School Bookback Bag	172
39406	Wenger Swiss Gear SA-1267 Multi-function Backpack 14-Inch Computer Laptop Backpack(Black)	172
30986	Ogio Squadron Laptop Backpack Black	172
30986	Ogio Rogue Laptop Backpack Red	172
44518	"Russia Flag and Emblem Design Full-Body Protective Plastic Case for MacBook Pro 13""/15"" (Non-Retina)"	172
23271	"** Storm Backpack for Laptops, Fits up to 16"", Polyester Fabric, Black/Gray **"	172
44518	Domke F-34L 19-Inch Protective Wrap -Red	172
29268	Snoogg 15.6 Inch Nylon Laptop Backpack School Backpack Casual Daypack With Compartments	172
18236	SwissGear ScanSmart Laptop Backpack - Black	172
17347	Pelican S140-BK S140 Sport Tablet Backpack Black	172
17287	DataShell CP-SST15-BK Black 3-in-1 Dynamic Shield up to 15.6 Laptop Backpack	172
44518	"Cat with Sexy Glasses Design Full-Body Protective Plastic Case for MacBook Pro 13""/15"" (Non-Retina)"	172
26012	Preferred Nation 4152.Blk Scan Express Computer Backpack	172
44518	"Birds On a Sunny Afternoon Wallpaper Design Full-Body Protective Plastic Case for MacBook Pro 13""/15"" (Non-Retina)"	172
15183	Lenovo 78004905 Case Logic Jaunt Backpack - Notebook carrying backpack - 15.6 inch - antracite	172
15831	SINPAID BM-3 Business Bag Men Laptop Backpack Book Case Computer Oxford Black	172
15443	Deercon Unisex Canvas Travel Satchel Shoulder Bag Laptop Backpack Student Rucksack(Blue)	172
29268	Sinpaid 16-17 Inch Laptop Backpack	172
29637	"Kenneth Cole Reaction 16"" Laptop / MacBook Pro Black Backpack"	172
21488	Santimon Canvas Leisure Beautiful flower Printing School Grils Backpack Darkblue Medium	172
31718	SwissGear Laptop Backpack with Sunglasses Holder and Audio Interface SA1191	172
19703	Nasis Classic Vintage College School Laptop Backpack Bag Rucksacks AH5031	172
15443	** Laptop Travel Charger, Slim Design, 90W **	172
39124	Swiss Travel Gear Business and Casual Travel Gear computer notebook Laptop teblet inch Backpack.SA1512-C2	172
42503	"Targus Gravity TSB628 Carrying Case Backpack for 17"" Notebook - Black"	172
15831	Computer Backpack	172
44518	"Welcome to The 21st Century Design Full-Body Protective Plastic Case for MacBook Pro 13""/15"" (Non-Retina)"	172
1351	Business and Casual Travel Gear fashion computer notebook Laptop Daypack Backpack.3996-C5	172
29268	Snoogg 15.6 Inch Nylon Laptop Backpack School Backpack Casual Daypack With Compartments	172
19141	"Yens® Fantasybag ""Cross"" Laptop Mono Strap Backpack, 3BP-12 Red"	172
29268	ArcEnCiel® 17 inch Laptop Backpack	172
30018	Daosen Casual Style Laptop Backpack Sport Bag School Bag Travel Daypack Handbag	172
30986	OGIO Bandit 17 Laptop Backpack	172
14797	"Belkin Slim Back Pack - Notebook carrying backpack - 17"" - chocolate, tourmaline"	172
18644	"Laurex Laptop Backpack fits up to 17"" Laptop"	172
29268	Snoogg 15.6 Inch Nylon Laptop Backpack School Backpack Casual Daypack With Compartments	172
4229	LIMME 13.3 inch Red Tape Computer Case for All Notebook	172
8027	Vintage Unisex Oxford Backpack School College Laptop Students Outdoor Travel Bag	172
44518	"The Universe Design Full-Body Protective Plastic Case for MacBook Pro 13""/15"" (Non-Retina)"	172
43042	Nasis professional laptop PC protection bag backpack office, daily style for 13 14 15 inches Laptop AL3012 black	172
11272	MOBILE EDGE 15.4 premium backpack black/silver	172
29268	Snoogg 15.6 Inch Nylon Laptop Backpack School Backpack Casual Daypack With Compartments	172
43042	JanSport Watchtower Laptop Backpack Black Ballistic Nylon - JanSport Laptop Backpacks	172
11416	Xenon 2 Spinner Mobile Office, 13.5 x 8 x 16.5, Nylon, Black	172
6524	Black & Lime Canvas Backpack	172
43042	Hello Kitty Backpack Style Laptop Case- Black	172
37320	Dakine Campus Laptop Backpack	172
34327	"Music in the Fire Design Full-Body Protective Plastic Case for MacBook Pro 13""/15"" (Non-Retina)"	172
14442	Timbuk2 Uptown Laptop TSA-Friendly Backpack	172
44518	"Little Bit Worse Design Full-Body Protective Plastic Case for MacBook Pro 13""/15"" (Non-Retina)"	172
37848	"VERA BRADLEY LAPTOP BACKPACK Large - ""LIME'S UP"" Pattern"	172
4229	"- 17"" Groove Laptop Backpack, Book Storage, Media Pocket, Water Bottle Holders"	172
29268	"ful 17"" Laptop Backpack Navy Blue"	172
39406	"The Neptune 16"" Laptop Computer Backpack Color: Gray"	172
37551	Wenger Laptop Computer Backpack by SwissGear SA1537 (Black) Fits Most 15 Inch Laptops	172
3291	Cgecko M1139 Leisure Canvas Casual Daypacks Backpack Rucksack Laptop School Bag	172
34640	Nasis Vintage Multifunctional Leather Schoolbag Laptop Backpack Rucksack AL5088	172
9612	VanGoddy Bonni Collection Laptop Backpack for Samsung 13.3 to 15.6-inch Laptops + 16GB Memory Card + USB Mouse + Headphones (Navy Blue)	172
29268	Samsonite Urbanite Laptop Backpack A66094511	172
1351	MayaStone Business and Casual Travel Gear Swiss Style fashion computer notebook Laptop teblet 12-16 inch Daypack Backpack.SW8108-C1	172
24280	Baida Unisex Laptop Backpack with Ipad Sleeve	172
9612	VanGoddy Bonni Collection Laptop Backpack for Fujitsu LifeBook & CELSIUS 13.3 to 15.6-inch Laptops + 16GB Memory Card + USB Mouse + Headphones (Wine)	172
29268	Snoogg 15.6 Inch Nylon Laptop Backpack School Backpack Casual Daypack With Compartments	172
23004	Wuddi Vintage College Backpack School Bookbag Laptop Backpack Canvas --Brown	172
17347	Pelican Ou1050-0003-110 15.6 Lite Progear(R) U105 Notebook Backpack	172
44518	"Nature Scenery Design Full-Body Protective Plastic Case for MacBook Pro 13""/15"" (Non-Retina)"	172
39074	Barsty Outdoor Hiking Climbing Backpack Travel Backpack Laptop Computer Backpack-Black	172
29268	HP 703890-001 Professional Backpack	172
44518	"The Horse Design Full-Body Protective Plastic Case for MacBook Pro 13""/15"" (Non-Retina)"	172
10515	Case Logic 16-Inch Security-Friendly Laptop Backpack CLBS-116	172
43042	Bronze Times Multi Purpose Backpack for 15 inch Laptop	172
35738	Delmkin New Macbook 11.6/13.3 Retina/15.4 Retina Inch Portable Bag	172
9612	VanGoddy 3 in 1 Travel School Shoulder Bag Backpack and Messenger Bag Briefcase for HP 15.6-inch 15-f004dx / HP - 15t Touch Laptop / HP ENVY - 15t / HP Pavilion 15 laptops (Blue) + White VG Headphone	172
18014	Everest Deluxe Laptop Backpack Color: Aqua blue	172
29268	Snoogg 15.6 Inch Nylon Laptop Backpack School Backpack Casual Daypack With Compartments	172
29268	Snoogg Cricket is Life Laptop Backpack Casual School Backpack	172
23271	"Exclusive Urban II 16"" Laptop Backpack By Targus"	172
30400	Duluth Pack 15-Inch Laptop Book Bag	172
43042	Dell XPS 12 Ultrabook Convertible Premium Laptop Backpack in Taupe Greyish/Brown	172
44518	"Australia Flag Design Full-Body Protective Plastic Case for MacBook Pro 13""/15"" (Non-Retina)"	172
8027	Vintage Unisex Oxford Backpack School College Laptop Students Outdoor Travel Bag	172
30986	OGIO Business and Luggage TP-14 Laptop Backpack Black	172
23271	Targus Sport Backpack Case Designed for 15.4 Inch Notebooks TSB007US, Black with Platinum Accents TSB007US	172
4229	Pink Candy Backpack Laptop Bag for 15.6 inch Asus A53E-AH51 Notebook + An Ekatomi Hook.	172
18014	14.2 inch Waterproof Fabric With Genuine Leather Backpack School Bag -RUFFRYDER Unisex Bookbag Rucksack Satchel for Mac Book,Notebooks,Documents,Journals-Fit 14 Inch Laptop,H1001#,Army Green	172
28754	SWISSWIN SW1908 1 backpack shoulder bag man bag 15 inch laptop bag	172
22063	Zeyner Backlash Leather Laptop Backpack	172
11272	"Brand New Mobile Edge Llc Alienware Orion M14x Laptop Backpack - Black -Scanfast Checkpoint Friendly - 14. ""Product Category: Laptop / Carrying Cases"""	172
23271	"CityGear 16"" Commuter Backpack"	172
23271	Case-it BK-PK-400 Notebook Backpack	172
44518	Mobile Edge EVO Backpack- 16-Inch PC/17-Inch MacBook Pro Black/Blue	172
29268	Everest Deluxe Laptop Backpack	172
17287	DataShell CBP-VY15-BK Black Flying Shield up to 15.6 Laptop Backpack	172
1664	Bellino Rolling Computer Backpack	172
29268	Yipingyou Netbook Laptop Backpack 3d010	172
36274	"Rikki Knight ""Alma"" Name - Cute Pink Owl on Branch with Personalized Name Design Lightning Series Gaming Mouse Pad (MPSQ-RK-25275)"	172
32405	Mobile Edge Onyx Backpack - Notebook carrying backpack - black	172
11415	"Conquer 16"" Backpack, 11-8/10 x 7-1/2 x 18-3/4, Black"	172
39074	Barsty Outdoor Hiking Climbing Backpack Travel Backpack Laptop Computer Backpack-Black	172
42503	LLR61615 - Lorell Carrying Case Backpack for 16 Notebook - Black	172
15443	Deercon Women Canvas Casual Travel Satchel Shoulder Bag Laptop Backpack School Rucksack(Black)	172
38283	[tresette] Premium PU Casual Business Laptop Backpack TR5C6 - #Brown	172
37551	SwissGear Laptop Computer Backpack SA6685 (Black/Blue) Fits Most 15 Inch Laptops	172
22765	"Handmade and Genuine Camel Leather Vintage Briefcase Travel Backpack 17"" Laptop Shoulder Bag Handbag"	172
17347	Pelican Genuine S105 Sport Laptop Backpack	172
40608	"14"" Silver Brand Waterproof Polyester Laptop School Hiking Backpack"	172
34327	"Without Me Design Full-Body Protective Plastic Case for MacBook Pro 13""/15"" (Non-Retina)"	172
21488	Hello Kitty Backpack Style Laptop Case- Red	172
29268	JanSport Coho 15-in. Laptop Backpack	172
15183	"Case Logic 17 Notebook Backpack ""Product Type: Notebook Accessories/Notebook Cases"""	172
22765	"Vagabond Traveler 18"" CEO Leather Large Briefcase Backpack Travel Bag L31.BLK"	172
39406	New Backpack Carrying Case For DJI Phantom 1/2/Vision 2/Vision 2+/FC40	172
869	"Red 16"" Granite Deluxe Laptop backpack with Tablet/eReader Pocket"	172
17347	S145 Sport Tablet Backpack	172
37848	VERA BRADLEY LAPTOP BACKPACK Large - SYMPHONY IN HUE Pattern	172
8027	Yanchen Unisex Classic Vintage College School Laptop Backpack	172
14769	Creativebags Laptop Daily Backpacks for Men Women Teenagers School Travel Hiking Camping Outdoor Sports	172
30018	"Hello Kitty KT4337R Backpack Style 15.4"" Laptop Case, Red"	172
17347	Pelican Ou1000-0003-110 Pelican U100 Elite Laptop Storage Backpack	172
39406	Wenger SwissGear THE NEPTUNE 16-inch Laptop Computer Backpack	172
44518	"Vintage Floral Wall Design Full-Body Protective Plastic Case for MacBook Pro 13""/15"" (Non-Retina)"	172
1098	Baitaihem Bohemian Style Canvas Bag Laptop Backpack Rose	172
39323	Microsoft 15.6-Inch Laptop Backpack - Queue Gray/Purple 39319	172
23271	"-- Zip-Thru Air Traveler Backpack, Fits 15.8"" Widescreen Laptop, Polyester, Black"	172
8760	Artone Unisex Water Resistant Oxford Fashion Dots Laptop Backpack School Daypack With Laptop Compartment Brown	172
43042	CalPak Axtec Gray/Lavender Plaid 18-inch Deluxe Backpack With Laptop Compartment	172
23271	Targus Drifter II Plus Backpack for 16 Inch Laptops TSB702US	172
43042	Brooklyn Industries Carrier Messenger 17 Inch Laptop Nylon Backpack - Black - One Size	172
41080	8848 Laptop Shoulder Messenger Handbag Backpack Computer School Bag	172
14442	Timbuk2 Swig Laptop Backpack,Black/Black/Black,M	172
39406	2014 Swiss Gear new style computer notebook Laptop teblet backpack.SA7038-C2-Purple	172
15831	Laptop Computer Travel Bag	172
9612	VanGoddy 3 in 1 Shoulder Bag Backpack and Messenger Bag Briefcase for Lenovo Thinkpad E450 14'' / E455 14'' / T440p 14'' / T450 14'' / Lenovo Flex 3 14 inch Laptop PC (Blue)+ Red Wireless Mouse	172
14797	Lenovo Performance Backpack	172
30018	Tgmgm_bps010 Casual Splice Bag Laptop Backpack	172
29268	"ALIENWARE AWVBP17 Vindicator Backpack 17"""	172
23271	Targus Groove Backpack Case Designed for 17 Inch Laptops CVR617 Black	172
37923	Lenovo - TP Professional Backpack	172
161	Wenger Computer Backpack - Red	172
36274	"Rikki Knight ""Josh"" Name - Cute Blue Owl on Branch with Personalized Name Design Lightning Series Gaming Mouse Pad (MPSQ-RK-12398)"	172
44518	"Colorful Leopard Print Design Full-Body Protective Plastic Case for MacBook Pro 13""/15"" (Non-Retina)"	172
31718	"15.6"" Laptop Backpack"	172
8760	kmbuy - Unique Linenette Style Unisex Fashionable Casual School Travel Shoulder Backpack bag with laptop Compartment / 40cm*28cm*13cm	172
44518	"Bat Design Full-Body Protective Plastic Case for MacBook Pro 13""/15"" (Non-Retina)"	172
12148	Lovely Women Backpack Angel Wings Satchel PU Leather Optional Shoulder Bag x1pcs	172
24280	Baida Unisex Laptop Backpack with Ipad Sleeve	172
29268	Snoogg 15.6 Inch Nylon Laptop Backpack School Backpack Casual Daypack With Compartments	172
25832	Casual Canvas Backpack Rucksack Bookbag Travel Hiking Bag School Laptop Backpack Kaki	172
15831	Phil Keoghan NOW Backpack with Laptop Computer Organizer Purple Durable NEW!	172
15443	Deercon Vintage Women Travel Satchel Shoulder Bag Laptop Backpack School Rucksack(Purple)	172
11272	MBLAWVBP14 - ALIENWARE AWVBP14 Vindicator Backpack 14	172
43042	Rosewill RL-BETA BLACK SHOCK ABSORBING BACKPACK FOR 15.6IN LAPTOP	172
29268	Snoogg Digital Floral Kenzie Laptop Backpack Casual School Backpack	172
15831	SINPAID Men/Women's Computer Laptop Notebook Backpack Carrying Laptop Case Notebook Bag	172
23271	"16"" Black Checkpoint-Friendlyo Notebook Backpack [Electronics]"	172
30400	Duluth Pack Laptop Scoutmaster Pack	172
44518	"France Flag Design Full-Body Protective Plastic Case for MacBook Pro 13""/15"" (Non-Retina)"	172
42050	MIERWORLD Men's Canvas Laptop Backpack Casual Travel Daypack-Small Black	172
18014	"Exhibition Computer Laptop Backpack Heavy Padded Straps 15.4"""	172
43627	"13"" 14"" 14.1"" Army Green Notebook Laptop Backpack Shoulder Bag for HP"	172
29268	Sinpaid 16-17 Inch Laptop Backpack	172
34327	The Colorful Sky Design Full-Body Protective Plastic Case for 11-inch/13-inch New MacBook Air	172
39406	2014 Swiss Gear new style computer notebook Laptop teblet backpack.SA7038-C1-Purple	172
7921	15 inch MacBook Pro / Laptop MR. ACE HOMME LAPTOP BACKPACK - RED	172
23271	"15.6"" Granite Notebook Back"	172
29268	Snoogg 15.6 Inch Nylon Laptop Backpack School Backpack Casual Daypack With Compartments	172
15443	Deercon Women Canvas Travel Satchel Shoulder Bag Laptop Backpack School Book Rucksack(Denim Blue)	172
23271	"Targus - 17"" CityGear Backpack"	172
31718	"Black 16"" Sidebar Computer Backpack With Tablet / eReader Pocket"	172
30986	Dynamic Discs Ogio Tribune 17 Strilux Red Laptop Backpack	172
44518	"The Colorful House Design Full-Body Protective Plastic Case for MacBook Pro 13""/15"" (Non-Retina)"	172
4714	NingDom 2015 PU Leather Clamshell Medium-sized School College Rucksack Bag Youth Strong Fashion Backpack Laptop Bag Black	172
10515	Case Logic Vnb-217 17-inch Laptop/notebook Backpack	172
42503	"Targus - TCG216US - ""17"""" CityGear Backpack"""	172
6584	"Mobile Edge EVO Laptop Backpack - Notebook carrying backpack - 16"" - black with silver accents *"	172
37848	VERA BRADLEY LAPTOP BACKPACK (Large) - SIMPLY VIOLET Pattern	172
30986	OGIO International Women's Operatrix Laptop Backpack	172
37303	"* 17"" Spruce EcoSmart Backpack, 19 1/2 x 13 x 6 3/4, Black *"	172
15183	"V7 CBEX1A-ORG-1N Odyssey Carrying Case Backpack for 15.6"" Notebook - Orange, Gray - Water Resistant - Nylon - Expedition V7CBEX1A-ORG-1N "	172
42503	"Targus Group International - Targus Zip-Thru Carrying Case Roller For 15.6"" Notebook - Black, Gray - Nylon, Polyester ""Product Category: Accessories/Carrying Cases"""	172
16816	"Targus Grove Notebook Backpack , - Targus Groove Notebook Backpack- Padded Sleeve Protects Notebooks With Screens Up To 15.4""- Front Storage Section Includes Padded Cd & Mobile Phone Pockets With Por"	172
29268	Snoogg 15.6 Inch Nylon Laptop Backpack School Backpack Casual Daypack With Compartments	172
30986	OGIO charger 17-inch laptop backpack CAMOMBRE	172
44518	"Wolf Design Full-Body Protective Plastic Case for MacBook Pro 13""/15"" (Non-Retina)"	172
29268	Snoogg Mustache Nautica Laptop Backpack Casual School Backpack	172
6980	Onwardpacks Laptop and Tablet Backpack - Blue - Give Towards Arts	172
2820	Brand New Kensington Contour Laptop Backpack Nylon 15 3/4 X 9 X 19 1/2 Black	172
10056	T-B3073 Excellent Quality Waterproof Laptop Bag High-Grade Student Backpack	172
18014	"AM Landen®Canvas 14"" Laptop Backpack School Bag with Padded Laptop Sleeve"	172
30018	Daosen Casual Style Laptop Backpack Sport Bag School Bag Travel Daypack Handbag	172
29268	Snoogg 15.6 Inch Nylon Laptop Backpack School Backpack Casual Daypack With Compartments	172
15183	"Mobile Edge Premium Carrying Case (Backpack) For 17.3"" Notebook, Macbook - Black, Camo ""Prod. Type: Bags & Carry Cases/Book Bags & Backpacks"""	172
42383	"Pelican - 15.6"" ProGear U105 Urban Laptop Backpack"	172
16968	Mobile Edge Alienware Orion M18x ScanFast Checkpoint Friendly Backpack	172
29268	Snoogg 15.6 Inch Nylon Laptop Backpack School Backpack Casual Daypack With Compartments	172
19157	Iblue Waterproof Student Backpack Laptop Backpack Fits up to 15.6 Inch Laptops #Tp508	172
43402	SwissGear Daypack Lightweight Laptop Backpack - Yellow	172
29268	Snoogg 15.6 Inch Nylon Laptop Backpack School Backpack Casual Daypack With Compartments	172
14442	Timbuk2 Yield Laptop Backpack Gunmetal/Blue, One Size	172
43042	13 inch Dell Vostro M301Z,V13,3400,3500 Notebook Laptop Backpack with Zippered Pocket and Scratch Guard Padded Compartment	172
35662	"Vangoddy Exclusive Purple Germini Designer Backpack for Apple MacBook Pro & Air 11.6"" 13.3"" 15.4"" Laptops"	172
44518	"France Design Full-Body Protective Plastic Case for MacBook Pro 13""/15"" (Non-Retina)"	172
43042	JanSport Air Cisco Backpack in Mammoth Blue Super Splash, TYH0ZE3	172
10515	"CASE LOGIC VNB-217 17"" Notebook Backpack"	172
18236	"Toshiba Carrying Case (Backpack) for 16"" Notebook - Black PA1493U-1BS6"	172
12282	Grey Osprey Packs Cyber Port Backpack - 1098Cu In	172
44518	"France Design Full-Body Protective Plastic Case for MacBook Pro 13""/15"" (Non-Retina)"	172
29268	Osprey Daylite Backpack	172
30400	Duluth Pack Laptop Scout Pack	172
28386	SHOP VAC Industrial Commercial quality back pack vac 2.0 peak HP / 2850010 /	172
