15443	Deercon Womens Canvas Travel Satchel Shoulder Bag Laptop Backpack School Book Rucksack Dark blue	172
29268	Snoogg 15.6 Inch Nylon Laptop Backpack School Backpack Casual Daypack With Compartments	172
4229	Everest Slim Laptop Backpack Carry Shoulder Bag - Black	172
30018	Daosen Casual Style Laptop Backpack Sport Bag School Bag Travel Daypack Handbag	172
29268	Snoogg 15.6 Inch Nylon Laptop Backpack School Backpack Casual Daypack With Compartments	172
29268	CalPak Rocket Laptop Backpack Navy	172
37320	Dakine Prom Laptop Backpack, 25 Liter	172
1705	"New York Statue of Liberty Design Full-Body Protective Plastic Case for MacBook Pro 13""/15"" (Non-Retina)"	172
14769	For U Designs Large Camouflage Animal Design College School Laptop Backpacks Students School Bags For Teenagers Men Women 2#	172
43042	Blue - Black Hard Shell Nylon Backpack Check Point Friendly Bag with Multiple Compartments fits most Acer TravelMate 5542-3590 Acer TravelMate 5742-7013 Acer TravelMate 5742-7159 Acer TravelMate 5742-7908 Acer TravelMate 5760-6477 Acer TravelMate 5760-6662 Acer TravelMate 5760-6816 Laptop + EnvyDeal Cable Tie (NBAGCAB1)	172
22765	"Denco Sports Luggage NBA New Orleans Pelicans 14"" Laptop Overnighter"	172
35852	"Sumdex Score@ 15.6"" Backpack"	172
17347	Pelican ProGear S100 Sport Elite Laptop Backpack - Orange	172
23271	"Sport Standard Black/Platinum Nylon 15"" Notebook Backpack"	172
30986	"OGIO 670030 Raceday Black 15.6"" Padded Laptop Backpack / School Travel Bag"	172
41080	Baellar Canvas Laptop Travel Computer Backpack (Brown)	172
43042	Sony VAIO S 13.3 Inch Laptop Hard Shell Nylon Backpack Check Point Friendly Bag with Multiple Compartments For VPC-SB11FX/B Color Pink - Black + Cleaning Kit + EnvyDeal Velcro Cable Tie	172
29268	Pro-Team 107124 Coachvac Vac Backpack 10Qt	172
44518	PANASONIC INFOCASE ALWAYS ON CASE FOR CF-52 REPLACES TM52-P	172
23271	Targus TSB19501US 16 Coastal Backpack Laptop	172
6980	Onwardpacks Laptop and Tablet Backpack - Green - Give Towards Arts	172
44518	"Bloom Rose Design Full-Body Protective Plastic Case for MacBook Pro 13""/15"" (Non-Retina)"	172
29268	Osprey Quasar Laptop Backpack	172
43042	Meffort Inc 15 15.6 inch Multiple Pockets Laptop Computer Travel Backpack with Air Mesh Padded Panel - Black Gary	172
38256	Vivitar Coco Series Large Digital Camcorder / Video Padded Carrying Bag / Case For Panasonic HC-V100M, HC-V110, HC-V201, HC-V500M, HC-V520 & More... + eCost Microfiber Cloth	172
23271	Manfrotto MB MA-BP-TS Advanced Tri Backpack, Small (Black)	172
18014	Donalworld Women Candy Leaf Laptop Backpack	172
43042	Kroo Carbon Fiber Look Blue EVA Shell Backpack for Toshiba Qosmio F755 15 Inch Notebooks + VanGoddy LIVE*LAUGH*LOVE Wristband + Black Toshiba Qosmio F755 15 Inch Compatible Earbuds	172
1709	"Solo Active 17.3"" Laptop Backpack. Black, TCC703-4/20"	172
23271	Targus CityGear Chicago Backpack Case for 16-Inch Notebooks, Black TCG650	172
23271	Targus CityGear Commuter Backpack for 16-Inch Laptops, Black/Yellow Accents (TBB018US) by Targus	172
41943	"ECO STYLE Luxe Topload 15.6"" Checkpoint Friendly"	172
41819	Green The North Face Surge Ii Charged Laptop Backpack - 1953Cu In	172
44518	"Tiger Design Full-Body Protective Plastic Case for MacBook Pro 13""/15"" (Non-Retina)"	172
43042	Asus 13.3 Inch Laptop Hard Shell Nylon Backpack Check Point Friendly Bag with Multiple Compartments For UL30JT Color Red - Black + Cleaning Kit + EnvyDeal Velcro Cable Tie	172
39406	Wenger Swiss Gear QUARTZ Laptop Notebook Computer Backpack - Red	172
43042	Kenneth Cole Reaction R-tech 17 Backpack Checkpoint Friendly	172
4426	JanSport Night Owl Laptop Backpack Heathered Grey	172
10515	CASE LOGIC GBP-116BLACK 16 NOTEBOOK BACKPACK BLACK	172
44518	"Lovely Flower Design Full-Body Protective Plastic Case for MacBook Pro 13""/15"" (Non-Retina)"	172
21625	"Ogio NEWT II S Carrying Case Backpack for 17"" Notebook [111061.163] -"	172
29110	Girl's College Leisure Lace Bowknot Canvas Laptop Backpack School Rucksack Brown	172
11272	Mobile Edge SecurePack 17-Inch Backpack Black/Yellow	172
29268	Snoogg 15.6 Inch Nylon Laptop Backpack School Backpack Casual Daypack With Compartments	172
15412	J World New York Vista Laptop Backpack Red	172
10515	Case Logic Griffith Park notebook carrying backpack	172
44518	"Dream Catcher Design Full-Body Protective Plastic Case for MacBook Pro 13""/15"" (Non-Retina)"	172
36274	"Rikki Knight ""Joyce"" Name - Cute Pink Owl on Branch with Personalized Name Design Lightning Series Gaming Mouse Pad (MPSQ-RK-28559)"	172
29268	"ALIENWARE AWVBP18 Vindicator Backpack 18"""	172
44518	"Realize Your Dreams Design Full-Body Protective Plastic Case for MacBook Pro 13""/15"" (Non-Retina)"	172
29268	Snoogg Movember Balloon Laptop Backpack Casual School Backpack	172
14442	Timbuk2 Swig Laptop Backpack	172
31718	"17"" Blue Notebook Backpack"	172
11272	Mobile Edge Alienware Orion ScanFast Checkpoint Friendly 17.3-Inch Backpack Color: Black	172
40726	"TARGE P3 15.4"" Laptop Backpack Black Fits up to 15.4-in Laptop Screens"	172
32405	Mobile Edge Select Backpack - notebook carrying backpack MEBPS7 -	172
6980	Ful Remix Laptop Backpack - Red	172
16816	Targus Xl Notebook Backpack	172
13299	Slappa Stovepipe 18-Inch Backpack for Laptop - Black/Red (SL-BP-STVP-1801)	172
15183	"Mobile Edge 17.3 Scanfast(Tm) Backpack ""Product Category: Notebook Accessories/Notebook Cases"""	172
23271	AirBac Professional Backpack - Black	172
8219	Campus Backpack High Quality School Backpacks Less Is More School Bags for Teenagers P1034	172
39074	"Flyshine Waterproof Outdoor Sports Travel Backpack Mountain Climbing Rucksack Knapsack 16"" Laptops Backpack With Laptop Compartment & Padded Shoulder Strap"	172
4482	Customized Kids School Bag Backpack Exquisite Workmanship	172
43042	Laptop Backpack Black	172
14442	Timbuk2 Uptown Laptop TSA-Friendly Backpack	172
25698	"pb travel Slim XL 17"" Backpack (Black)"	172
11272	"Mobile Edge Alienware Vindicator 17"" Backpack"	172
18014	"17"" Laptop Computer Backpack BLUE"	172
44518	"Palm Trees Design Full-Body Protective Plastic Case for MacBook Pro 13""/15"" (Non-Retina)"	172
18014	Fashion Special Beatles Shaped Design Zebral Stripes School Backpack Laptop Backpack	172
44518	"France Design Full-Body Protective Plastic Case for MacBook Pro 13""/15"" (Non-Retina)"	172
25161	Unique Vintage Korean style Unisex Casual Fashion School Travel Backpack Bags with Laptop Lining Red	172
6584	Manhattan Olympian Notebook Computer Sport Pack - Blue/Gray 439473	172
44518	"Purple Texture Design Full-Body Protective Plastic Case for MacBook Pro 13""/15"" (Non-Retina)"	172
5295	Archie Benson Outdoor Canvas Rucksack 15.6 inch Laptop Backpack with Padded Laptop Sleeve Travel College Bag for Work, Shopping, Traveling,Camping,Daily use	172
4229	Oflamn Women's Canvas Backpack Bag Pink	172
16155	S140 Sport Elite Tablet Backpack	172
43042	Sony VAIO S 13.3 Inch Laptop Hard Shell Nylon Backpack Check Point Friendly Bag with Multiple Compartments For VPC-SA2EGX/BI Color Pink - Black + Cleaning Kit + EnvyDeal Velcro Cable Tie	172
17347	Victorinox VX Sport Cadet Laptop Backpack - Black	172
8760	HotStyle Quality Linenette Style Unisex Fashion Casual School Travel Shoulder Backpack bag with laptop Compartment / 43cm*28cm*12cm	172
44518	"Pyramid Art Design Full-Body Protective Plastic Case for MacBook Pro 13""/15"" (Non-Retina)"	172
23271	"Targus - 1"" Laptop Backpack, File Compartment, Audio Player Sleeve, Black/Blue"	172
5037	Belkin Core Laptop Backpack Pitch Black/Soft Gray fits up to 15.6-Inch laptops	172
29268	Manhattan Portage Ken's Backpack	172
44518	"The Peacock Design Full-Body Protective Plastic Case for MacBook Pro 13""/15"" (Non-Retina)"	172
7921	Thule TCBP117PUR MacBook Pro Backpack For 17-Inch MacBook/Pro/Air - Purple	172
15443	Deercon Unisex Travel Satchel Shoulder Bag Laptop Backpack School Book Rucksack(Purple)	172
29268	Snoogg 15.6 Inch Nylon Laptop Backpack School Backpack Casual Daypack With Compartments	172
23271	UDG U9101BL/OR Digi Backpack - Black/Orange	172
29782	American Shield Travel Gear Travel School computer notebook Laptop teblet 15.6 inch Backpack.AGHE70-C3 Black	172
37123	Artone Leisure Lightweight Campus Backpack Candy Color School Bag With Laptop Compartment	172
3264	"** Pro Laptop Backpack, 17.3"", 12 1/2 x 7 1/2 x 18, Black"	172
30426	Creativebags Waterproof Laptop Backpacks School Notebook Rucksacks Women Girls Travel	172
29110	"DRF Men's Backpack Canvas Hiking Travel Bag Fit 15"" Laptop BG-34 (Black)"	172
23271	Targus 15.4'' Sport Backpack	172
29268	"17.3"" City Backpack Bag"	172
21625	"V7 CBP2-9N / Professional CBP2-9N Carrying Case Backpack for 17"" Notebook - Black"	172
25365	HP Business Backpack	172
43627	SUNROLAN Old School Canvas School Laptop Backpack For 14-15Inch Pc Macbook Pro Ipad	172
18644	Victorinox Architecture 3.0 - Big Ben Mono Retrax Wheeled Laptop Backpack with Monopole Backpack Bags - Black	172
9612	Brenthaven Collins Ultra-Padded Convertible Backpack for 15.4-Inch Macbooks, Laptops and Ultrabooks, Grey 1907101	172
34327	Who Will Hear Me Design Full-Body Protective Plastic Case for 11-inch/13-inch New MacBook Air	172
23035	"Fabrique WIB FWB14BKMIAMI Miami Carrying Case Backpack for 14.1"" Notebook - Twill Polyester"	172
3264	"** Pro Laptop Backpack, 17.3"", 12 1/2 x 7 1/2 x 18, Black"	172
10515	"16"" Black Checkpoint-Friendly Notebook Backpack"	172
15443	SWISSWIN SW9323 15-Inch Laptop Shoulder Backpack	172
29268	Everki EKP117NBKCT LAPTOP BACKPACK W/GAMING SLEEVE- TO 18	172
37923	Sony IT VAIO Convertible Backpack and Business Case - Grey VGP-AMK1A15/H	172
29547	"**17"" Spruce EcoSmart Backpack, 19 1/2 x 13 x 6 3/4, Black"	172
43042	Kroo Carbon Fiber Look Pink EVA Shell Backpack for Samsung Series 3 15 Inch Notebooks + VanGoddy LIVE*LAUGH*LOVE Wristband + Supertooth Disco Bluetooth Speaker	172
3264	"-- Active Laptop Backpack, 17.3"", 12 1/2 x 6 x 18 3/4, Black"	172
29268	Travelling Casual Mens Daily Backpack Laptop External Frame New Arrival Small Slim Daily Back Pack Laptop Hot Selling Fast Ship	172
30986	Ogio Ace Laptop Backpack Black	172
31718	"15.6"" Laptop & Tablet Backpack"	172
34327	Without Me Design Full-Body Protective Plastic Case for 11-inch/13-inch New MacBook Air	172
15831	Sinpaid Computer Laptop Book Backpack	172
39406	2014 Swiss Gear new style computer notebook Laptop teblet backpack.SA7038-C2-Purple	172
37923	"Lenovo Essential Carrying Case Backpack for 15.6"" Notebook 4X40E77329"	172
31718	"Olympia Campus 16"" Backpack"	172
17347	PELICAN OS1400-0003-150 Urban ProGear R S140 Sport Tablet Backpack Orange OS1400-0003-150	172
23271	Targus Rolling Notebook Backpack TSB700-DISC	172
10515	Allant ENERGY AL-1612-14F00 Carrying Case for 16' Notebook, iPad, Tablet PC - Gray, Black. ALLANT ENERGY 15.6IN SLIMCASE DOUBLE GUSSET CHECK POINT FRIENDLY NB-CAS. Polyester	172
29268	Kipling Seoul Backpack with Laptop Protection	172
18014	Brand New ful Free Fall'n - Orange Laptop Backpack NEW	172
14442	Timbuk2 Swig Laptop Backpack	172
9612	VanGoddy Bonni Collection Laptop Backpack for HP 13.3 to 15.6-inch Laptops + 16GB Memory Card + USB Mouse + Headphones (Aqua Blue)	172
14605	MZONEPLUS K0279 Backpack Bag	172
44518	"Water Colorful Vortex Design Full-Body Protective Plastic Case for MacBook Pro 13""/15"" (Non-Retina)"	172
21488	Fjallraven Rucksack No. 21 Medium Red OS -Kids	172
44518	"Oil Painting The Street Design Full-Body Protective Plastic Case for MacBook Pro 13""/15"" (Non-Retina)"	172
23271	Targus Rolling Notebook Backpack TSB700-DISC	172
37123	Artone MH Series Unisex-Adult Nylon Laptop Backpack	172
14442	Timbuk2 Moby Laptop Backpack	172
29268	Eastwear 15.6 In. Laptop Backpack	172
29268	Alienware 18-Inch Vindicator Backpack AWVBP18	172
17347	Pelican Products OU1400-0003-111 ProGear Elite Tablet Backpack for Tablets/Netbooks/iPads/Camera Black	172
37923	"eBuymore Business Laptop Backpack Case for 13.3'' 14'' 15.4'' 15.6"" Laptops - Inspiron, MacBook, Aspire, Satellite, ROG, Flip, Thinkpad, Envy, & Others (Royalblue)"	172
9612	"El Prado 3-in-1 Messenger + Backpack + Briefcase for 15-15.6"" Laptop- Inspiron, Satellite, MacBook, ThinkPad, Aspire, &Others"	172
15183	"Mobile Edge Meevo7 16"" Evo Backpack red Trim"	172
30986	OGIO International Tribune Laptop Backpack	172
29268	Snoogg 15.6 Inch Nylon Laptop Backpack School Backpack Casual Daypack With Compartments	172
44518	"City Design Full-Body Protective Plastic Case for MacBook Pro 13""/15"" Non-Retina"	172
10515	Case Logic BPCA-215ANTHRACITE Berkley Deluxe 15.6 inch Laptop + Tablet Backpack - Notebook carrying backpack - 15.6 inch - black - for Apple MacBook Pro 15.4 in	172
44518	"I Down You Design Full-Body Protective Plastic Case for MacBook Pro 13""/15"" (Non-Retina)"	172
41943	"ECO STYLE Luxe ELUX-BP14 Carrying Case Backpack for 16.1"" Notebook, Netbook, iPad - Orange, Blac -"	172
41819	True Back Burton Profanity Laptop Backpack - 1098cu in	172
1351	Business and Casual Travel Gear Scan smart computer notebook Laptop teblet 15 inch basketball sports outdoor Backpack.SA0576-C2	172
6584	"JanSport Coho Backpack - Black / 19""H x 13""W x 11.5""D"	172
15831	Sinpaid Computer Laptop Book Backpack	172
42503	"703116 - 18"" Mesh See-through Student Backpack - Black Case Pack 40"	172
34060	Cannondale Quick Backpack, Black	172
29268	Snoogg Digital Knowings Laptop Backpack Casual School Backpack	172
43042	Black Backpack for HP 15.4 inch Laptop - Worldwide	172
14442	Timbuk2 Parkside Laptop Backpack	172
32405	MOBILE EDGE premium notebook backpack black/charcoal - NEW - Retail - MEBPP1	172
14694	"Caseflex Acer Chromebook C720 Premium Protective 11.6"" Laptop Shoulder Bag Carry Case - Black"	172
29268	Snoogg 15.6 Inch Nylon Laptop Backpack School Backpack Casual Daypack With Compartments	172
10515	"Case Logic Griffith Park - Notebook carrying backpack - 15.6"" - black"	172
23444	Iblue 17 Inch Waterproof Multipurpose Backpack Laptop Travel Backpack Schoolbag #Tp499	172
44518	"Yin And Yang Fire Design Full-Body Protective Plastic Case for MacBook Pro 13""/15"" (Non-Retina)"	172
32862	CHADA Leather Cover Canvas Backpack for Laptop School Bag Sapphire	172
44518	"Statue Of Liberty Vintage Photography Design Full-Body Protective Plastic Case for MacBook Pro 13""/15"" (Non-Retina)"	172
11272	Rothco Vintage Canvas Mini Backpack - Black	172
29268	Timuk2 Showdown Laptop Backpack 2014	172
23271	Targus Rolling Notebook Backpack TSB700-DISC	172
23271	"Targus Tbb012us 16"" Zip-thru Air Traveler Backpack"	172
43042	Samsung RF511-S02 15.6 Inch Notebook Laptop CheckPoint Friendly Reinforced Hard Shell Backpack with Internal Nylon Compartment Pockets Color Black / Blue + NuVur  Keychain (NBAGCAB1)	172
14442	Timbuk2 Swig Laptop Backpack	172
44518	"Let go the Balloon Design Full-Body Protective Plastic Case for MacBook Pro 13""/15"" Non-Retina"	172
29268	Snoogg 15.6 Inch Nylon Laptop Backpack School Backpack Casual Daypack With Compartments	172
11272	Mobile Edge EVO Laptop Backpack - notebook carrying backpack MEEVO7 -	172
17347	Pelican PEL-U100-BK U100 Elite Laptop Backpack Black	172
43627	"eBuymore Business Laptop Backpack Case for 13.3'' 14'' 15.4'' 15.6"" ASUS / HP / Dell /Acer / Lenovo / Toshiba and Apple MacBook Pro with Retina display 15'' / Pro 15.4 Laptops (Black)"	172
10515	"CASE LOGIC VNB-217 17"" Notebook Backpack"	172
17444	Maxam Blue Black Gray Backpack Padded Adjustable Shoulder Straps Padded Back Practical	172
23271	Targus - tsb219us - brilliance ii laptop backpack	172
29268	Snoogg 15.6 Inch Nylon Laptop Backpack School Backpack Casual Daypack With Compartments	172
14442	Timbuk2 Jones Laptop Backpack	172
23271	"GIGABYTE B7 AORUS Backpack for 17"" Notebook Black/Orange"	172
10515	Case Logic VNB-217 Value 17-Inch Laptop Backpack Black	172
34667	Back to School Summer Sale! For students or professional use. Blue Candy Backpack Laptop Bag for 15.6 inch Sony...	172
23271	WMU - Targus Grove Notebook Backpack	172
18014	Auburn University Tigers Laptop Backpack Computer Bookbag	172
29268	Manhattan Portage Ken's Backpack	172
29268	Herschel Supply Co. Settlement Mid-Volume Laptop Backpack Green/Navy/Pink	172
15443	Deercon Women Travel Satchel Shoulder Bag Laptop Backpack School Book Rucksack(Black)	172
37320	Dakine Frankie Laptop Backpack	172
18014	Fashion Special Beatles Shaped Design School Backpack Laptop Backpack	172
24280	Baida Unisex Laptop Backpack with Ipad Sleeve	172
44518	"Vintage Daisies Photography Design Full-Body Protective Plastic Case for MacBook Pro 13""/15"" (Non-Retina)"	172
14442	Timbuk2 Candybar Laptop Backpack Black/Black/Black, Medium	172
1351	Business and Casual Travel Gear computer notebook Laptop Backpack.B7712-C2	172
44518	"Love Heart Design Full-Body Protective Plastic Case for MacBook Pro 13""/15"" (Non-Retina)"	172
18644	HEX Alliance Laptop Backpack (Convoy Black Stripe - HX1696-BKST)	172
29268	Snoogg 15.6 Inch Nylon Laptop Backpack School Backpack Casual Daypack With Compartments	172
15443	Deercon Unisex Canvas Travel Satchel Shoulder Bag Laptop Backpack School Book Rucksack(Red)	172
16816	Targus XL Notebook Backpack TXL617 - D20287	172
40608	"15"" Liebaowang Polyester Laptop School Travel Hiking Backpack"	172
21023	(20753 Tan & Navy Blue Stripes) Nila Anthony 2 Tone Faux Leather & Fabric Backpack Case for Asus Multimedia Entertainment N46 Series 14-inch Notebook	172
39074	Barsty Outdoor Hiking Climbing Backpack Travel Backpack Laptop Computer Backpack-Black	172
31718	"15.6"" Laptop Backpack"	172
44518	"Phone Booth And Falling Snow on The City Design Full-Body Protective Plastic Case for MacBook Pro 13""/15"" (Non-Retina)"	172
3291	Jiyaru Unisex Casual Lightweight Canvas Laptop Travel School Bag Backpack Rose	172
25832	Genuine Leather Canvas Casual Multipurpose Backpack Rucksack Laptop School Bag	172
18644	Laurex Laptop backpack - fits up to a 17.3 inches laptop Cherry Hummingbird .	172
14769	For U Designs Large Camouflage Animal Design College School Laptop Backpacks Students School Bags For Teenagers Men Women 5#	172
44518	"The World Pulse Design Full-Body Protective Plastic Case for MacBook Pro 13""/15"" (Non-Retina)"	172
18014	National Geographic Ng S5302 Day Pack Laptop Notebook Backpack Bag Expshp /Char	172
14694	"Caseflex Dell Chromebook 11 CB1C13 Premium Protective 11.6"" Laptop Shoulder Bag Carry Case - Black"	172
42503	"Targus Groove Carrying Case Backpack for 15.4"" Notebook - Black"	172
43042	Crown Micro Satchel Style Laptop Backpack - Fits Up To 15.6 Inch Laptops	172
10515	"BPCA-115 Carrying Case Backpack for 15.6"" Notebook, MacBook, Tablet"	172
1351	Business and Casual Travel Gear fashion computer notebook Laptop Daypack Backpack.B7702-C3	172
31718	SWISSGEAR ARISTA BACKPACK BLUE CASE FITS MOST 16IN LAPTOPS	172
29268	The Best LAPTOP BACKPACK W/GAMING SLEEVE- TO 18	172
2820	KENSINGTON TECHNOLOGY GROUP K62591AM BACKPACK BLACK FOR ULTRABOOK 14IN	172
43042	Kroo Carbon Fiber Look Blue EVA Shell Backpack for HP Pavillion DV6 and G6 Series 15 Inch Notebooks + VanGoddy LIVE*LAUGH*LOVE Wristband + Supertooth Disco Bluetooth Speaker	172
31718	"15.6"" Granite Notebook Backpack"	172
25832	Men Canvas Laptop Backpack	172
23271	Targus Rolling Notebook Backpack TSB700-DISC	172
17347	S100 Sport Elite Laptop Backpack	172
38256	Vivitar Coco Series Large Digital Camcorder / Video Padded Carrying Bag / Case For Panasonic HC-V100M, HC-V110, HC-V201, HC-V500M, HC-V520 & More... + eCost Microfiber Cloth	172
29268	Himalayan's School Hemp Backpack with Padded Laptop Sleeve. Fits Upto 14 Inch Laptop	172
5091	Caribee Sky Master Wheeled Backpack, Black, 80	172
4229	XXXX new men's and women's backpack, travel bag computer bag book student leisure canvas bag.	172
43042	Laptop Computer Accessories from VanGoddy Presents This Kroo Carbon Fiber Look Blue EVA Shell Backpack for Sony Vaio E Series 15 Inch Notebooks + VanGoddy LIVE*LAUGH*LOVE Wristband + 6 Foot HDMI Cable	172
22765	Gl100nl-F Glanor Rustic Vintage Leather Briefcase Backpack Laptop Bag	172
29268	Snoogg 15.6 Inch Nylon Laptop Backpack School Backpack Casual Daypack With Compartments	172
37923	"NEW Ogio Backpack 15.6"" (Bags & Carry Cases)"	172
29268	Ecogear Flash Laptop Backpack	172
10515	Case Logic RBP-117 17.3-Inch MacBook Pro/Laptop Backpack with iPad/Tablet Pocket Black	172
9612	VanGoddy Bonni Collection Laptop Backpack for Asus 13.3 to 15.6-inch Laptops (Wine)	172
14769	Creativebags Laptop Cases Rucksack Travel Backpacks for Men Women Teenagers 30-40L	172
15831	Vintage Pure Colour Schoolie Notebook Computer Book Bags Backpack Grey	172
34327	"Without Me Design Full-Body Protective Plastic Case for MacBook Pro 13""/15"" (Non-Retina)"	172
43627	SINPAID XHB-8 Unisex Waterproof Nylon Oxford Backpack Student School Bag Canvas Travel Rucksack Rose Red	172
15831	Sinpaid CS8 Computer Laptop Book Backpack Carrying Laptop Case Book Bag Small	172
44518	"Howard Fogg Railroad Painting Design Full-Body Protective Plastic Case for MacBook Pro 13""/15"" (Non-Retina)"	172
29268	AirPacks Ergonomic Backpack by Core	172
30986	OGIO International Rebel Laptop Backpack	172
19157	VanGoddy Universal Hybrid Design Backpack Bag with Padded Sleeve & Hand strap for Lenovo Thinkpad/ Edge E545/ E540 Fit 13.3 to 15.6 Inch Laptop/ Computer/ Ultrabook (Black Red)	172
6584	"Tamrac 1717 Superlights Computer Backpack 17 - For 17"" laptops (Brown/Tan)"	172
25832	"Vintage Canvas Schoolbag Laptop Backpack Rucksack Bookbag 15"" Laptop Backpack Black"	172
29268	Snoogg 15.6 Inch Nylon Laptop Backpack School Backpack Casual Daypack With Compartments	172
23444	Iblue 17 Inch Oxford Cloth College Laptop Backpack Multipurpose Daypacks #Hb-22	172
44518	"Vintage Purple Flower Design Full-Body Protective Plastic Case for MacBook Pro 13""/15"" (Non-Retina)"	172
29268	J World Ranser Laptop Backpack	172
19141	Laptop Backpack, Spigen® 13 inch Laptop Backpack [Klasden 2 Backpack] [Black] Laptop Bag fits up to 13 inch Laptop	172
44518	"Coconut Tree Design Full-Body Protective Plastic Case for MacBook Pro 13""/15"" (Non-Retina)"	172
9612	VanGoddy Bonni Collection Laptop Backpack for Samsung 13.3 to 15.6-inch Laptops (Aqua Blue)	172
23271	Targus Conquer Backpack Designed to Fit up to 16-Inch Laptops TSB214US Black/Gray	172
23271	Targus Terra Backpack Designed for 16-Inch Laptops - TSB226US Black/Red Accents	172
15443	Purple Travel School Rolling Backpack School Roller Bag Schoolbags K0737-2	172
37320	Dakine Frankie Laptop Backpack	172
16816	Hewlett Packard Targus Feren Backpack Removable Pouch 17 In Notebook Compatibility	172
31718	"Kensington Contour Computer Backpack for 16"" Laptops K62238B"	172
15443	Everest Classic Laptop Canvas Backpack Color: Olive	172
37551	SwissGear Laptop Computer Backpack SA6639 (Neon Yellow) Fits Most 15 Inch Laptops	172
11272	Mobile Edge Rev360 Rotating Case for Dell Latitude 10 (ME-DL10R360)	172
29268	Snoogg Redesign Laptop Backpack Casual School Backpack	172
11416	Xenon 2 Spinner Mobile Office, 13.5 x 8 x 16.5, Nylon, Black	172
29268	Snoogg 15.6 Inch Nylon Laptop Backpack School Backpack Casual Daypack With Compartments	172
30111	"Tucano Work_Out Backpack for MacBook Pro 15"""	172
11416	- Contour Laptop Backpack, Nylon, 15 3/4 x 9 x 19 1/2, Black -	172
23271	Sumdex Full Speed Armor II Backpack PON-375RD	172
10515	"HP Carrying Case Backpack for 15.6"" Notebook, Tablet PC H4J93AA"	172
29268	Snoogg 15.6 Inch Nylon Laptop Backpack School Backpack Casual Daypack With Compartments	172
34327	Music in the Fire Design Full-Body Protective Plastic Case for 11-inch/13-inch New MacBook Air	172
15183	"Mobile Edge Paris - Notebook carrying backpack - 16"" - black"	172
43042	Mountainsmith Explore Laptop Backpack Black	172
29268	Everest Sytlish Laptop Backpack	172
10515	"Wenger Fuse 16"" Laptop Backpack with Protective 10.1"" Tablet or eReader Pocket - Black"	172
43042	Toshiba Satellite L755-S5242 15.6 Inch Notebook Laptop CheckPoint Friendly Reinforced Hard Shell Backpack with Internal Nylon Compartment Pockets Color Black / Blue + NuVur  Keychain (NBAGCAB1)	172
13314	Case Logic SNB-15 15.4-Inch Canvas Lifestyle Backpack Gray	172
34327	"Wild Wolf Design Full-Body Protective Plastic Case for MacBook Pro 13""/15"" (Non-Retina)"	172
37320	Dakine 101 Laptop Backpack	172
40608	"15"" Force 1 Waterproof Polyester Laptop School Travel Hiking Backpack"	172
43042	15-Inch Laptop Backpack HP 2000t-2d00 Notebook PC - Taupe / Brown	172
9612	VanGoddy Bonni Collection Laptop Backpack for Toshiba 13.3 to 15.6-inch Laptops + USB Mouse + 4GB Thumbdrive + 7 Port USB Hub (Aqua Blue)	172
23271	"TARGUS revolution notebook backpack for 15.4"" TEB005US"	172
15443	"Classic Unisex High Density Washed Canvas 17"" Laptop Backpack-Black"	172
29268	CalPak Fox Laptop Backpack Navy/Black	172
23271	Adafruit 942 Pi Dish for Raspberry Pi - Includes Breadboard	172
42503	"Case Logic, Inc - Case Logic Griffith Park Bogb-115 Carrying Case Backpack For 15.6"" Notebook, Macbook, Ipad, Tablet - Black - Polyester ""Product Category: Accessories/Carrying Cases"""	172
23271	Targus Pewter Backpack for 16-Inch Laptops, Sage TSB77801US	172
29268	Snoogg 15.6 Inch Nylon Laptop Backpack School Backpack Casual Daypack With Compartments	172
23271	Targus Groove Backpack Case Designed for 17 Inch Laptops CVR617 (Black)	172
23271	Targus Groove Notebook Backpack CVR600	172
23271	"Targus - TSB239US - ""Drifter II 17"""" Laptop Backpack"""	172
18014	YIYINOE HOT New Brand Women and Men's Backpack 14 14.4 Inch Notebook Computer Laptop Backpack Bag Outdoor Travel Backpack School bag Blue	172
19682	BAGedge Commuter Backpack Bag	172
11272	"Mobile Edge Women's 16"" PC/17"" Mac Slimline Paris Backpack"	172
22063	Leatherbay Laptop Leather Backpack	172
23271	Targus Demolition Backpack Designed to Fit up to 17.3-Inch Laptop, Black TSB220US Color: Black	172
43042	Asus 15.6 Inch Notebook Laptop CheckPoint Friendly Reinforced Hard Shell Backpack with Internal Nylon Compartment Pockets , Fits models PRO B53S XH71, PRO P53E XH31, PRO P53E XH51 Color Black / Blue + NuVur  Keychain (NBAGCAB1)	172
